Sheet: Description
A1: COMP 5700/6700/6706 -- Software Process
A3: Assignment: | B3: CA02
A4: 5700/6700 due date: | B4: 2013-04-30T00:00:00.000 | C4: 1899-12-31T14:30:00.000 | E4: blackout begins at 6pm on | G4: =RC[-5]-4 -> 2013-04-26T00:00:00.000
A5: 6706 due date: | B5: =R[-1]C+7 -> 2013-05-07T00:00:00.000 | C5: =R[-1]C -> 1899-12-31T14:30:00.000 | E5: blackout begins at 6pm on | G5: =RC[-5]-4 -> 2013-05-03T00:00:00.000
A6: Name of deliverables: | B6: =CONCATENATE("username",R[-3]C,".xls") -> usernameCA02.xls | C6: username.zip
A8: Objective: | B8: To gain experience with TDD
A9: Assignment: | B9: Write software to read navigational sightings and to adjust those sightings based on atmospheric conditions.
A10: Deliverables: | B10: Via Canvas: | C10: Submit the following: | D10: 1) The URL of your GitHub account.
D11: 2) The URL of your AWL Lambda function
B12: Via GitHub: | C12: Push your code and your spreadsheet to GitHub.com
A13: Notes on Process: | B13: - Follow the process in the "Process" worksheet for this assignment.
B14: - This homework assignment is be accomplished individually
B15: - Ensure you follow the course coding and counting standards.
B16: - Be honest in your data. Your grade depends on how you follow the process and the quality of your work, not on the speed of your work or the number of defects found.
B17: - Below are clarifications for process worksheets that have been problematic in the past:
C18: Worksheet | D18: Special Instructions
C19: Plan | D19: Record estimated/actual LOC, nuber of components, and time of your primary deliverable(s). Do not include test code.
C20: Acceptance | D20: Develop acceptance tests for the specified black box. Do not include tests for items that are not part of the specifications (meaning, items over and above the specs -- these tests will appear in your individual unit test files). Write the expected results at planning time. Modify if necessary later. Don’t write actual results in advance.
C21: Time Log | D21: Use the "sandbox" activity to record time spent experimenting with the assignment requirements.
C22: Historical Data | D22: Record your process and product data from all previous programming assignments. Do this as part of the planning activity.
C23: Review | D23: During the planning activity, list a count of all defects that you've previously encountered. Construct a checklist from your defect logs. Indicate during the review activity the number of times the review checklist item found an error.
C24: Scenarios | D24: Create an interface specification depicting the interaction between a test driver and the class specified above. Create nominal scenario(s) and anomalous scenario(s) sufficient to convey your understanding of software behavior
C25: Lessons Learned | D25: This tab is optional. Use it to record great ideas, suggestions, etc.
C26: Architecture | D26: Develop CRC cards only for the production code needed to implement the specifications. Do not include CRC cards for test drivers.
C27: Estimate | D27: Record all the items from your architecture. Do not include test code.
C28: Iterations | D28: Record the number of iterations you plan to use, together with the planned velocity of each iteration. Record the amount of time you plan to have available each day of the project window. Please plan for more than one iteration.
A29: Special Instructions: | B29: - Selected cells in this spreadsheet are locked against inadvertent editing. Should you need to unlock the spreadsheet, select the protected worksheet, select Tools -> Protection -> unprotect.

Sheet: Process
A1: =Constants!RC -> Constants | B1: =Constants!RC ->  | C1: =Constants!RC ->  | D1: =Constants!RC ->  | E1: =Constants!RC[1] -> CA02
A2: =Constants!RC -> Start date: | B2: =Constants!RC -> 36526 | C2: =Constants!RC ->  | D2: =Constants!RC -> Grades: | E2: =Constants!RC[1] -> 1
A3: =Constants!RC -> End date: | B3: =Constants!RC -> 73051 | C3: =Constants!RC ->  | D3: =Constants!RC ->  | E3: =Constants!RC[1] -> 0.95
A4: =Constants!RC -> Phases: | B4: =Constants!RC -> Analysis | C4: =Constants!RC ->  | D4: =Constants!RC ->  | E4: =Constants!RC[1] -> 0.9
A5: =Constants!RC ->  | B5: =Constants!RC -> Architecture | C5: =Constants!RC ->  | D5: =Constants!RC ->  | E5: =Constants!RC[1] -> 0.85
A6: =Constants!RC ->  | B6: =Constants!RC -> Project planning | C6: =Constants!RC ->  | D6: =Constants!RC ->  | E6: =Constants!RC[1] -> 0.8
A7: =Constants!RC ->  | B7: =Constants!RC -> Interation planning | C7: =Constants!RC ->  | D7: =Constants!RC ->  | E7: =Constants!RC[1] -> 0.75
A8: =Constants!RC ->  | B8: =Constants!RC -> Construction | C8: =Constants!RC ->  | D8: =Constants!RC ->  | E8: =Constants!RC[1] -> 0.7
A9: =Constants!RC ->  | B9: =Constants!RC -> Refactoring | C9: =Constants!RC ->  | D9: =Constants!RC ->  | E9: =Constants!RC[1] -> 0.65
A10: =Constants!RC ->  | B10: =Constants!RC -> Review | C10: =Constants!RC ->  | D10: =Constants!RC ->  | E10: =Constants!RC[1] -> 0.5
A11: =Constants!RC ->  | B11: =Constants!RC -> Integration test | C11: =Constants!RC ->  | D11: =Constants!RC ->  | E11: =Constants!RC[1] -> 
A12: =Constants!RC ->  | B12: =Constants!RC -> Repatterning | C12: =Constants!RC ->  | D12: =Constants!RC ->  | E12: =Constants!RC[1] -> 
A13: =Constants!RC ->  | B13: =Constants!RC -> Postmortem | C13: =Constants!RC ->  | D13: =Constants!RC ->  | E13: =Constants!RC[1] -> 
A14: =Constants!RC ->  | B14: =Constants!RC -> Sandbox | C14: =Constants!RC ->  | D14: =Constants!RC ->  | E14: =Constants!RC[1] -> 
A15: =Constants!RC ->  | B15: =Constants!RC ->  | C15: =Constants!RC ->  | D15: =Constants!RC ->  | E15: =Constants!RC[1] -> 
A16: =Constants!RC ->  | B16: =Constants!RC ->  | C16: =Constants!RC ->  | D16: =Constants!RC ->  | E16: =Constants!RC[1] -> 
A17: =Constants!RC ->  | B17: =Constants!RC ->  | C17: =Constants!RC ->  | D17: =Constants!RC ->  | E17: =Constants!RC[1] -> 
A18: =Constants!RC ->  | B18: =Constants!RC ->  | C18: =Constants!RC ->  | D18: =Constants!RC ->  | E18: =Constants!RC[1] -> 
A19: =Constants!RC -> Defect Types: | B19: =Constants!RC -> Requirements Change | C19: =Constants!RC -> Changes to requirements | D19: =Constants!RC -> Iteration | E19: =Constants!RC[1] -> did not follow
A20: =Constants!RC ->  | B20: =Constants!RC -> Requirements Clarification | C20: =Constants!RC -> Clarifications to requirements | D20: =Constants!RC ->  | E20: =Constants!RC[1] -> very painful
A21: =Constants!RC ->  | B21: =Constants!RC -> Product syntax | C21: =Constants!RC -> Syntax flaws in the deliverable product | D21: =Constants!RC ->  | E21: =Constants!RC[1] -> painful
A22: =Constants!RC ->  | B22: =Constants!RC -> Product logic | C22: =Constants!RC -> Logic flaws in the deliverable product | D22: =Constants!RC ->  | E22: =Constants!RC[1] -> neutral
A23: =Constants!RC ->  | B23: =Constants!RC -> Product interface | C23: =Constants!RC -> Flaws in the interface of a component of the deliverable product | D23: =Constants!RC ->  | E23: =Constants!RC[1] -> helpful
A24: =Constants!RC ->  | B24: =Constants!RC -> Product checking | C24: =Constants!RC -> Flaws with boundary/type checking within a component of the deliverable product | D24: =Constants!RC ->  | E24: =Constants!RC[1] -> very helpful
A25: =Constants!RC ->  | B25: =Constants!RC -> Test syntax | C25: =Constants!RC -> Syntax flaws in the test code | D25: =Constants!RC ->  | E25: =Constants!RC[1] -> 
A26: =Constants!RC ->  | B26: =Constants!RC -> Test logic | C26: =Constants!RC -> Logic flaws in the test code | D26: =Constants!RC ->  | E26: =Constants!RC[1] -> 
A27: =Constants!RC ->  | B27: =Constants!RC -> Test interface | C27: =Constants!RC -> Flaws in the interface of a component of the test code | D27: =Constants!RC ->  | E27: =Constants!RC[1] -> 
A28: =Constants!RC ->  | B28: =Constants!RC -> Test checking | C28: =Constants!RC -> Flaws with boundary/type checking within a component of the test code | D28: =Constants!RC ->  | E28: =Constants!RC[1] -> 
A29: =Constants!RC ->  | B29: =Constants!RC -> Bad Smell | C29: =Constants!RC -> Refactoring changes (please note the bad smell in the defect description) | D29: =Constants!RC ->  | E29: =Constants!RC[1] -> 0
A30: =Constants!RC -> Y/N: | B30: =Constants!RC -> Yes | C30: =Constants!RC ->  | D30: =Constants!RC ->  | E30: =Constants!RC[1] -> 0
A31: =Constants!RC ->  | B31: =Constants!RC -> No | C31: =Constants!RC ->  | D31: =Constants!RC ->  | E31: =Constants!RC[1] -> 0
A32: =Constants!RC -> Proxy Types: | B32: =Constants!RC -> - | C32: =Constants!RC ->  | D32: =Constants!RC ->  | E32: =Constants!RC[1] -> 
A33: =Constants!RC ->  | B33: =Constants!RC -> Calculation | C33: =Constants!RC ->  | D33: =Constants!RC ->  | E33: =Constants!RC[1] -> 
A34: =Constants!RC ->  | B34: =Constants!RC -> Data | C34: =Constants!RC ->  | D34: =Constants!RC ->  | E34: =Constants!RC[1] -> 
A35: =Constants!RC ->  | B35: =Constants!RC -> I/O | C35: =Constants!RC ->  | D35: =Constants!RC ->  | E35: =Constants!RC[1] -> 
A36: =Constants!RC ->  | B36: =Constants!RC -> Logic | C36: =Constants!RC ->  | D36: =Constants!RC ->  | E36: =Constants!RC[1] -> 
A37: =Constants!RC ->  | B37: =Constants!RC ->  | C37: =Constants!RC ->  | D37: =Constants!RC ->  | E37: =Constants!RC[1] -> 
A38: =Constants!RC -> Sizes: | B38: =Constants!RC -> VS | C38: =Constants!RC -> S | D38: =Constants!RC -> M | E38: =Constants!RC[1] -> VL
A39: =Constants!RC -> upper | B39: =Constants!RC -> -1.5 | C39: =Constants!RC -> -0.5 | D39: =Constants!RC -> 0.5 | E39: =Constants!RC[1] -> 99999
A40: =Constants!RC -> mid | B40: =Constants!RC -> -2 | C40: =Constants!RC -> -1 | D40: =Constants!RC -> 0 | E40: =Constants!RC[1] -> 2
A41: =Constants!RC -> lower | B41: =Constants!RC -> 0 | C41: =Constants!RC -> -1.5 | D41: =Constants!RC -> -0.5 | E41: =Constants!RC[1] -> 1.5
A42: =Constants!RC ->  | B42: =Constants!RC -> 0 | C42: =Constants!RC -> 0 | D42: =Constants!RC -> 0 | E42: =Constants!RC[1] -> 
A43: =Constants!RC ->  | B43: =Constants!RC ->  | C43: =Constants!RC ->  | D43: =Constants!RC ->  | E43: =Constants!RC[1] -> 
A44: =Constants!RC -> <-- Mandatory | B44: =Constants!RC ->  | C44: =Constants!RC -> ✔ | D44: =Constants!RC ->  | E44: =Constants!RC[1] -> 
A45: Process Script
A47: Minimal Guiding Indicators | E47: Minimal Sufficient Activities
B48: Goal | C48: Indicator | F48: Engineering Activities
B49: Cost: | C49: None | F49: Envision
B50: Schedule: | C50: On time | F50: Analyze
B51: Performance: | F51: Synthesize
B52: Product: | F52: Architecture
B53: NFR: | C53: None | F53: Articulate
B54: FR: | C54: Equivalence Class Partitioning | F54: Construct
B55: Process: | C55: Completed spreadsheet | F55: Interpret
F56: Integration Test
F57: Operational Activities
F58: Plan
F59: Plan project
F60: Monitor/Control
F61: Post Mortem
F62: Release
A64: Minimal Viable Process | E64: Minimal Effective Practices
E65: MSA | F65: MEP | H65: Spreadsheet tab on which to document MEP:
E66: Plan Project | F66: • Transfer process information from the previous assignment | H66: Historical Data
F67: • Write as many acceptance tests as you feel are necessary to understand the assignment | H67: Acceptance
F68: • Guess projected LOC and number of components (classes) | H68: Plan
F69: • Guess projected effort (in minutes) | H69: Plan
E70: Construction | F70: • Copy lambda_function.py and template dispatch.py to your prod folder
F71: • repeat
F72: • • select/write a test case and run it as a red light test
F73: • • while the test is not red
F74: • • • diagnose why the test was not red
F75: • • • if the problem was due to incorrect test code
F76: • • • • fix the defect and log it in the change log | H76: Change Log
F77: • • • else
F78: • • • • continue to the next red light test
F79: • • • build enough production code to make the test pass
F80: • • • run the test as a green light test
F81: • • • while the test is not green
F82: • • • • fix the defect and log it in the change log | H82: Change Log
F83: • • • • run the test as a green light test
F84: • • • clean up the code as appropriate
F85: • until test coverage is sufficient and all tests pass
F86: • Commit all code to git.
E87: Review | F87: • Perform rubber duck review of test code
E88: Post Mortem | F88: • Record acceptance test results | H88: Acceptance
F89: • Count production LOC | H89: Plan
F90: • Count components | H90: Plan
E91: Release | F91: • Commit all code to git.
F92: • Push to GitHub.com
F93: • Deploy code to AWS Lambda
F94: • Upload completed spreadsheet to Github
E97: Monitor | F97: • Record time spent in each activity. | H97: Time Log
F98: • Record defects, changes to requirements. | H98: Change Log
A108: Minimal Guiding Indicators
A109: Cost: | C109: -
A110: Schedule: | C110: Submitted on time
A111: Performance:
B112: Product:
B113: NFR: | C113: Meets delivery requirements.
B114: FR: | C114: Boundary Value Analysis
B115: Process: | C115: Evident on spreadsheet

Sheet:  Customer Needs
A1: Conversation with the customer:
A2: Client clarification:
A3: The production code must contain, at a minimum, the components listed below:
A4: lambda_handler … provided to you and will not need modification
A5: dispatch … provided to you as a partially-completed function
A6: You are free to implement additional classes and methods.
A8: Client Clarification 2:
A9: Method interfaces should be constructed so that parameters can be specified by position (where possible) or name.
A11: Specifications
A12: Background: | B12: We are developing a set of microservices that derives geographic position from star sighting information. Each microservice receives its input as a Python dictionary represented by a URL-encoded string and outputs its result as UTF-8 string of a Python dictionary. This assignment has you to write a function that adjusts celestial sightings based on the circumstances of how the sighting was made.
A13: Functional Specifications: | B13: def dispatch
C14: Abstraction: | D14: dispatch performs a specific navigational calculation based on information it receives via its parameters.
B15: method | D15: description
B16: dispatch | D16: dispatch(values)
D17: Performs the navigational calculation specified by the "op" dictionary element passed as a parameter.
D18: Parameters: | E18: values is a dictionary of one or more key-value pairs. Mandatory. Arrives unvalidated.
D19: Desired behavior (normal): | E19: Performs the calculation named by the 'op' dictionary key. Returns a dictionary containing the results. Calculations are:
E20: Operation Name | F20: Operation Description
E21: {'op':'adjust'} | F21: Adjusts observed angle to compensate for sighting circumstances.
E22: {'op':'predict'} | F22: Predicts the angle at which the celestial body should be observed.
E23: {'op':'correct'} | F23: Finds the difference between the observed and expected angle
E24: {'op':'locate'} | F24: Determines geo position based on triangulation of multiple sightings
E25: A description of each operation is given in the "operation" section below.
D26: Desired behavior (errors): | E26: If: | F26: • values violates the parameter description above, or
F27: • values does not contain 'op' as a key
E28: Action: | F28: Add to values a dictionary element having 'error' as the key and a diagnostic string as its value. Return values.
E29: Exit conditions: | F29: No further processing takes place once an error is discovered.
D30: State change: | E30: No state is retained or changed.
D31: General examples: | E31: Valid values
E32: Input: | F32: {'op': 'predict'}
E33: Returns: | F33: A dictionary containing the results of the "predict" calculation
E34: Input: | F34: {'observation': '15d04.9', 'height': '6.0', 'pressure': '1010', 'horizon': 'artificial', 'op': 'adjust', 'temperature': '72'}
E35: Returns: | F35: A dictionary containing the results of the "adjust" calculation
E36: Invalid values
E37: Input: | F37: {}
E38: Returns: | F38: {'error':'no op is specified'}
E39: Input: | F39: {'observation': '15d04.9', 'height': '6.0', 'pressure': '1010', 'horizon': 'artificial', 'temperature': '72' 'error':'no op is specified'}
E40: Returns: | F40: {'observation': '15d04.9', 'height': '6.0', 'pressure': '1010', 'horizon': 'artificial', 'temperature': '72'}
E41: Input: | F41: 42
E42: Returns: | F42: {'error':'parameter is not a dictionary'}
E43: Input: | F43: {'op': 'unknown'}
E44: Returns: | F44: {'error':'op is not a legal operation'}
E45: Input:
E46: Returns: | F46: {'error':'dictionary is missing'}
B47: operation | D47: description
B48: {'op': 'adjust'}
D49: Adjusts the celestial sighting according to amospheric conditions
D50: Relevant dictionary elements: | E50: observation | F50: Angle of the sighting relative to a reference point. This angle is referred to as the "observed altitude". It is a mandatory string in the form xdy.y where
F51: x is the degree portion of the altitude. It is a postive integer .GE. 0 and .LT. 90
F52: d is the character "d" and used to separate degrees from minutes
F53: y.y is the minute portion of the altitude. It is a positive floating point value with one digit to the right of the decimal point and is in the range .GE. 0.0 and .LT. 60.0.
E54: height | F54: Height (in feet) at which the observation was made. It is a string of a numeric value .GE. 0. Optional, deaults to '0' if missing.
E55: temperature | F55: Temperature (in degrees F) at the time of the observation. It is a string of an integer in the range .GE. -20 and .LE. 120. Optional, defaults to '72' if missing.
E56: pressure | F56: Barometric pressure (in mbar) at the time of the observation. It is a string of an integer in the range .GE. 100 and .LE. 1100. Optional, defaults to '1010' if missing.
E57: horizon | F57: What the observed altitude is relative to. It is one of the following case-insensitive strings: "artificial" or "natural". Optional, defaults to "natural" if missing.
E58: Dictionary elements not specified above are ignored.
D59: Desired behavior (normal): | E59: Adjust the observation as follows:
E60: • if the observation is relative to a natural horizon
E61: •• dip = ( -0.97 * sqrt( height ) ) / 60
E62: • else
E63: •• dip = 0
E64: • refraction=(-0.00452*pressure) / (273+convert_to_celsius(temperature))/tangent(altitude)
E65: • altitude = observation + dip + refraction
E66: • round altitude to the nearest 0.1 arc-minute
E67: • convert alltitude to a string having the format xdyy.y, where
E68: x is the degree portion of the altitude, represented as a string of an integer .GT. -90 and .LT. 90 with no leading zeroes.
E69: d is the character "d" and used to separate degrees from minutes
E70: y.y is the minute portion of the altitude, represented as a string of a positive floating point value in the range .GE. 0.0 and .LT. 60.0, formatted with two digits to the left of the decimal point and one digit to the right.
E71: • add the string to the input dictionary using a key named "altitude".
D72: Desired behavior (errors): | E72: If: | F72: • 'altitude' already exists in the input dictionary, or
F73: • any dictionary element violates the description above, or
F74: • 'observation' is .LT. 0d0.1
E75: Action: | F75: wD
E76: Exit conditions: | F76: No further processing takes place once an error is discovered.
D77: Calculation-specific examples: | E77: Valid values
E78: Input: | F78: {'observation': '30d1.5', 'height': '19.0', 'pressure': '1000', 'horizon': 'artificial', 'op': 'adjust', 'temperature': '85'}
E79: Returns: | F79: {'altitude':'29d59.9', 'observation': '30d1.5', 'height': '19.0', 'pressure': '1000', 'horizon': 'artificial', 'op': 'adjust', 'temperature': '85'}
E80: Input: | F80: {'observation': '45d15.2', 'height': '6', 'pressure': '1010', 'horizon': 'natural', 'op': 'adjust', 'temperature': '71'}
E81: Returns: | F81: {'altitude':'45d11.9', 'observation': '30d1.5', 'height': '19.0', 'pressure': '1000', 'horizon': 'artificial', 'op': 'adjust', 'temperature': '85'}
E82: Input: | F82: {'observation': '42d0.0', 'op': 'adjust'}
E83: Returns: | F83: {'altitude':'41d59.0', 'observation': '42d0.0', 'op': 'adjust'}
E84: Input: | F84: {'observation': '42d0.0', 'op': 'adjust', 'extraKey':'ignore'}
E85: Returns: | F85: {'altitude':'41d59.0', 'observation': '42d0.0', 'op': 'adjust', 'extraKey':'ignore'}
E86: Invalid values
E87: Input: | F87: {'op': 'adjust'}
E88: Returns: | F88: {'error':'mandatory information is missing'}
E89: Input: | F89: {'observation': '101d15.2', 'height': '6', 'pressure': '1010', 'horizon': 'natural', 'op': 'adjust', 'temperature': '71'}
E90: Returns: | F90: {'observation': '101d15.2', 'height': '6', 'pressure': '1010', 'horizon': 'natural', 'op': 'adjust', 'temperature': '71', 'error':'observation is invalid'}
E91: Input: | F91: {'observation': '45d15.2', 'height': 'a', 'pressure': '1010', 'horizon': 'natural', 'op': 'adjust', 'temperature': '71'}
E92: Returns: | F92: {'observation': '45d15.2', 'height': 'a', 'pressure': '1010', 'horizon': 'natural', 'op': 'adjust', 'temperature': '71', 'error':'height is invalid'}
E93: Input: | F93: {'observation': '45d15.2', 'height': '6', 'horizon': ' ', 'pressure': '1010', 'op': 'adjust', 'temperature': '71'}
E94: Returns: | F94: {'observation': '45d15.2', 'height': '6', 'horizon': ' ', 'pressure': '1010', 'op': 'adjust', 'temperature': '71', 'error':'horizon is invalid'}
B95: {'op': 'predict'}
D96: Predicts the angle at which the celestial body should be observed.
D97: Desired behavior (normal): | E97: Stubbed: does not change values.
B98: {'op': 'correct'}
D99: Finds the difference between the observed and expected angle
D100: Desired behavior (normal): | E100: Stubbed: does not change values.
B101: {'op': 'locate'}
D102: Determines geo position based on triangulation of multiple sightings
D103: Desired behavior (normal): | E103: Stubbed: does not change values.
A105: Specification by Example
A106: The following is an example of how your customer plans to use the code:
A108: Code
A109: import dispatch as dispatch
A110: sighting = {'op':'adjust', 'observation':'015d04.9', 'height':'6.0', 'temperature':'72','pressure':'1010', 'horizon':'artificial'}
A111: result = dispatch.dispatch(sighting)
A113: AWL Lambda
A114: https://2kr26wpool.execute-api.us-east-1.amazonaws.com/prod/navigate/?op=adjust&observation=015d04.9&height=6.0&temperature=72&pressure=1010&horizon=artificial
A164: Specifications
A165: Background: | B165: We are developing a set of microservices that derives geographic position from star sighting information. Each microservice receives its input in a URL-encoded string and outputs a result as a UTF-8 string. This assignment has you to write a function that adjusts celestial sightings based on the circumstances of how the sighting was made.
A166: Functional Requirements: | B166: def dispatch
C167: Abstraction: | D167: dispatch calls other functions based on the information it receives via its parameters. True to its name, it examines what operation should be performed, dispatches information to that operation, and passes the result back to its calling component in a predefined format.
B168: method | D168: description
B169: dispatch | D169: dispatch(values)
D170: Dispatches information to the function named by the "op" dictionary element.
D171: Parameters: | E171: values is a dictionary of one or more key-value pairs. Mandatory. Arrives unvalidated.
D172: Desired behavior (normal): | E172: Calls the function named by the 'op' dictionary key. Passes values to the function. Receives a dictionary containing the function's result. Returns the dictionary as its result.
D173: Desired behavior (errors): | E173: Action: | F173: Return a Python dictionary consisting solely of the a single element: the 'error' key set to a diagnostic string (see client clarification for content requirements).
E174: Occurs when: | F174: • values violates the parameter description above, or
F175: • values has zero entries, or
F176: • values does not contain the "op" as a key
E177: Exit conditions: | F177: No further processing takes place once an error is discovered.
D178: State change: | E178: No state is retained or changed.
D179: Examples: | E179: Valid values
E180: Input: | F180: {'op': 'navigate'}
E181: Processing: | F181: {'op': 'navigate'} is passed to a function named "navigate"
E182: Output: | F182: whatever dictionary is returned from the "navigate" function
E183: Input: | F183: {'observation': '015d04.9', 'height': '6.0', 'pressure': '1010', 'horizon': 'artificial', 'op': 'adjust', 'temperature': '72'}
E184: Processing: | F184: {'observation': '015d04.9', 'height': '6.0', 'pressure': '1010', 'horizon': 'artificial', 'op': 'adjust', 'temperature': '72'} is passed to a function named "adjust"
E185: Output: | F185: whatever dictionary is returned from the "adjust" function
E186: Invalid values
E187: Input: | F187: {}
E188: Output: | F188: {'error':'dispatch.dispatch: empty dictionary is illegal'}
E189: Input: | F189: {'observation': '015d04.9', 'height': '6.0', 'pressure': '1010', 'horizon': 'artificial', 'temperature': '72'}
E190: Output: | F190: {'error':'dispatch.dispatch: no op specified'}
E191: Input: | F191: 42
E192: Output: | F192: {'error':'dispatch.dispatch: parameter is not a dictionary'}
E193: Input:
E194: Output: | F194: {'error':'dispatch.dispatch: parameter is missing'}
A197: Specification by Example
A198: The following is an example of how your customer plans to use the code:
A200: import softwareprocess.convertString2Dictionary as cs2d
A201: import urllib
A203: # convert human-readable key=value to percent-encoded string
A204: inputValue = urllib.quote("key=value")
A205: # convert percent-encoded string to dictionary
A206: outputValue = cs2d.convertString2Dictionary(inputString = inputValue)
A207: # iterate through keys, print key and corresponding value
A208: for key in outputValue.keys():
A209: print('key={0}, value={1}'.format(key, outputValue[key]))

Sheet: Spec Notes
A1: Specification Notes

Sheet: Assessment
A1: =Constants!RC -> Constants | B1: =Constants!RC ->  | C1: =Constants!RC ->  | D1: =Constants!RC ->  | E1: =Constants!RC ->  | F1: =Constants!RC -> CA02
A2: =Constants!RC -> Start date: | B2: =Constants!RC -> 36526 | C2: =Constants!RC ->  | D2: =Constants!RC -> Grades: | E2: =Constants!RC -> AA | F2: =Constants!RC -> 1
A3: =Constants!RC -> End date: | B3: =Constants!RC -> 73051 | C3: =Constants!RC ->  | D3: =Constants!RC ->  | E3: =Constants!RC -> A | F3: =Constants!RC -> 0.95
A4: =Constants!RC -> Phases: | B4: =Constants!RC -> Analysis | C4: =Constants!RC ->  | D4: =Constants!RC ->  | E4: =Constants!RC -> AB | F4: =Constants!RC -> 0.9
A5: =Constants!RC ->  | B5: =Constants!RC -> Architecture | C5: =Constants!RC ->  | D5: =Constants!RC ->  | E5: =Constants!RC -> B | F5: =Constants!RC -> 0.85
A6: =Constants!RC ->  | B6: =Constants!RC -> Project planning | C6: =Constants!RC ->  | D6: =Constants!RC ->  | E6: =Constants!RC -> BC | F6: =Constants!RC -> 0.8
A7: =Constants!RC ->  | B7: =Constants!RC -> Interation planning | C7: =Constants!RC ->  | D7: =Constants!RC ->  | E7: =Constants!RC -> C | F7: =Constants!RC -> 0.75
A8: =Constants!RC ->  | B8: =Constants!RC -> Construction | C8: =Constants!RC ->  | D8: =Constants!RC ->  | E8: =Constants!RC -> CD | F8: =Constants!RC -> 0.7
A9: =Constants!RC ->  | B9: =Constants!RC -> Refactoring | C9: =Constants!RC ->  | D9: =Constants!RC ->  | E9: =Constants!RC -> D | F9: =Constants!RC -> 0.65
A10: =Constants!RC ->  | B10: =Constants!RC -> Review | C10: =Constants!RC ->  | D10: =Constants!RC ->  | E10: =Constants!RC -> F | F10: =Constants!RC -> 0.5
A11: =Constants!RC ->  | B11: =Constants!RC -> Integration test | C11: =Constants!RC ->  | D11: =Constants!RC ->  | E11: =Constants!RC ->  | F11: =Constants!RC -> 
A12: =Constants!RC ->  | B12: =Constants!RC -> Repatterning | C12: =Constants!RC ->  | D12: =Constants!RC ->  | E12: =Constants!RC ->  | F12: =Constants!RC -> 
A13: =Constants!RC ->  | B13: =Constants!RC -> Postmortem | C13: =Constants!RC ->  | D13: =Constants!RC ->  | E13: =Constants!RC ->  | F13: =Constants!RC -> 
A14: =Constants!RC ->  | B14: =Constants!RC -> Sandbox | C14: =Constants!RC ->  | D14: =Constants!RC ->  | E14: =Constants!RC ->  | F14: =Constants!RC -> 
A15: =Constants!RC ->  | B15: =Constants!RC ->  | C15: =Constants!RC ->  | D15: =Constants!RC ->  | E15: =Constants!RC ->  | F15: =Constants!RC -> 
A16: =Constants!RC ->  | B16: =Constants!RC ->  | C16: =Constants!RC ->  | D16: =Constants!RC ->  | E16: =Constants!RC ->  | F16: =Constants!RC -> 
A17: =Constants!RC ->  | B17: =Constants!RC ->  | C17: =Constants!RC ->  | D17: =Constants!RC ->  | E17: =Constants!RC ->  | F17: =Constants!RC -> 
A18: =Constants!RC ->  | B18: =Constants!RC ->  | C18: =Constants!RC ->  | D18: =Constants!RC ->  | E18: =Constants!RC ->  | F18: =Constants!RC -> 
A19: =Constants!RC -> Defect Types: | B19: =Constants!RC -> Requirements Change | C19: =Constants!RC -> Changes to requirements | D19: =Constants!RC -> Iteration | E19: =Constants!RC -> NA | F19: =Constants!RC -> did not follow
A20: =Constants!RC ->  | B20: =Constants!RC -> Requirements Clarification | C20: =Constants!RC -> Clarifications to requirements | D20: =Constants!RC ->  | E20: =Constants!RC -> 1 | F20: =Constants!RC -> very painful
A21: =Constants!RC ->  | B21: =Constants!RC -> Product syntax | C21: =Constants!RC -> Syntax flaws in the deliverable product | D21: =Constants!RC ->  | E21: =Constants!RC -> 2 | F21: =Constants!RC -> painful
A22: =Constants!RC ->  | B22: =Constants!RC -> Product logic | C22: =Constants!RC -> Logic flaws in the deliverable product | D22: =Constants!RC ->  | E22: =Constants!RC -> 3 | F22: =Constants!RC -> neutral
A23: =Constants!RC ->  | B23: =Constants!RC -> Product interface | C23: =Constants!RC -> Flaws in the interface of a component of the deliverable product | D23: =Constants!RC ->  | E23: =Constants!RC -> 4 | F23: =Constants!RC -> helpful
A24: =Constants!RC ->  | B24: =Constants!RC -> Product checking | C24: =Constants!RC -> Flaws with boundary/type checking within a component of the deliverable product | D24: =Constants!RC ->  | E24: =Constants!RC -> 5 | F24: =Constants!RC -> very helpful
A25: =Constants!RC ->  | B25: =Constants!RC -> Test syntax | C25: =Constants!RC -> Syntax flaws in the test code | D25: =Constants!RC ->  | E25: =Constants!RC -> 6 | F25: =Constants!RC -> 
A26: =Constants!RC ->  | B26: =Constants!RC -> Test logic | C26: =Constants!RC -> Logic flaws in the test code | D26: =Constants!RC ->  | E26: =Constants!RC -> 7 | F26: =Constants!RC -> 
A27: =Constants!RC ->  | B27: =Constants!RC -> Test interface | C27: =Constants!RC -> Flaws in the interface of a component of the test code | D27: =Constants!RC ->  | E27: =Constants!RC -> 8 | F27: =Constants!RC -> 
A28: =Constants!RC ->  | B28: =Constants!RC -> Test checking | C28: =Constants!RC -> Flaws with boundary/type checking within a component of the test code | D28: =Constants!RC ->  | E28: =Constants!RC -> 9 | F28: =Constants!RC -> 
A29: =Constants!RC ->  | B29: =Constants!RC -> Bad Smell | C29: =Constants!RC -> Refactoring changes (please note the bad smell in the defect description) | D29: =Constants!RC ->  | E29: =Constants!RC -> 10 | F29: =Constants!RC -> 0
A30: =Constants!RC -> Y/N: | B30: =Constants!RC -> Yes | C30: =Constants!RC ->  | D30: =Constants!RC ->  | E30: =Constants!RC -> Passed | F30: =Constants!RC -> 0
A31: =Constants!RC ->  | B31: =Constants!RC -> No | C31: =Constants!RC ->  | D31: =Constants!RC ->  | E31: =Constants!RC -> Passed with issues | F31: =Constants!RC -> 0
A32: =Constants!RC -> Proxy Types: | B32: =Constants!RC -> - | C32: =Constants!RC ->  | D32: =Constants!RC ->  | E32: =Constants!RC -> Failed | F32: =Constants!RC -> 
A33: =Constants!RC ->  | B33: =Constants!RC -> Calculation | C33: =Constants!RC ->  | D33: =Constants!RC ->  | E33: =Constants!RC -> Not tested | F33: =Constants!RC -> 
A34: =Constants!RC ->  | B34: =Constants!RC -> Data | C34: =Constants!RC ->  | D34: =Constants!RC ->  | E34: =Constants!RC -> Not applicable | F34: =Constants!RC -> 
A35: =Constants!RC ->  | B35: =Constants!RC -> I/O | C35: =Constants!RC ->  | D35: =Constants!RC ->  | E35: =Constants!RC ->  | F35: =Constants!RC -> 
A36: =Constants!RC ->  | B36: =Constants!RC -> Logic | C36: =Constants!RC ->  | D36: =Constants!RC ->  | E36: =Constants!RC ->  | F36: =Constants!RC -> 
A37: =Constants!RC ->  | B37: =Constants!RC ->  | C37: =Constants!RC ->  | D37: =Constants!RC ->  | E37: =Constants!RC ->  | F37: =Constants!RC -> 
A38: =Constants!RC -> Sizes: | B38: =Constants!RC -> VS | C38: =Constants!RC -> S | D38: =Constants!RC -> M | E38: =Constants!RC -> L | F38: =Constants!RC -> VL
A39: =Constants!RC -> upper | B39: =Constants!RC -> -1.5 | C39: =Constants!RC -> -0.5 | D39: =Constants!RC -> 0.5 | E39: =Constants!RC -> 1.5 | F39: =Constants!RC -> 99999
A40: =Constants!RC -> mid | B40: =Constants!RC -> -2 | C40: =Constants!RC -> -1 | D40: =Constants!RC -> 0 | E40: =Constants!RC -> 1 | F40: =Constants!RC -> 2
A41: =Constants!RC -> lower | B41: =Constants!RC -> 0 | C41: =Constants!RC -> -1.5 | D41: =Constants!RC -> -0.5 | E41: =Constants!RC -> 0.5 | F41: =Constants!RC -> 1.5
A42: =Constants!RC ->  | B42: =Constants!RC -> 0 | C42: =Constants!RC -> 0 | D42: =Constants!RC -> 0 | E42: =Constants!RC -> 0 | F42: =Constants!RC -> 
A43: =Constants!RC ->  | B43: =Constants!RC ->  | C43: =Constants!RC ->  | D43: =Constants!RC ->  | E43: =Constants!RC ->  | F43: =Constants!RC -> 
A44: =Constants!RC -> <-- Mandatory | B44: =Constants!RC ->  | C44: =Constants!RC -> ✔ | D44: =Constants!RC ->  | E44: =Constants!RC ->  | F44: =Constants!RC -> 
A46: Assessment Worksheet
A48: Name: | C48: Zeru Zhang
A49: User name: | C49: zzz0054
A50: GitHub account name | C50: msqiqi
A51: AWL Lambda URL
A53: Instructor Assessment
A56: Product Assessment
A57: Process Assessment:
A58: Score: | B58: =IF(OR(ISBLANK(R[-2]C),ISBLANK(R[-1]C)),"",VLOOKUP(R[-2]C,R[4]C:R[12]C[1],2,FALSE)+VLOOKUP(R[-1]C,R[14]C:R[22]C[1],2,FALSE)) ->  | C58: out of | D58: 100
A61: Grading rubric: Product Aspect
B62: =R[-60]C[3] -> AA | C62: =R58C4/2*R[-60]C[3] -> 50 | D62: Exceptional job worthy of being used as an example of superior work
B63: =R[-60]C[3] -> A | C63: =R58C4/2*R[-60]C[3] -> 47.5 | D63: Product passes all major tests, fails >0% and <10% of minor tests
B64: =R[-60]C[3] -> AB | C64: =R58C4/2*R[-60]C[3] -> 45 | D64: Product passes all major tests, fails >=10% and <25% of minor tests
B65: =R[-60]C[3] -> B | C65: =R58C4/2*R[-60]C[3] -> 42.5 | D65: Product passes all major tests, fails >=25% of minor tests
B66: =R[-60]C[3] -> BC | C66: =R58C4/2*R[-60]C[3] -> 40 | D66: Product fails >0% and <10% of major tests
B67: =R[-60]C[3] -> C | C67: =R58C4/2*R[-60]C[3] -> 37.5 | D67: Product fails >=10% and <25% of major tests
B68: =R[-60]C[3] -> CD | C68: =R58C4/2*R[-60]C[3] -> 35 | D68: Product fails >=25% of major tests
B69: =R[-60]C[3] -> D | C69: =R58C4/2*R[-60]C[3] -> 32.5 | D69: Product must be modified to run.
B70: =R[-60]C[3] -> F | C70: =R58C4/2*R[-60]C[3] -> 25 | D70: Product shows lack of comprehension of concepts, or is incomplete
A71: Grading rubic: Process Aspect
B72: =R[-70]C[3] -> AA | C72: =R58C4/2*R[-70]C[3] -> 50 | D72: Exceptional job worthy of being used as an example of superior work
B73: =R[-70]C[3] -> A | C73: =R58C4/2*R[-70]C[3] -> 47.5 | D73: Process has insignificant exceptions
B74: =R[-70]C[3] -> AB | C74: =R58C4/2*R[-70]C[3] -> 45 | D74: Process has multiple minor exceptions
B75: =R[-70]C[3] -> B | C75: =R58C4/2*R[-70]C[3] -> 42.5 | D75: Process has exceptions that obsure activity verification
B76: =R[-70]C[3] -> BC | C76: =R58C4/2*R[-70]C[3] -> 40 | D76: Process has exceptions with historical data that affect the current project
B77: =R[-70]C[3] -> C | C77: =R58C4/2*R[-70]C[3] -> 37.5 | D77: Process has exceptions that suggest lack of comprehension of concepts
B78: =R[-70]C[3] -> CD | C78: =R58C4/2*R[-70]C[3] -> 35 | D78: Process has exceptions that bring into question the validity of the data
B79: =R[-70]C[3] -> D | C79: =R58C4/2*R[-70]C[3] -> 32.5 | D79: Process has exceptions suggesting it wasn't followed.
B80: =R[-70]C[3] -> F | C80: =R58C4/2*R[-70]C[3] -> 25 | D80: Deliverables are incomplete
A83: Quality checks
A84: General
B85: Are all regions highlighted in yellow appropriately complete?
B86: Does the workbook reflect a faithful record of information?
B87: Has this assignment been uploaded as specified by the assignment description?
A88: Project Plan Summary
B89: Was the planned information determined before development and not altered after development?
B90: Is planned time expressed in minutes?
B91: Do LOC counts address production code (and exclude test code)?
B92: Is the actual line count calculated according to the counting standard?
A93: Time Recording Log
B94: Does the log reflect a faithful record of time spent?
B95: Do no times span midnight?
B96: Does the log reflect the activities in the specified process?
B97: Is post mortem the final phase?
B98: Does the time recording log reflect the your lifecycle?
A99: Change Log
B100: Is each change accompanied by a description in the "comment" field?
B101: Are changes recorded against the appropriate phase in which they were injected and removed?
B102: Does the "removed" count equal the "injected" count? If not, is the rational documented in the "lessons learned" tab?
B103: Are the dates and times in the change log consistent with the dates and times in the time recording log?
A104: Acceptance
B105: Were initial "expected results" determined before coding began?
B106: Are the expected results sufficiently detailed for an independent party to test the software?
B107: Are the expected results correct?
B108: Do actual results support expected results?
B109: Do actual results marked as "Passed with issues" include a comment?
A110: Source Code
B111: Does the code reflect the coding standard?
B112: Will the code compile without change?
B113: Does the code contain no unspecified packages?
B114: Does the code take into consideration specified error conditions?
B115: Does the code fulfill the assignment requirements?
B116: Does the code follow the prescribed directory format (i.e., prod, test, sandbox)?
A117: Historical Data
B118: Is the historical data complete?
B119: Have previously noted problems in process measurements been corrected?
A120: Deliverables
B121: Has the spreadsheet been uploaded to GitHub
B122: Has all the code been pushed to GitHub?
B123: Is the test code in a "test" folder?
B124: Will the test code work without modification?
B125: Is the project file in the proper format with the required name?
B126: Does your git respository reflect commits at the specified process points?
B127: Has the code been deployed?
A128: Review
B129: Did you construct your review checklist during the planning phase?
B130: Does the error count indicated the analysis of defects match your historical defect count?
B131: Are checklist items answerable in "yes" or "no" terms?
B132: Does your checklist reflect at least two common items from your defect log ?
B133: Does your checklist contain more than "mom and apple pie" items?
A134: Refactor
B135: Is code free of the following bad smells: duplicate code, long methods, long classes
B136: temporary variables, useless comments, coding standard violations?
A137: Scenario
B138: Were the scenarios constructed during the analysis phase (and not changed later)?
B139: Does each scenario describe as fully as possible the interaction with the software under construction?
B140: Are the actors correctly identified?
B141: Are suitably understandable examples given?
B142: Are events and responses directly observable?
A143: Architecture
B144: Was the architecture determined before construction (and not changed later)?
B145: Does the architecture reflect a solid initial understanding of the solution?
B146: Does the architecture show all components required for the solution (with the exception of system built-in components)?
B147: Are collaborators specified correctly?
B148: Do functionally-decomposed components have only one operation? Has the operation been given the component name?
B149: Are component operations given names to suggest their behavior?
B150: Does the architecture exhibit "good" design characteristics, such as appropriate levels of coupling, cohesion, etc.?
A151: Estimate
B152: Does each component denoted by a CRC card appear in the estimate as either base code, new components, or reused code?
B153: Is base code vs reuse code identified correctly?
B154: Do the base components and the new comopnents reflect the architecture?
B155: Are the base components and new components sized according to historical proxies?
B156: Is a rationale provided if either the LOCp and/or Ep are overridden?
B157: Is actual LOC data recorded at post mortem time?
A158: Iterations
B159: Is more than one iteration planned?
B160: Does the WBS list all iterations?
B161: Is the overall estimate of time in the WBS consistent with the calculated effort?
B162: Are the planned completion dates of iterations in the WBS consistent with the calendar?
B163: Are planned times recorded from the start of the calendar through the end of the project?
B164: Does the calendar corroborate the WBS, and visa versa?
A165: Construction
B166: Did you follow the design -> red light-> write producton code -> green light -> clean up (if necessary) -> repeat pattern?
B167: Are all unit tests written so that passing the test satisifies requirements?
B168: Is there at least one test case for each component?
B169: Is there at least one test suite which, when run, exercises the entire production code base?
B170: Does your code pass all test cases?

Sheet: Historical Data
A1: =Constants!RC -> Constants | B1: =Constants!RC ->  | C1: =Constants!RC ->  | D1: =Constants!RC ->  | E1: =Constants!RC ->  | F1: =Constants!RC -> CA02
A2: =Constants!RC -> Start date: | B2: =Constants!RC -> 36526 | C2: =Constants!RC ->  | D2: =Constants!RC -> Grades: | E2: =Constants!RC -> AA | F2: =Constants!RC -> 1
A3: =Constants!RC -> End date: | B3: =Constants!RC -> 73051 | C3: =Constants!RC ->  | D3: =Constants!RC ->  | E3: =Constants!RC -> A | F3: =Constants!RC -> 0.95
A4: =Constants!RC -> Phases: | B4: =Constants!RC -> Analysis | C4: =Constants!RC ->  | D4: =Constants!RC ->  | E4: =Constants!RC -> AB | F4: =Constants!RC -> 0.9
A5: =Constants!RC ->  | B5: =Constants!RC -> Architecture | C5: =Constants!RC ->  | D5: =Constants!RC ->  | E5: =Constants!RC -> B | F5: =Constants!RC -> 0.85
A6: =Constants!RC ->  | B6: =Constants!RC -> Project planning | C6: =Constants!RC ->  | D6: =Constants!RC ->  | E6: =Constants!RC -> BC | F6: =Constants!RC -> 0.8
A7: =Constants!RC ->  | B7: =Constants!RC -> Interation planning | C7: =Constants!RC ->  | D7: =Constants!RC ->  | E7: =Constants!RC -> C | F7: =Constants!RC -> 0.75
A8: =Constants!RC ->  | B8: =Constants!RC -> Construction | C8: =Constants!RC ->  | D8: =Constants!RC ->  | E8: =Constants!RC -> CD | F8: =Constants!RC -> 0.7
A9: =Constants!RC ->  | B9: =Constants!RC -> Refactoring | C9: =Constants!RC ->  | D9: =Constants!RC ->  | E9: =Constants!RC -> D | F9: =Constants!RC -> 0.65
A10: =Constants!RC ->  | B10: =Constants!RC -> Review | C10: =Constants!RC ->  | D10: =Constants!RC ->  | E10: =Constants!RC -> F | F10: =Constants!RC -> 0.5
A11: =Constants!RC ->  | B11: =Constants!RC -> Integration test | C11: =Constants!RC ->  | D11: =Constants!RC ->  | E11: =Constants!RC ->  | F11: =Constants!RC -> 
A12: =Constants!RC ->  | B12: =Constants!RC -> Repatterning | C12: =Constants!RC ->  | D12: =Constants!RC ->  | E12: =Constants!RC ->  | F12: =Constants!RC -> 
A13: =Constants!RC ->  | B13: =Constants!RC -> Postmortem | C13: =Constants!RC ->  | D13: =Constants!RC ->  | E13: =Constants!RC ->  | F13: =Constants!RC -> 
A14: =Constants!RC ->  | B14: =Constants!RC -> Sandbox | C14: =Constants!RC ->  | D14: =Constants!RC ->  | E14: =Constants!RC ->  | F14: =Constants!RC -> 
A15: =Constants!RC ->  | B15: =Constants!RC ->  | C15: =Constants!RC ->  | D15: =Constants!RC ->  | E15: =Constants!RC ->  | F15: =Constants!RC -> 
A16: =Constants!RC ->  | B16: =Constants!RC ->  | C16: =Constants!RC ->  | D16: =Constants!RC ->  | E16: =Constants!RC ->  | F16: =Constants!RC -> 
A17: =Constants!RC ->  | B17: =Constants!RC ->  | C17: =Constants!RC ->  | D17: =Constants!RC ->  | E17: =Constants!RC ->  | F17: =Constants!RC -> 
A18: =Constants!RC ->  | B18: =Constants!RC ->  | C18: =Constants!RC ->  | D18: =Constants!RC ->  | E18: =Constants!RC ->  | F18: =Constants!RC -> 
A19: =Constants!RC -> Defect Types: | B19: =Constants!RC -> Requirements Change | C19: =Constants!RC -> Changes to requirements | D19: =Constants!RC -> Iteration | E19: =Constants!RC -> NA | F19: =Constants!RC -> did not follow
A20: =Constants!RC ->  | B20: =Constants!RC -> Requirements Clarification | C20: =Constants!RC -> Clarifications to requirements | D20: =Constants!RC ->  | E20: =Constants!RC -> 1 | F20: =Constants!RC -> very painful
A21: =Constants!RC ->  | B21: =Constants!RC -> Product syntax | C21: =Constants!RC -> Syntax flaws in the deliverable product | D21: =Constants!RC ->  | E21: =Constants!RC -> 2 | F21: =Constants!RC -> painful
A22: =Constants!RC ->  | B22: =Constants!RC -> Product logic | C22: =Constants!RC -> Logic flaws in the deliverable product | D22: =Constants!RC ->  | E22: =Constants!RC -> 3 | F22: =Constants!RC -> neutral
A23: =Constants!RC ->  | B23: =Constants!RC -> Product interface | C23: =Constants!RC -> Flaws in the interface of a component of the deliverable product | D23: =Constants!RC ->  | E23: =Constants!RC -> 4 | F23: =Constants!RC -> helpful
A24: =Constants!RC ->  | B24: =Constants!RC -> Product checking | C24: =Constants!RC -> Flaws with boundary/type checking within a component of the deliverable product | D24: =Constants!RC ->  | E24: =Constants!RC -> 5 | F24: =Constants!RC -> very helpful
A25: =Constants!RC ->  | B25: =Constants!RC -> Test syntax | C25: =Constants!RC -> Syntax flaws in the test code | D25: =Constants!RC ->  | E25: =Constants!RC -> 6 | F25: =Constants!RC -> 
A26: =Constants!RC ->  | B26: =Constants!RC -> Test logic | C26: =Constants!RC -> Logic flaws in the test code | D26: =Constants!RC ->  | E26: =Constants!RC -> 7 | F26: =Constants!RC -> 
A27: =Constants!RC ->  | B27: =Constants!RC -> Test interface | C27: =Constants!RC -> Flaws in the interface of a component of the test code | D27: =Constants!RC ->  | E27: =Constants!RC -> 8 | F27: =Constants!RC -> 
A28: =Constants!RC ->  | B28: =Constants!RC -> Test checking | C28: =Constants!RC -> Flaws with boundary/type checking within a component of the test code | D28: =Constants!RC ->  | E28: =Constants!RC -> 9 | F28: =Constants!RC -> 
A29: =Constants!RC ->  | B29: =Constants!RC -> Bad Smell | C29: =Constants!RC -> Refactoring changes (please note the bad smell in the defect description) | D29: =Constants!RC ->  | E29: =Constants!RC -> 10 | F29: =Constants!RC -> 0
A30: =Constants!RC -> Y/N: | B30: =Constants!RC -> Yes | C30: =Constants!RC ->  | D30: =Constants!RC ->  | E30: =Constants!RC -> Passed | F30: =Constants!RC -> 0
A31: =Constants!RC ->  | B31: =Constants!RC -> No | C31: =Constants!RC ->  | D31: =Constants!RC ->  | E31: =Constants!RC -> Passed with issues | F31: =Constants!RC -> 0
A32: =Constants!RC -> Proxy Types: | B32: - | C32: =Constants!RC ->  | D32: =Constants!RC ->  | E32: =Constants!RC -> Failed | F32: =Constants!RC -> 
A33: =Constants!RC ->  | B33: =Constants!RC -> Calculation | C33: =Constants!RC ->  | D33: =Constants!RC ->  | E33: =Constants!RC -> Not tested | F33: =Constants!RC -> 
A34: =Constants!RC ->  | B34: =Constants!RC -> Data | C34: =Constants!RC ->  | D34: =Constants!RC ->  | E34: =Constants!RC -> Not applicable | F34: =Constants!RC -> 
A35: =Constants!RC ->  | B35: =Constants!RC -> I/O | C35: =Constants!RC ->  | D35: =Constants!RC ->  | E35: =Constants!RC ->  | F35: =Constants!RC -> 
A36: =Constants!RC ->  | B36: =Constants!RC -> Logic | C36: =Constants!RC ->  | D36: =Constants!RC ->  | E36: =Constants!RC ->  | F36: =Constants!RC -> 
A37: =Constants!RC ->  | B37: =Constants!RC ->  | C37: =Constants!RC ->  | D37: =Constants!RC ->  | E37: =Constants!RC ->  | F37: =Constants!RC -> 
A38: =Constants!RC -> Sizes: | B38: =Constants!RC -> VS | C38: =Constants!RC -> S | D38: =Constants!RC -> M | E38: =Constants!RC -> L | F38: =Constants!RC -> VL
A39: =Constants!RC -> upper | B39: =Constants!RC -> -1.5 | C39: =Constants!RC -> -0.5 | D39: =Constants!RC -> 0.5 | E39: =Constants!RC -> 1.5 | F39: =Constants!RC -> 99999
A40: =Constants!RC -> mid | B40: =Constants!RC -> -2 | C40: =Constants!RC -> -1 | D40: =Constants!RC -> 0 | E40: =Constants!RC -> 1 | F40: =Constants!RC -> 2
A41: =Constants!RC -> lower | B41: =Constants!RC -> 0 | C41: =Constants!RC -> -1.5 | D41: =Constants!RC -> -0.5 | E41: =Constants!RC -> 0.5 | F41: =Constants!RC -> 1.5
A42: =Constants!RC ->  | B42: =Constants!RC -> 0 | C42: =Constants!RC -> 0 | D42: =Constants!RC -> 0 | E42: =Constants!RC -> 0 | F42: =Constants!RC -> 
A43: =Constants!RC ->  | B43: =Constants!RC ->  | C43: =Constants!RC ->  | D43: =Constants!RC ->  | E43: =Constants!RC ->  | F43: =Constants!RC -> 
A45: Historical Data
A47: Current Assignment: | C47: 201720Assignment4
A48: Immediate Past Assignment: | C48: 201720Assignment2
A50: Project Plan Summary From | D50: =R[-2]C[-1] -> 201720Assignment2
A51: Program Size (LOC) | C51: Plan | D51: Actual | E51: Actual to Date
A52: Base code LOC count
A53: Lines deleted from Base
A54: Lines modified from Base
A55: Lines added to Base
A56: Reused lines
A57: New component lines of code | D57: 103
A59: Component Count | C59: Plan | D59: Actual | E59: Actual to Date
A60: Base components | E60: 0
A61: Modified components | E61: 0
A62: New components
A64: Time In Phase (minutes) | C64: Plan | D64: Actual | E64: Actual To Date | F64: Actual to Date %
A65: =R[-61]C[1] -> Analysis | D65: 30 | E65: 0 | F65: 0
A66: =R[-61]C[1] -> Architecture | D66: 10 | E66: 0 | F66: 0
A67: =R[-61]C[1] -> Project planning | D67: 10 | E67: 0 | F67: 0
A68: =R[-61]C[1] -> Interation planning | D68: 15 | E68: 0 | F68: 0
A69: =R[-61]C[1] -> Construction | D69: 220 | E69: 0 | F69: 0
A70: =R[-61]C[1] -> Refactoring | D70: 0 | E70: 0 | F70: 0
A71: =R[-61]C[1] -> Review | D71: 30 | E71: 0 | F71: 0
A72: =R[-61]C[1] -> Integration test | D72: 0 | E72: 0 | F72: 0
A73: =R[-61]C[1] -> Repatterning | D73: 0 | E73: 0 | F73: 0
A74: =R[-61]C[1] -> Postmortem | D74: 0 | E74: 0 | F74: 0
A75: =R[-61]C[1] -> Sandbox | D75: 0 | E75: 0 | F75: 0
A76: TOTAL | C76: 0 | D76: 0 | E76: =SUM(R[-11]C:R[-1]C) -> 0 | F76: 0
A78: Changes traced to | E78: Actual to Date | F78: Actual to Date %
A79: =R[-75]C[1] -> Analysis | E79: 0 | F79: =IF(RC[-1]=0,0,RC[-1]/R90C5) -> 0
A80: =R[-75]C[1] -> Architecture | E80: 0 | F80: =IF(RC[-1]=0,0,RC[-1]/R90C5) -> 0
A81: =R[-75]C[1] -> Project planning | E81: 0 | F81: =IF(RC[-1]=0,0,RC[-1]/R90C5) -> 0
A82: =R[-75]C[1] -> Interation planning | E82: 0 | F82: =IF(RC[-1]=0,0,RC[-1]/R90C5) -> 0
A83: =R[-75]C[1] -> Construction | E83: 0 | F83: =IF(RC[-1]=0,0,RC[-1]/R90C5) -> 0
A84: =R[-75]C[1] -> Refactoring | E84: 0 | F84: =IF(RC[-1]=0,0,RC[-1]/R90C5) -> 0
A85: =R[-75]C[1] -> Review | E85: 0 | F85: =IF(RC[-1]=0,0,RC[-1]/R90C5) -> 0
A86: =R[-75]C[1] -> Integration test | E86: 0 | F86: =IF(RC[-1]=0,0,RC[-1]/R90C5) -> 0
A87: =R[-75]C[1] -> Repatterning | E87: 0 | F87: =IF(RC[-1]=0,0,RC[-1]/R90C5) -> 0
A88: =R[-75]C[1] -> Postmortem | E88: 0 | F88: =IF(RC[-1]=0,0,RC[-1]/R90C5) -> 0
A89: =R[-75]C[1] -> Sandbox | E89: 0 | F89: =IF(RC[-1]=0,0,RC[-1]/R90C5) -> 0
A90: TOTAL | E90: =SUM(R[-11]C:R[-1]C) -> 0 | F90: =IF(RC[-1]=0,0,RC[-1]/R90C5) -> 0
A92: Changes implemented in | E92: Actual to Date | F92: Actual to Date %
A93: =R[-89]C[1] -> Analysis | E93: 0 | F93: =IF(RC[-1]=0,0,RC[-1]/R104C5) -> 0
A94: =R[-89]C[1] -> Architecture | E94: 0 | F94: =IF(RC[-1]=0,0,RC[-1]/R104C5) -> 0
A95: =R[-89]C[1] -> Project planning | E95: 0 | F95: =IF(RC[-1]=0,0,RC[-1]/R104C5) -> 0
A96: =R[-89]C[1] -> Interation planning | E96: 0 | F96: =IF(RC[-1]=0,0,RC[-1]/R104C5) -> 0
A97: =R[-89]C[1] -> Construction | E97: 0 | F97: =IF(RC[-1]=0,0,RC[-1]/R104C5) -> 0
A98: =R[-89]C[1] -> Refactoring | E98: 0 | F98: =IF(RC[-1]=0,0,RC[-1]/R104C5) -> 0
A99: =R[-89]C[1] -> Review | E99: 0 | F99: =IF(RC[-1]=0,0,RC[-1]/R104C5) -> 0
A100: =R[-89]C[1] -> Integration test | E100: 0 | F100: =IF(RC[-1]=0,0,RC[-1]/R104C5) -> 0
A101: =R[-89]C[1] -> Repatterning | E101: 0 | F101: =IF(RC[-1]=0,0,RC[-1]/R104C5) -> 0
A102: =R[-89]C[1] -> Postmortem | E102: 0 | F102: =IF(RC[-1]=0,0,RC[-1]/R104C5) -> 0
A103: =R[-89]C[1] -> Sandbox | E103: 0 | F103: =IF(RC[-1]=0,0,RC[-1]/R104C5) -> 0
A104: TOTAL | E104: =SUM(R[-11]C:R[-1]C) -> 0 | F104: =IF(RC[-1]=0,0,RC[-1]/R104C5) -> 0
A106: Size Matrix (LOC/Method)
B107: =R[-69]C -> VS | C107: =R[-69]C -> S | D107: =R[-69]C -> M | E107: =R[-69]C -> L | F107: =R[-69]C -> VL
A108: Upper | B108: =CEILING(EXP(R157C8+R158C8*R[-69]C),1) -> 37 | C108: =CEILING(EXP(R157C8+R158C8*R[-69]C),1) -> 37 | D108: =CEILING(EXP(R157C8+R158C8*R[-69]C),1) -> 37 | E108: =CEILING(EXP(R157C8+R158C8*R[-69]C),1) -> 37 | F108: big
A109: Mid | B109: =CEILING(EXP(R157C8+R158C8*R[-69]C),1) -> 37 | C109: =CEILING(EXP(R157C8+R158C8*R[-69]C),1) -> 37 | D109: =CEILING(EXP(R157C8+R158C8*R[-69]C),1) -> 37 | E109: =CEILING(EXP(R157C8+R158C8*R[-69]C),1) -> 37 | F109: =CEILING(EXP(R157C8+R158C8*R[-69]C),1) -> 37
A110: Lower | B110: 0 | C110: =CEILING(EXP(R157C8+R158C8*R[-69]C),1) -> 37 | D110: =CEILING(EXP(R157C8+R158C8*R[-69]C),1) -> 37 | E110: =CEILING(EXP(R157C8+R158C8*R[-69]C),1) -> 37 | F110: =CEILING(EXP(R157C8+R158C8*R[-69]C),1) -> 37
B111: =R[-4]C -> VS | C111: =R[-4]C -> S | D111: =R[-4]C -> M | E111: =R[-4]C -> L | F111: =R[-4]C -> VL
A113: Project History
B114: New and Changed LOC | E114: Effort
A115: Project Name | B115: Raw LOC | C115: Planned LOC | D115: Actual LOC | E115: Estimated Time | F115: Actual Time | G115: LOCa/LOCr | H115: Ea/LOCa
A116: 1.xls | B116: =RC[1] -> 0 | G116: =IF(ISERR(RC[-3]/RC[-5]),0,RC[-3]/RC[-5]) -> 0 | H116: =IF(ISERR(RC[-2]/RC[-4]),0,RC[-2]/RC[-4]) -> 0
A117: CA02 | B117: =RC[1] -> 0 | G117: =IF(ISERR(RC[-3]/RC[-5]),0,RC[-3]/RC[-5]) -> 0 | H117: =IF(ISERR(RC[-2]/RC[-4]),0,RC[-2]/RC[-4]) -> 0
A118: 3.xls | G118: =IF(ISERR(RC[-3]/RC[-5]),0,RC[-3]/RC[-5]) -> 0 | H118: =IF(ISERR(RC[-2]/RC[-4]),0,RC[-2]/RC[-4]) -> 0
A119: CA04 | B119: =RC[1] -> 0 | G119: =IF(ISERR(RC[-3]/RC[-5]),0,RC[-3]/RC[-5]) -> 0 | H119: =IF(ISERR(RC[-2]/RC[-4]),0,RC[-2]/RC[-4]) -> 0
A120: CA05 | C120: =R[-63]C -> 0 | D120: =R[-63]C -> 103 | E120: =R[-44]C[-2] -> 0 | F120: =R[-44]C[-2] -> 0 | G120: =IF(ISERR(RC[-3]/RC[-5]),0,RC[-3]/RC[-5]) -> 0 | H120: =IF(ISERR(RC[-2]/RC[-4]),0,RC[-2]/RC[-4]) -> 0 | I120: =IF(ISERR(RC[-3]/RC[-6]),"",RC[-3]/RC[-6]) -> 
A122: Project Trends
A123: Productivity= | B123: =IF(ISERR(SUM(R[-7]C[2]:R[-3]C[2])/SUM(R[-7]C[4]:R[-3]C[4])),"",SUM(R[-7]C[2]:R[-5]C[2])/SUM(R[-7]C[4]:R[-5]C[4])*60) ->  | C123: LOC/hr
A124: Average size= | B124: =IF(ISERR(ROUNDUP(EXP(AVERAGE(R[4]C[6]:R[32]C[6])),0)),"",ROUNDUP(EXP(AVERAGE(R[4]C[6]:R[32]C[6])),0)) -> 37 | C124: LOC/method
A126: Component History
A127: Component Name | C127: Total LOC | D127: Method Count | E127: Type | F127: Size | G127: LOC/method | H127: ln(LOC/meth)
A128: convertString2Dictionary | C128: 37 | D128: 1 | E128: Calculation | F128: =IF(R48C3>5,IF(RC[1]="","-",HLOOKUP(RC[1],R110C2:R111C6,2)),IF(ISBLANK(RC[-5]),"-","M")) -> VL | G128: =IF(OR(ISBLANK(RC[-4]),ISBLANK(RC[-3])),"",CEILING(RC[-4]/RC[-3],1)) -> 37 | H128: =IF(OR(ISBLANK(RC[-5]),ISBLANK(RC[-4])),"",LN(RC[-1])) -> 3.6109179126442243
A129: dispatch | C129: 103 | E129: Calculation | F129: =IF(R48C3>5,IF(RC[1]="","-",HLOOKUP(RC[1],R110C2:R111C6,2)),IF(ISBLANK(RC[-5]),"-","M")) -> - | G129: =IF(OR(ISBLANK(RC[-4]),ISBLANK(RC[-3])),"",CEILING(RC[-4]/RC[-3],1)) ->  | H129: =IF(OR(ISBLANK(RC[-5]),ISBLANK(RC[-4])),"",LN(RC[-1])) -> 
E130: - | F130: =IF(R48C3>5,IF(RC[1]="","-",HLOOKUP(RC[1],R110C2:R111C6,2)),IF(ISBLANK(RC[-5]),"-","M")) -> - | G130: =IF(OR(ISBLANK(RC[-4]),ISBLANK(RC[-3])),"",CEILING(RC[-4]/RC[-3],1)) ->  | H130: =IF(OR(ISBLANK(RC[-5]),ISBLANK(RC[-4])),"",LN(RC[-1])) ->  | L130: `
E131: - | F131: =IF(R48C3>5,IF(RC[1]="","-",HLOOKUP(RC[1],R110C2:R111C6,2)),IF(ISBLANK(RC[-5]),"-","M")) -> - | G131: =IF(OR(ISBLANK(RC[-4]),ISBLANK(RC[-3])),"",CEILING(RC[-4]/RC[-3],1)) ->  | H131: =IF(OR(ISBLANK(RC[-5]),ISBLANK(RC[-4])),"",LN(RC[-1])) -> 
E132: - | F132: =IF(R48C3>5,IF(RC[1]="","-",HLOOKUP(RC[1],R110C2:R111C6,2)),IF(ISBLANK(RC[-5]),"-","M")) -> - | G132: =IF(OR(ISBLANK(RC[-4]),ISBLANK(RC[-3])),"",CEILING(RC[-4]/RC[-3],1)) ->  | H132: =IF(OR(ISBLANK(RC[-5]),ISBLANK(RC[-4])),"",LN(RC[-1])) -> 
E133: - | F133: =IF(R48C3>5,IF(RC[1]="","-",HLOOKUP(RC[1],R110C2:R111C6,2)),IF(ISBLANK(RC[-5]),"-","M")) -> - | G133: =IF(OR(ISBLANK(RC[-4]),ISBLANK(RC[-3])),"",CEILING(RC[-4]/RC[-3],1)) ->  | H133: =IF(OR(ISBLANK(RC[-5]),ISBLANK(RC[-4])),"",LN(RC[-1])) -> 
E134: - | F134: =IF(R48C3>5,IF(RC[1]="","-",HLOOKUP(RC[1],R110C2:R111C6,2)),IF(ISBLANK(RC[-5]),"-","M")) -> - | G134: =IF(OR(ISBLANK(RC[-4]),ISBLANK(RC[-3])),"",CEILING(RC[-4]/RC[-3],1)) ->  | H134: =IF(OR(ISBLANK(RC[-5]),ISBLANK(RC[-4])),"",LN(RC[-1])) -> 
E135: - | F135: =IF(R48C3>5,IF(RC[1]="","-",HLOOKUP(RC[1],R110C2:R111C6,2)),IF(ISBLANK(RC[-5]),"-","M")) -> - | G135: =IF(OR(ISBLANK(RC[-4]),ISBLANK(RC[-3])),"",CEILING(RC[-4]/RC[-3],1)) ->  | H135: =IF(OR(ISBLANK(RC[-5]),ISBLANK(RC[-4])),"",LN(RC[-1])) -> 
E136: - | F136: =IF(R48C3>5,IF(RC[1]="","-",HLOOKUP(RC[1],R110C2:R111C6,2)),IF(ISBLANK(RC[-5]),"-","M")) -> - | G136: =IF(OR(ISBLANK(RC[-4]),ISBLANK(RC[-3])),"",CEILING(RC[-4]/RC[-3],1)) ->  | H136: =IF(OR(ISBLANK(RC[-5]),ISBLANK(RC[-4])),"",LN(RC[-1])) -> 
E137: - | F137: =IF(R48C3>5,IF(RC[1]="","-",HLOOKUP(RC[1],R110C2:R111C6,2)),IF(ISBLANK(RC[-5]),"-","M")) -> - | G137: =IF(OR(ISBLANK(RC[-4]),ISBLANK(RC[-3])),"",CEILING(RC[-4]/RC[-3],1)) ->  | H137: =IF(OR(ISBLANK(RC[-5]),ISBLANK(RC[-4])),"",LN(RC[-1])) -> 
E138: - | F138: =IF(R48C3>5,IF(RC[1]="","-",HLOOKUP(RC[1],R110C2:R111C6,2)),IF(ISBLANK(RC[-5]),"-","M")) -> - | G138: =IF(OR(ISBLANK(RC[-4]),ISBLANK(RC[-3])),"",CEILING(RC[-4]/RC[-3],1)) ->  | H138: =IF(OR(ISBLANK(RC[-5]),ISBLANK(RC[-4])),"",LN(RC[-1])) -> 
E139: - | F139: =IF(R48C3>5,IF(RC[1]="","-",HLOOKUP(RC[1],R110C2:R111C6,2)),IF(ISBLANK(RC[-5]),"-","M")) -> - | G139: =IF(OR(ISBLANK(RC[-4]),ISBLANK(RC[-3])),"",CEILING(RC[-4]/RC[-3],1)) ->  | H139: =IF(OR(ISBLANK(RC[-5]),ISBLANK(RC[-4])),"",LN(RC[-1])) -> 
E140: - | F140: =IF(R48C3>5,IF(RC[1]="","-",HLOOKUP(RC[1],R110C2:R111C6,2)),IF(ISBLANK(RC[-5]),"-","M")) -> - | G140: =IF(OR(ISBLANK(RC[-4]),ISBLANK(RC[-3])),"",CEILING(RC[-4]/RC[-3],1)) ->  | H140: =IF(OR(ISBLANK(RC[-5]),ISBLANK(RC[-4])),"",LN(RC[-1])) -> 
E141: - | F141: =IF(R48C3>5,IF(RC[1]="","-",HLOOKUP(RC[1],R110C2:R111C6,2)),IF(ISBLANK(RC[-5]),"-","M")) -> - | G141: =IF(OR(ISBLANK(RC[-4]),ISBLANK(RC[-3])),"",CEILING(RC[-4]/RC[-3],1)) ->  | H141: =IF(OR(ISBLANK(RC[-5]),ISBLANK(RC[-4])),"",LN(RC[-1])) -> 
E142: - | F142: =IF(R48C3>5,IF(RC[1]="","-",HLOOKUP(RC[1],R110C2:R111C6,2)),IF(ISBLANK(RC[-5]),"-","M")) -> - | G142: =IF(OR(ISBLANK(RC[-4]),ISBLANK(RC[-3])),"",CEILING(RC[-4]/RC[-3],1)) ->  | H142: =IF(OR(ISBLANK(RC[-5]),ISBLANK(RC[-4])),"",LN(RC[-1])) -> 
E143: - | F143: =IF(R48C3>5,IF(RC[1]="","-",HLOOKUP(RC[1],R110C2:R111C6,2)),IF(ISBLANK(RC[-5]),"-","M")) -> - | G143: =IF(OR(ISBLANK(RC[-4]),ISBLANK(RC[-3])),"",CEILING(RC[-4]/RC[-3],1)) ->  | H143: =IF(OR(ISBLANK(RC[-5]),ISBLANK(RC[-4])),"",LN(RC[-1])) -> 
E144: - | F144: =IF(R48C3>5,IF(RC[1]="","-",HLOOKUP(RC[1],R110C2:R111C6,2)),IF(ISBLANK(RC[-5]),"-","M")) -> - | G144: =IF(OR(ISBLANK(RC[-4]),ISBLANK(RC[-3])),"",CEILING(RC[-4]/RC[-3],1)) ->  | H144: =IF(OR(ISBLANK(RC[-5]),ISBLANK(RC[-4])),"",LN(RC[-1])) -> 
E145: - | F145: =IF(R48C3>5,IF(RC[1]="","-",HLOOKUP(RC[1],R110C2:R111C6,2)),IF(ISBLANK(RC[-5]),"-","M")) -> - | G145: =IF(OR(ISBLANK(RC[-4]),ISBLANK(RC[-3])),"",CEILING(RC[-4]/RC[-3],1)) ->  | H145: =IF(OR(ISBLANK(RC[-5]),ISBLANK(RC[-4])),"",LN(RC[-1])) -> 
E146: - | F146: =IF(R48C3>5,IF(RC[1]="","-",HLOOKUP(RC[1],R110C2:R111C6,2)),IF(ISBLANK(RC[-5]),"-","M")) -> - | G146: =IF(OR(ISBLANK(RC[-4]),ISBLANK(RC[-3])),"",CEILING(RC[-4]/RC[-3],1)) ->  | H146: =IF(OR(ISBLANK(RC[-5]),ISBLANK(RC[-4])),"",LN(RC[-1])) -> 
E147: - | F147: =IF(R48C3>5,IF(RC[1]="","-",HLOOKUP(RC[1],R110C2:R111C6,2)),IF(ISBLANK(RC[-5]),"-","M")) -> - | G147: =IF(OR(ISBLANK(RC[-4]),ISBLANK(RC[-3])),"",CEILING(RC[-4]/RC[-3],1)) ->  | H147: =IF(OR(ISBLANK(RC[-5]),ISBLANK(RC[-4])),"",LN(RC[-1])) -> 
E148: - | F148: =IF(R48C3>5,IF(RC[1]="","-",HLOOKUP(RC[1],R110C2:R111C6,2)),IF(ISBLANK(RC[-5]),"-","M")) -> - | G148: =IF(OR(ISBLANK(RC[-4]),ISBLANK(RC[-3])),"",CEILING(RC[-4]/RC[-3],1)) ->  | H148: =IF(OR(ISBLANK(RC[-5]),ISBLANK(RC[-4])),"",LN(RC[-1])) -> 
E149: - | F149: =IF(R48C3>5,IF(RC[1]="","-",HLOOKUP(RC[1],R110C2:R111C6,2)),IF(ISBLANK(RC[-5]),"-","M")) -> - | G149: =IF(OR(ISBLANK(RC[-4]),ISBLANK(RC[-3])),"",CEILING(RC[-4]/RC[-3],1)) ->  | H149: =IF(OR(ISBLANK(RC[-5]),ISBLANK(RC[-4])),"",LN(RC[-1])) -> 
E150: - | F150: =IF(R48C3>5,IF(RC[1]="","-",HLOOKUP(RC[1],R110C2:R111C6,2)),IF(ISBLANK(RC[-5]),"-","M")) -> - | G150: =IF(OR(ISBLANK(RC[-4]),ISBLANK(RC[-3])),"",CEILING(RC[-4]/RC[-3],1)) ->  | H150: =IF(OR(ISBLANK(RC[-5]),ISBLANK(RC[-4])),"",LN(RC[-1])) -> 
E151: - | F151: =IF(R48C3>5,IF(RC[1]="","-",HLOOKUP(RC[1],R110C2:R111C6,2)),IF(ISBLANK(RC[-5]),"-","M")) -> - | G151: =IF(OR(ISBLANK(RC[-4]),ISBLANK(RC[-3])),"",CEILING(RC[-4]/RC[-3],1)) ->  | H151: =IF(OR(ISBLANK(RC[-5]),ISBLANK(RC[-4])),"",LN(RC[-1])) -> 
E152: - | F152: =IF(R48C3>5,IF(RC[1]="","-",HLOOKUP(RC[1],R110C2:R111C6,2)),IF(ISBLANK(RC[-5]),"-","M")) -> - | G152: =IF(OR(ISBLANK(RC[-4]),ISBLANK(RC[-3])),"",CEILING(RC[-4]/RC[-3],1)) ->  | H152: =IF(OR(ISBLANK(RC[-5]),ISBLANK(RC[-4])),"",LN(RC[-1])) -> 
E153: - | F153: =IF(R48C3>5,IF(RC[1]="","-",HLOOKUP(RC[1],R110C2:R111C6,2)),IF(ISBLANK(RC[-5]),"-","M")) -> - | G153: =IF(OR(ISBLANK(RC[-4]),ISBLANK(RC[-3])),"",CEILING(RC[-4]/RC[-3],1)) ->  | H153: =IF(OR(ISBLANK(RC[-5]),ISBLANK(RC[-4])),"",LN(RC[-1])) -> 
E154: - | F154: =IF(R48C3>5,IF(RC[1]="","-",HLOOKUP(RC[1],R110C2:R111C6,2)),IF(ISBLANK(RC[-5]),"-","M")) -> - | G154: =IF(OR(ISBLANK(RC[-4]),ISBLANK(RC[-3])),"",CEILING(RC[-4]/RC[-3],1)) ->  | H154: =IF(OR(ISBLANK(RC[-5]),ISBLANK(RC[-4])),"",LN(RC[-1])) -> 
E155: - | F155: =IF(R48C3>5,IF(RC[1]="","-",HLOOKUP(RC[1],R110C2:R111C6,2)),IF(ISBLANK(RC[-5]),"-","M")) -> - | G155: =IF(OR(ISBLANK(RC[-4]),ISBLANK(RC[-3])),"",CEILING(RC[-4]/RC[-3],1)) ->  | H155: =IF(OR(ISBLANK(RC[-5]),ISBLANK(RC[-4])),"",LN(RC[-1])) -> 
E156: - | F156: =IF(R48C3>5,IF(RC[1]="","-",HLOOKUP(RC[1],R110C2:R111C6,2)),IF(ISBLANK(RC[-5]),"-","M")) -> - | G156: =IF(OR(ISBLANK(RC[-4]),ISBLANK(RC[-3])),"",CEILING(RC[-4]/RC[-3],1)) ->  | H156: =IF(OR(ISBLANK(RC[-5]),ISBLANK(RC[-4])),"",LN(RC[-1])) -> 
G157: Average= | H157: =IF(ISERR(AVERAGE(R[-29]C:R[-1]C)),0,AVERAGE(R[-29]C:R[-1]C)) -> 3.6109179126442243
G158: Std= | H158: =IF(ISERR(STDEV(R[-30]C:R[-2]C)),0,STDEV(R[-30]C:R[-2]C)) -> 0

Sheet: Review
A1: Review
A3: =Constants!R[-2]C -> Constants | B3: =Constants!R[-2]C ->  | C3: =Constants!R[-2]C ->  | D3: =Constants!R[-2]C ->  | E3: =Constants!R[-2]C ->  | F3: =Constants!R[-2]C -> CA02 | G3: =Constants!R[-2]C ->  | H3: =Constants!R[-2]C ->  | I3: =Constants!R[-2]C ->  | J3: =Constants!R[-2]C -> 0
A4: =Constants!R[-2]C -> Start date: | B4: =Constants!R[-2]C -> 36526 | C4: =Constants!R[-2]C ->  | D4: =Constants!R[-2]C -> Grades: | E4: =Constants!R[-2]C -> AA | F4: =Constants!R[-2]C -> 1 | G4: =Constants!R[-2]C -> 0 | H4: =Constants!R[-2]C -> 0 | I4: =Constants!R[-2]C -> 0 | J4: =Constants!R[-2]C -> 0
A5: =Constants!R[-2]C -> End date: | B5: =Constants!R[-2]C -> 73051 | C5: =Constants!R[-2]C ->  | D5: =Constants!R[-2]C ->  | E5: =Constants!R[-2]C -> A | F5: =Constants!R[-2]C -> 0.95 | G5: =Constants!R[-2]C -> 0 | H5: =Constants!R[-2]C -> 0 | I5: =Constants!R[-2]C -> 0 | J5: =Constants!R[-2]C -> 0
A6: =Constants!R[-2]C -> Phases: | B6: =Constants!R[-2]C -> Analysis | C6: =Constants!R[-2]C ->  | D6: =Constants!R[-2]C ->  | E6: =Constants!R[-2]C -> AB | F6: =Constants!R[-2]C -> 0.9 | G6: =Constants!R[-2]C -> 0 | H6: =Constants!R[-2]C -> 0 | I6: =Constants!R[-2]C -> 0 | J6: =Constants!R[-2]C -> 0
A7: =Constants!R[-2]C ->  | B7: =Constants!R[-2]C -> Architecture | C7: =Constants!R[-2]C ->  | D7: =Constants!R[-2]C ->  | E7: =Constants!R[-2]C -> B | F7: =Constants!R[-2]C -> 0.85 | G7: =Constants!R[-2]C -> 0 | H7: =Constants!R[-2]C -> 0 | I7: =Constants!R[-2]C -> 0 | J7: =Constants!R[-2]C -> 0
A8: =Constants!R[-2]C ->  | B8: =Constants!R[-2]C -> Project planning | C8: =Constants!R[-2]C ->  | D8: =Constants!R[-2]C ->  | E8: =Constants!R[-2]C -> BC | F8: =Constants!R[-2]C -> 0.8 | G8: =Constants!R[-2]C -> 0 | H8: =Constants!R[-2]C -> 0 | I8: =Constants!R[-2]C -> 0 | J8: =Constants!R[-2]C -> 0
A9: =Constants!R[-2]C ->  | B9: =Constants!R[-2]C -> Interation planning | C9: =Constants!R[-2]C ->  | D9: =Constants!R[-2]C ->  | E9: =Constants!R[-2]C -> C | F9: =Constants!R[-2]C -> 0.75 | G9: =Constants!R[-2]C -> 0 | H9: =Constants!R[-2]C -> 0 | I9: =Constants!R[-2]C -> 0 | J9: =Constants!R[-2]C -> 0
A10: =Constants!R[-2]C ->  | B10: =Constants!R[-2]C -> Construction | C10: =Constants!R[-2]C ->  | D10: =Constants!R[-2]C ->  | E10: =Constants!R[-2]C -> CD | F10: =Constants!R[-2]C -> 0.7 | G10: =Constants!R[-2]C -> 0 | H10: =Constants!R[-2]C -> 0 | I10: =Constants!R[-2]C -> 0 | J10: =Constants!R[-2]C -> 0
A11: =Constants!R[-2]C ->  | B11: =Constants!R[-2]C -> Refactoring | C11: =Constants!R[-2]C ->  | D11: =Constants!R[-2]C ->  | E11: =Constants!R[-2]C -> D | F11: =Constants!R[-2]C -> 0.65 | G11: =Constants!R[-2]C -> 0 | H11: =Constants!R[-2]C -> 0 | I11: =Constants!R[-2]C -> 0 | J11: =Constants!R[-2]C -> 0
A12: =Constants!R[-2]C ->  | B12: =Constants!R[-2]C -> Review | C12: =Constants!R[-2]C ->  | D12: =Constants!R[-2]C ->  | E12: =Constants!R[-2]C -> F | F12: =Constants!R[-2]C -> 0.5 | G12: =Constants!R[-2]C -> 0 | H12: =Constants!R[-2]C -> 0 | I12: =Constants!R[-2]C -> 0 | J12: =Constants!R[-2]C -> 0
A13: =Constants!R[-2]C ->  | B13: =Constants!R[-2]C -> Integration test | C13: =Constants!R[-2]C ->  | D13: =Constants!R[-2]C ->  | E13: =Constants!R[-2]C ->  | F13: =Constants!R[-2]C ->  | G13: =Constants!R[-2]C -> 0 | H13: =Constants!R[-2]C -> 0 | I13: =Constants!R[-2]C -> 0 | J13: =Constants!R[-2]C -> 0
A14: =Constants!R[-2]C ->  | B14: =Constants!R[-2]C -> Repatterning | C14: =Constants!R[-2]C ->  | D14: =Constants!R[-2]C ->  | E14: =Constants!R[-2]C ->  | F14: =Constants!R[-2]C ->  | G14: =Constants!R[-2]C -> 0 | H14: =Constants!R[-2]C -> 0 | I14: =Constants!R[-2]C -> 0 | J14: =Constants!R[-2]C -> 0
A15: =Constants!R[-2]C ->  | B15: =Constants!R[-2]C -> Postmortem | C15: =Constants!R[-2]C ->  | D15: =Constants!R[-2]C ->  | E15: =Constants!R[-2]C ->  | F15: =Constants!R[-2]C ->  | G15: =Constants!R[-2]C -> 0 | H15: =Constants!R[-2]C -> 0 | I15: =Constants!R[-2]C -> 0 | J15: =Constants!R[-2]C -> 0
A16: =Constants!R[-2]C ->  | B16: =Constants!R[-2]C -> Sandbox | C16: =Constants!R[-2]C ->  | D16: =Constants!R[-2]C ->  | E16: =Constants!R[-2]C ->  | F16: =Constants!R[-2]C ->  | G16: =Constants!R[-2]C -> 0 | H16: =Constants!R[-2]C -> 0 | I16: =Constants!R[-2]C -> 0 | J16: =Constants!R[-2]C -> 0
A17: =Constants!R[-2]C ->  | B17: =Constants!R[-2]C ->  | C17: =Constants!R[-2]C ->  | D17: =Constants!R[-2]C ->  | E17: =Constants!R[-2]C ->  | F17: =Constants!R[-2]C ->  | G17: =Constants!R[-2]C -> 0 | H17: =Constants!R[-2]C -> 0 | I17: =Constants!R[-2]C -> 0 | J17: =Constants!R[-2]C -> 0
A18: =Constants!R[-2]C ->  | B18: =Constants!R[-2]C ->  | C18: =Constants!R[-2]C ->  | D18: =Constants!R[-2]C ->  | E18: =Constants!R[-2]C ->  | F18: =Constants!R[-2]C ->  | G18: =Constants!R[-2]C -> 0 | H18: =Constants!R[-2]C -> 0 | I18: =Constants!R[-2]C -> 0 | J18: =Constants!R[-2]C -> 0
A19: =Constants!R[-2]C ->  | B19: =Constants!R[-2]C ->  | C19: =Constants!R[-2]C ->  | D19: =Constants!R[-2]C ->  | E19: =Constants!R[-2]C ->  | F19: =Constants!R[-2]C ->  | G19: =Constants!R[-2]C -> 0 | H19: =Constants!R[-2]C -> 0 | I19: =Constants!R[-2]C -> 0 | J19: =Constants!R[-2]C -> 0
A20: =Constants!R[-2]C ->  | B20: =Constants!R[-2]C ->  | C20: =Constants!R[-2]C ->  | D20: =Constants!R[-2]C ->  | E20: =Constants!R[-2]C ->  | F20: =Constants!R[-2]C ->  | G20: =Constants!R[-2]C -> 0 | H20: =Constants!R[-2]C -> 0 | I20: =Constants!R[-2]C -> 0 | J20: =Constants!R[-2]C -> 0
A21: =Constants!R[-2]C -> Defect Types: | B21: =Constants!R[-2]C -> Requirements Change | C21: =Constants!R[-2]C -> Changes to requirements | D21: =Constants!R[-2]C -> Iteration | E21: =Constants!R[-2]C -> NA | F21: =Constants!R[-2]C -> did not follow | G21: =Constants!R[-2]C -> 0 | H21: =Constants!R[-2]C -> 0 | I21: =Constants!R[-2]C -> 0 | J21: =Constants!R[-2]C -> 0
A22: =Constants!R[-2]C ->  | B22: =Constants!R[-2]C -> Requirements Clarification | C22: =Constants!R[-2]C -> Clarifications to requirements | D22: =Constants!R[-2]C ->  | E22: =Constants!R[-2]C -> 1 | F22: =Constants!R[-2]C -> very painful | G22: =Constants!R[-2]C -> 0 | H22: =Constants!R[-2]C -> 0 | I22: =Constants!R[-2]C -> 0 | J22: =Constants!R[-2]C -> 0
A23: =Constants!R[-2]C ->  | B23: =Constants!R[-2]C -> Product syntax | C23: =Constants!R[-2]C -> Syntax flaws in the deliverable product | D23: =Constants!R[-2]C ->  | E23: =Constants!R[-2]C -> 2 | F23: =Constants!R[-2]C -> painful | G23: =Constants!R[-2]C -> 0 | H23: =Constants!R[-2]C -> 0 | I23: =Constants!R[-2]C -> 0 | J23: =Constants!R[-2]C -> 0
A24: =Constants!R[-2]C ->  | B24: =Constants!R[-2]C -> Product logic | C24: =Constants!R[-2]C -> Logic flaws in the deliverable product | D24: =Constants!R[-2]C ->  | E24: =Constants!R[-2]C -> 3 | F24: =Constants!R[-2]C -> neutral | G24: =Constants!R[-2]C -> 0 | H24: =Constants!R[-2]C -> 0 | I24: =Constants!R[-2]C -> 0 | J24: =Constants!R[-2]C -> 0
A25: =Constants!R[-2]C ->  | B25: =Constants!R[-2]C -> Product interface | C25: =Constants!R[-2]C -> Flaws in the interface of a component of the deliverable product | D25: =Constants!R[-2]C ->  | E25: =Constants!R[-2]C -> 4 | F25: =Constants!R[-2]C -> helpful | G25: =Constants!R[-2]C -> 0 | H25: =Constants!R[-2]C -> 0 | I25: =Constants!R[-2]C -> 0 | J25: =Constants!R[-2]C -> 0
A26: =Constants!R[-2]C ->  | B26: =Constants!R[-2]C -> Product checking | C26: =Constants!R[-2]C -> Flaws with boundary/type checking within a component of the deliverable product | D26: =Constants!R[-2]C ->  | E26: =Constants!R[-2]C -> 5 | F26: =Constants!R[-2]C -> very helpful | G26: =Constants!R[-2]C -> 0 | H26: =Constants!R[-2]C -> 0 | I26: =Constants!R[-2]C -> 0 | J26: =Constants!R[-2]C -> 0
A27: =Constants!R[-2]C ->  | B27: =Constants!R[-2]C -> Test syntax | C27: =Constants!R[-2]C -> Syntax flaws in the test code | D27: =Constants!R[-2]C ->  | E27: =Constants!R[-2]C -> 6 | F27: =Constants!R[-2]C ->  | G27: =Constants!R[-2]C -> 0 | H27: =Constants!R[-2]C -> 0 | I27: =Constants!R[-2]C -> 0 | J27: =Constants!R[-2]C -> 0
A28: =Constants!R[-2]C ->  | B28: =Constants!R[-2]C -> Test logic | C28: =Constants!R[-2]C -> Logic flaws in the test code | D28: =Constants!R[-2]C ->  | E28: =Constants!R[-2]C -> 7 | F28: =Constants!R[-2]C ->  | G28: =Constants!R[-2]C -> 0 | H28: =Constants!R[-2]C -> 0 | I28: =Constants!R[-2]C -> 0 | J28: =Constants!R[-2]C -> 0
A29: =Constants!R[-2]C ->  | B29: =Constants!R[-2]C -> Test interface | C29: =Constants!R[-2]C -> Flaws in the interface of a component of the test code | D29: =Constants!R[-2]C ->  | E29: =Constants!R[-2]C -> 8 | F29: =Constants!R[-2]C ->  | G29: =Constants!R[-2]C -> 0 | H29: =Constants!R[-2]C -> 0 | I29: =Constants!R[-2]C -> 0 | J29: =Constants!R[-2]C -> 0
A30: =Constants!R[-2]C ->  | B30: =Constants!R[-2]C -> Test checking | C30: =Constants!R[-2]C -> Flaws with boundary/type checking within a component of the test code | D30: =Constants!R[-2]C ->  | E30: =Constants!R[-2]C -> 9 | F30: =Constants!R[-2]C ->  | G30: =Constants!R[-2]C -> 0 | H30: =Constants!R[-2]C -> 0 | I30: =Constants!R[-2]C -> 0 | J30: =Constants!R[-2]C -> 0
A31: =Constants!R[-2]C ->  | B31: =Constants!R[-2]C -> Bad Smell | C31: =Constants!R[-2]C -> Refactoring changes (please note the bad smell in the defect description) | D31: =Constants!R[-2]C ->  | E31: =Constants!R[-2]C -> 10 | F31: =Constants!R[-2]C -> 0 | G31: =Constants!R[-2]C -> 0 | H31: =Constants!R[-2]C -> 0 | I31: =Constants!R[-2]C -> 0 | J31: =Constants!R[-2]C -> 0
A32: =Constants!R[-2]C -> Y/N: | B32: =Constants!R[-2]C -> Yes | C32: =Constants!R[-2]C ->  | D32: =Constants!R[-2]C ->  | E32: =Constants!R[-2]C -> Passed | F32: =Constants!R[-2]C -> 0 | G32: =Constants!R[-2]C -> 0 | H32: =Constants!R[-2]C -> 0 | I32: =Constants!R[-2]C -> 0 | J32: =Constants!R[-2]C -> 0
A33: =Constants!R[-2]C ->  | B33: =Constants!R[-2]C -> No | C33: =Constants!R[-2]C ->  | D33: =Constants!R[-2]C ->  | E33: =Constants!R[-2]C -> Passed with issues | F33: =Constants!R[-2]C -> 0 | G33: =Constants!R[-2]C -> 0 | H33: =Constants!R[-2]C -> 0 | I33: =Constants!R[-2]C -> 0 | J33: =Constants!R[-2]C -> 0
A34: =Constants!R[-2]C -> Proxy Types: | B34: =Constants!R[-2]C -> - | C34: =Constants!R[-2]C ->  | D34: =Constants!R[-2]C ->  | E34: =Constants!R[-2]C -> Failed | F34: =Constants!R[-2]C ->  | G34: =Constants!R[-2]C -> 0 | H34: =Constants!R[-2]C -> 0 | I34: =Constants!R[-2]C -> 0 | J34: =Constants!R[-2]C -> 0
A35: =Constants!R[-2]C ->  | B35: =Constants!R[-2]C -> Calculation | C35: =Constants!R[-2]C ->  | D35: =Constants!R[-2]C ->  | E35: =Constants!R[-2]C -> Not tested | F35: =Constants!R[-2]C ->  | G35: =Constants!R[-2]C -> 0 | H35: =Constants!R[-2]C -> 0 | I35: =Constants!R[-2]C -> 0 | J35: =Constants!R[-2]C -> 0
A36: =Constants!R[-2]C ->  | B36: =Constants!R[-2]C -> Data | C36: =Constants!R[-2]C ->  | D36: =Constants!R[-2]C ->  | E36: =Constants!R[-2]C -> Not applicable | F36: =Constants!R[-2]C ->  | G36: =Constants!R[-2]C -> 0 | H36: =Constants!R[-2]C -> 0 | I36: =Constants!R[-2]C -> 0 | J36: =Constants!R[-2]C -> 0
A37: =Constants!R[-2]C ->  | B37: =Constants!R[-2]C -> I/O | C37: =Constants!R[-2]C ->  | D37: =Constants!R[-2]C ->  | E37: =Constants!R[-2]C ->  | F37: =Constants!R[-2]C ->  | G37: =Constants!R[-2]C -> 0 | H37: =Constants!R[-2]C -> 0 | I37: =Constants!R[-2]C -> 0 | J37: =Constants!R[-2]C -> 0
A38: =Constants!R[-2]C ->  | B38: =Constants!R[-2]C -> Logic | C38: =Constants!R[-2]C ->  | D38: =Constants!R[-2]C ->  | E38: =Constants!R[-2]C ->  | F38: =Constants!R[-2]C ->  | G38: =Constants!R[-2]C -> 0 | H38: =Constants!R[-2]C -> 0 | I38: =Constants!R[-2]C -> 0 | J38: =Constants!R[-2]C -> 0
A39: =Constants!R[-2]C ->  | B39: =Constants!R[-2]C ->  | C39: =Constants!R[-2]C ->  | D39: =Constants!R[-2]C ->  | E39: =Constants!R[-2]C ->  | F39: =Constants!R[-2]C ->  | G39: =Constants!R[-2]C -> 0 | H39: =Constants!R[-2]C -> 0 | I39: =Constants!R[-2]C -> 0 | J39: =Constants!R[-2]C -> 0
A40: =Constants!R[-2]C -> Sizes: | B40: =Constants!R[-2]C -> VS | C40: =Constants!R[-2]C -> S | D40: =Constants!R[-2]C -> M | E40: =Constants!R[-2]C -> L | F40: =Constants!R[-2]C -> VL | G40: =Constants!R[-2]C -> 0 | H40: =Constants!R[-2]C -> 0 | I40: =Constants!R[-2]C -> 0 | J40: =Constants!R[-2]C -> 0
A41: =Constants!R[-2]C -> upper | B41: =Constants!R[-2]C -> -1.5 | C41: =Constants!R[-2]C -> -0.5 | D41: =Constants!R[-2]C -> 0.5 | E41: =Constants!R[-2]C -> 1.5 | F41: =Constants!R[-2]C -> 99999 | G41: =Constants!R[-2]C -> 0 | H41: =Constants!R[-2]C -> 0 | I41: =Constants!R[-2]C -> 0 | J41: =Constants!R[-2]C -> 0
A42: =Constants!R[-2]C -> mid | B42: =Constants!R[-2]C -> -2 | C42: =Constants!R[-2]C -> -1 | D42: =Constants!R[-2]C -> 0 | E42: =Constants!R[-2]C -> 1 | F42: =Constants!R[-2]C -> 2 | G42: =Constants!R[-2]C -> 0 | H42: =Constants!R[-2]C -> 0 | I42: =Constants!R[-2]C -> 0 | J42: =Constants!R[-2]C -> 0
A43: =Constants!R[-2]C -> lower | B43: =Constants!R[-2]C -> 0 | C43: =Constants!R[-2]C -> -1.5 | D43: =Constants!R[-2]C -> -0.5 | E43: =Constants!R[-2]C -> 0.5 | F43: =Constants!R[-2]C -> 1.5 | G43: =Constants!R[-2]C -> 0 | H43: =Constants!R[-2]C -> 0 | I43: =Constants!R[-2]C -> 0 | J43: =Constants!R[-2]C -> 0
A44: =Constants!R[-2]C ->  | B44: =Constants!R[-2]C -> 0 | C44: =Constants!R[-2]C -> 0 | D44: =Constants!R[-2]C -> 0 | E44: =Constants!R[-2]C -> 0 | F44: =Constants!R[-2]C ->  | G44: =Constants!R[-2]C -> 0 | H44: =Constants!R[-2]C -> 0 | I44: =Constants!R[-2]C -> 0 | J44: =Constants!R[-2]C -> 0
A45: =Constants!R[-2]C ->  | B45: =Constants!R[-2]C ->  | C45: =Constants!R[-2]C ->  | D45: =Constants!R[-2]C ->  | E45: =Constants!R[-2]C ->  | F45: =Constants!R[-2]C ->  | G45: =Constants!R[-2]C -> 0 | H45: =Constants!R[-2]C -> 0 | I45: =Constants!R[-2]C -> 0 | J45: =Constants!R[-2]C -> 0
A46: =Constants!R[-2]C -> <-- Mandatory | B46: =Constants!R[-2]C ->  | C46: =Constants!R[-2]C -> ✔ | D46: =Constants!R[-2]C ->  | E46: =Constants!R[-2]C ->  | F46: =Constants!R[-2]C ->  | G46: =Constants!R[-2]C -> 0 | H46: =Constants!R[-2]C -> 0 | I46: =Constants!R[-2]C -> 0 | J46: =Constants!R[-2]C -> 0
A47: =Constants!R[-2]C -> 0 | B47: =Constants!R[-2]C -> 0 | C47: =Constants!R[-2]C -> 0 | D47: =Constants!R[-2]C -> 0 | E47: =Constants!R[-2]C -> 0 | F47: =Constants!R[-2]C ->  | G47: =Constants!R[-2]C -> 0 | H47: =Constants!R[-2]C -> 0 | I47: =Constants!R[-2]C -> 0 | J47: =Constants!R[-2]C -> 0
A48: =Constants!R[-2]C -> 0 | B48: =Constants!R[-2]C -> 0 | C48: =Constants!R[-2]C -> 0 | D48: =Constants!R[-2]C -> 0 | E48: =Constants!R[-2]C -> 0 | F48: =Constants!R[-2]C ->  | G48: =Constants!R[-2]C -> 0 | H48: =Constants!R[-2]C -> 0 | I48: =Constants!R[-2]C -> 0 | J48: =Constants!R[-2]C -> 0
A49: =Constants!R[-2]C -> 0 | B49: =Constants!R[-2]C -> 0 | C49: =Constants!R[-2]C -> 0 | D49: =Constants!R[-2]C -> 0 | E49: =Constants!R[-2]C -> 0 | F49: =Constants!R[-2]C ->  | G49: =Constants!R[-2]C -> 0 | H49: =Constants!R[-2]C -> 0 | I49: =Constants!R[-2]C -> 0 | J49: =Constants!R[-2]C -> 0
A51: Defect Pareto Analysis (taken from all defects to date)
B52: Type | C52: Description | E52: Count of Occurrences | F52: %
B53: =R[-32]C -> Requirements Change | C53: =R[-32]C -> Changes to requirements | F53: =IF(ISERR(RC[-1]/R64C5),"",RC[-1]/R64C5) -> 
B54: =R[-32]C -> Requirements Clarification | C54: =R[-32]C -> Clarifications to requirements | F54: =IF(ISERR(RC[-1]/R64C5),"",RC[-1]/R64C5) -> 
B55: =R[-32]C -> Product syntax | C55: =R[-32]C -> Syntax flaws in the deliverable product | F55: =IF(ISERR(RC[-1]/R64C5),"",RC[-1]/R64C5) -> 
B56: =R[-32]C -> Product logic | C56: =R[-32]C -> Logic flaws in the deliverable product | F56: =IF(ISERR(RC[-1]/R64C5),"",RC[-1]/R64C5) -> 
B57: =R[-32]C -> Product interface | C57: =R[-32]C -> Flaws in the interface of a component of the deliverable product | F57: =IF(ISERR(RC[-1]/R64C5),"",RC[-1]/R64C5) -> 
B58: =R[-32]C -> Product checking | C58: =R[-32]C -> Flaws with boundary/type checking within a component of the deliverable product | F58: =IF(ISERR(RC[-1]/R64C5),"",RC[-1]/R64C5) -> 
B59: =R[-32]C -> Test syntax | C59: =R[-32]C -> Syntax flaws in the test code | F59: =IF(ISERR(RC[-1]/R64C5),"",RC[-1]/R64C5) -> 
B60: =R[-32]C -> Test logic | C60: =R[-32]C -> Logic flaws in the test code | F60: =IF(ISERR(RC[-1]/R64C5),"",RC[-1]/R64C5) -> 
B61: =R[-32]C -> Test interface | C61: =R[-32]C -> Flaws in the interface of a component of the test code | F61: =IF(ISERR(RC[-1]/R64C5),"",RC[-1]/R64C5) -> 
B62: =R[-32]C -> Test checking | C62: =R[-32]C -> Flaws with boundary/type checking within a component of the test code | F62: =IF(ISERR(RC[-1]/R64C5),"",RC[-1]/R64C5) -> 
B63: =R[-32]C -> Bad Smell | C63: =R[-32]C -> Refactoring changes (please note the bad smell in the defect description) | F63: =IF(ISERR(RC[-1]/R64C5),"",RC[-1]/R64C5) -> 
D64: Total | E64: =SUM(R[-11]C:R[-1]C) -> 0 | F64: =IF(RC[-1]='Historical Data'!R[26]C[-1],,"<-- Warning, defect count doesn't match Historical Data") -> 0
A65: Code Review Checklist
B66: Item | E66: Number of times this item detected a defect during review

Sheet: Acceptance
A1: =Constants!RC -> Constants | B1: =Constants!RC ->  | C1: =Constants!RC ->  | D1: =Constants!RC ->  | E1: =Constants!RC ->  | F1: =Constants!RC -> CA02 | G1: =Constants!RC -> 
A2: =Constants!RC -> Start date: | B2: =Constants!RC -> 36526 | C2: =Constants!RC ->  | D2: =Constants!RC -> Grades: | E2: =Constants!RC -> AA | F2: =Constants!RC -> 1 | G2: =Constants!RC -> 0
A3: =Constants!RC -> End date: | B3: =Constants!RC -> 73051 | C3: =Constants!RC ->  | D3: =Constants!RC ->  | E3: =Constants!RC -> A | F3: =Constants!RC -> 0.95 | G3: =Constants!RC -> 0
A4: =Constants!RC -> Phases: | B4: =Constants!RC -> Analysis | C4: =Constants!RC ->  | D4: =Constants!RC ->  | E4: =Constants!RC -> AB | F4: =Constants!RC -> 0.9 | G4: =Constants!RC -> 0
A5: =Constants!RC ->  | B5: =Constants!RC -> Architecture | C5: =Constants!RC ->  | D5: =Constants!RC ->  | E5: =Constants!RC -> B | F5: =Constants!RC -> 0.85 | G5: =Constants!RC -> 0
A6: =Constants!RC ->  | B6: =Constants!RC -> Project planning | C6: =Constants!RC ->  | D6: =Constants!RC ->  | E6: =Constants!RC -> BC | F6: =Constants!RC -> 0.8 | G6: =Constants!RC -> 0
A7: =Constants!RC ->  | B7: =Constants!RC -> Interation planning | C7: =Constants!RC ->  | D7: =Constants!RC ->  | E7: =Constants!RC -> C | F7: =Constants!RC -> 0.75 | G7: =Constants!RC -> 0
A8: =Constants!RC ->  | B8: =Constants!RC -> Construction | C8: =Constants!RC ->  | D8: =Constants!RC ->  | E8: =Constants!RC -> CD | F8: =Constants!RC -> 0.7 | G8: =Constants!RC -> 0
A9: =Constants!RC ->  | B9: =Constants!RC -> Refactoring | C9: =Constants!RC ->  | D9: =Constants!RC ->  | E9: =Constants!RC -> D | F9: =Constants!RC -> 0.65 | G9: =Constants!RC -> 0
A10: =Constants!RC ->  | B10: =Constants!RC -> Review | C10: =Constants!RC ->  | D10: =Constants!RC ->  | E10: =Constants!RC -> F | F10: =Constants!RC -> 0.5 | G10: =Constants!RC -> 0
A11: =Constants!RC ->  | B11: =Constants!RC -> Integration test | C11: =Constants!RC ->  | D11: =Constants!RC ->  | E11: =Constants!RC ->  | F11: =Constants!RC ->  | G11: =Constants!RC -> 0
A12: =Constants!RC ->  | B12: =Constants!RC -> Repatterning | C12: =Constants!RC ->  | D12: =Constants!RC ->  | E12: =Constants!RC ->  | F12: =Constants!RC ->  | G12: =Constants!RC -> 0
A13: =Constants!RC ->  | B13: =Constants!RC -> Postmortem | C13: =Constants!RC ->  | D13: =Constants!RC ->  | E13: =Constants!RC ->  | F13: =Constants!RC ->  | G13: =Constants!RC -> 0
A14: =Constants!RC ->  | B14: =Constants!RC -> Sandbox | C14: =Constants!RC ->  | D14: =Constants!RC ->  | E14: =Constants!RC ->  | F14: =Constants!RC ->  | G14: =Constants!RC -> 0
A15: =Constants!RC ->  | B15: =Constants!RC ->  | C15: =Constants!RC ->  | D15: =Constants!RC ->  | E15: =Constants!RC ->  | F15: =Constants!RC ->  | G15: =Constants!RC -> 0
A16: =Constants!RC ->  | B16: =Constants!RC ->  | C16: =Constants!RC ->  | D16: =Constants!RC ->  | E16: =Constants!RC ->  | F16: =Constants!RC ->  | G16: =Constants!RC -> 0
A17: =Constants!RC ->  | B17: =Constants!RC ->  | C17: =Constants!RC ->  | D17: =Constants!RC ->  | E17: =Constants!RC ->  | F17: =Constants!RC ->  | G17: =Constants!RC -> 0
A18: =Constants!RC ->  | B18: =Constants!RC ->  | C18: =Constants!RC ->  | D18: =Constants!RC ->  | E18: =Constants!RC ->  | F18: =Constants!RC ->  | G18: =Constants!#REF! -> #REF!
A19: =Constants!RC -> Defect Types: | B19: =Constants!RC -> Requirements Change | C19: =Constants!RC -> Changes to requirements | D19: =Constants!RC -> Iteration | E19: =Constants!RC -> NA | F19: =Constants!RC -> did not follow | G19: =Constants!#REF! -> #REF!
A20: =Constants!RC ->  | B20: =Constants!RC -> Requirements Clarification | C20: =Constants!RC -> Clarifications to requirements | D20: =Constants!RC ->  | E20: =Constants!RC -> 1 | F20: =Constants!RC -> very painful | G20: =Constants!#REF! -> #REF!
A21: =Constants!RC ->  | B21: =Constants!RC -> Product syntax | C21: =Constants!RC -> Syntax flaws in the deliverable product | D21: =Constants!RC ->  | E21: =Constants!RC -> 2 | F21: =Constants!RC -> painful | G21: =Constants!#REF! -> #REF!
A22: =Constants!RC ->  | B22: =Constants!RC -> Product logic | C22: =Constants!RC -> Logic flaws in the deliverable product | D22: =Constants!RC ->  | E22: =Constants!RC -> 3 | F22: =Constants!RC -> neutral | G22: =Constants!#REF! -> #REF!
A23: =Constants!RC ->  | B23: =Constants!RC -> Product interface | C23: =Constants!RC -> Flaws in the interface of a component of the deliverable product | D23: =Constants!RC ->  | E23: =Constants!RC -> 4 | F23: =Constants!RC -> helpful | G23: =Constants!#REF! -> #REF!
A24: =Constants!RC ->  | B24: =Constants!RC -> Product checking | C24: =Constants!RC -> Flaws with boundary/type checking within a component of the deliverable product | D24: =Constants!RC ->  | E24: =Constants!RC -> 5 | F24: =Constants!RC -> very helpful | G24: =Constants!#REF! -> #REF!
A25: =Constants!RC ->  | B25: =Constants!RC -> Test syntax | C25: =Constants!RC -> Syntax flaws in the test code | D25: =Constants!RC ->  | E25: =Constants!RC -> 6 | F25: =Constants!RC ->  | G25: =Constants!#REF! -> #REF!
A26: =Constants!RC ->  | B26: =Constants!RC -> Test logic | C26: =Constants!RC -> Logic flaws in the test code | D26: =Constants!RC ->  | E26: =Constants!RC -> 7 | F26: =Constants!RC ->  | G26: =Constants!#REF! -> #REF!
A27: =Constants!RC ->  | B27: =Constants!RC -> Test interface | C27: =Constants!RC -> Flaws in the interface of a component of the test code | D27: =Constants!RC ->  | E27: =Constants!RC -> 8 | F27: =Constants!RC ->  | G27: =Constants!#REF! -> #REF!
A28: =Constants!RC ->  | B28: =Constants!RC -> Test checking | C28: =Constants!RC -> Flaws with boundary/type checking within a component of the test code | D28: =Constants!RC ->  | E28: =Constants!RC -> 9 | F28: =Constants!RC ->  | G28: =Constants!#REF! -> #REF!
A29: =Constants!RC ->  | B29: =Constants!RC -> Bad Smell | C29: =Constants!RC -> Refactoring changes (please note the bad smell in the defect description) | D29: =Constants!RC ->  | E29: =Constants!RC -> 10 | F29: =Constants!RC -> 0 | G29: =Constants!#REF! -> #REF!
A30: =Constants!RC -> Y/N: | B30: =Constants!RC -> Yes | C30: =Constants!RC ->  | D30: =Constants!RC ->  | E30: =Constants!RC -> Passed | F30: =Constants!RC -> 0 | G30: =Constants!#REF! -> #REF!
A31: =Constants!RC ->  | B31: =Constants!RC -> No | C31: =Constants!RC ->  | D31: =Constants!RC ->  | E31: =Constants!RC -> Passed with issues | F31: =Constants!RC -> 0 | G31: =Constants!RC -> 0
A32: =Constants!RC -> Proxy Types: | B32: =Constants!RC -> - | C32: =Constants!RC ->  | D32: =Constants!RC ->  | E32: =Constants!RC -> Failed | F32: =Constants!RC ->  | G32: =Constants!RC -> 0
A33: =Constants!RC ->  | B33: =Constants!RC -> Calculation | C33: =Constants!RC ->  | D33: =Constants!RC ->  | E33: =Constants!RC -> Not tested | F33: =Constants!RC ->  | G33: =Constants!RC -> 0
A34: =Constants!RC ->  | B34: =Constants!RC -> Data | C34: =Constants!RC ->  | D34: =Constants!RC ->  | E34: =Constants!RC -> Not applicable | F34: =Constants!RC ->  | G34: =Constants!RC -> 0
A35: =Constants!RC ->  | B35: =Constants!RC -> I/O | C35: =Constants!RC ->  | D35: =Constants!RC ->  | E35: =Constants!RC ->  | F35: =Constants!RC ->  | G35: =Constants!RC -> 0
A36: =Constants!RC ->  | B36: =Constants!RC -> Logic | C36: =Constants!RC ->  | D36: =Constants!RC ->  | E36: =Constants!RC ->  | F36: =Constants!RC ->  | G36: =Constants!RC -> 0
A37: =Constants!RC ->  | B37: =Constants!RC ->  | C37: =Constants!RC ->  | D37: =Constants!RC ->  | E37: =Constants!RC ->  | F37: =Constants!RC ->  | G37: =Constants!RC -> 0
A38: =Constants!RC -> Sizes: | B38: =Constants!RC -> VS | C38: =Constants!RC -> S | D38: =Constants!RC -> M | E38: =Constants!RC -> L | F38: =Constants!RC -> VL | G38: =Constants!RC -> 0
A39: =Constants!RC -> upper | B39: =Constants!RC -> -1.5 | C39: =Constants!RC -> -0.5 | D39: =Constants!RC -> 0.5 | E39: =Constants!RC -> 1.5 | F39: =Constants!RC -> 99999 | G39: =Constants!RC -> 0
A40: =Constants!RC -> mid | B40: =Constants!RC -> -2 | C40: =Constants!RC -> -1 | D40: =Constants!RC -> 0 | E40: =Constants!RC -> 1 | F40: =Constants!RC -> 2 | G40: =Constants!RC -> 0
A41: =Constants!RC -> lower | B41: =Constants!RC -> 0 | C41: =Constants!RC -> -1.5 | D41: =Constants!RC -> -0.5 | E41: =Constants!RC -> 0.5 | F41: =Constants!RC -> 1.5 | G41: =Constants!RC -> 0
A42: =Constants!RC ->  | B42: =Constants!RC -> 0 | C42: =Constants!RC -> 0 | D42: =Constants!RC -> 0 | E42: =Constants!RC -> 0 | F42: =Constants!RC ->  | G42: =Constants!RC -> 0
A43: Acceptance Test Report
A44: Use this worksheet to record tests that, if passed, tell you that your software is complete. List only tests that are directly linked to requirements (in other words, do not list tests for methods or components that you create over and above what is required to fulfill the specified interface definition -- these tests will appear in your individual unit test files). Write the expected results at planning time. Modify if necessary later. Don’t write actual results in advance.
A45: Requirements:
A46: dispatch function
A47: adjust calculation
A48: predict calculation
A49: correct calculation
A50: locate calculation
A51: Requirement | B51: Test | C51: Expected Results | E51: Actual Results | F51: Issues
A52: dispatch function | B52: test_dispatch100_000_emptyInput | C52: {'error': 'no op is specified'} | E52: Passed
A53: dispatch function | B53: test_dispatch100_001_observationMissing | C53: {'error': 'mandatory information missing'} | E53: Passed
A54: dispatch function | B54: test_dispatch100_002_observationValueIllegal | C54: value of observation is illegal' | E54: Passed
A55: dispatch function | B55: test_dispatch100_003_observationValueIllegal | C55: degree of observation value is illegal' | E55: Passed
A56: dispatch function | B56: test_dispatch100_004_observationValueIllegal | C56: minute of observation value is illegal' | E56: Passed
A57: dispatch function | B57: test_dispatch100_005_observationValueIllegal | C57: minute of observation value is illegal' | E57: Passed
A58: dispatch function | B58: test_dispatch100_006_heightValueIllegal | C58: value of height is illegal' | E58: Passed
A59: dispatch function | B59: test_dispatch100_007_tempValueIllegal | C59: value of temperature is illegal' | E59: Passed
A60: dispatch function | B60: test_dispatch100_008_tempValueIllegal | C60: value of temperature is illegal' | E60: Passed
A61: dispatch function | B61: test_dispatch100_009_horizonValueIllegal | C61: value of horizon is illegal' | E61: Passed
A62: dispatch function | B62: test_dispatch100_010_givenCase1 | C62: 'degree of observation value is illegal' | E62: Passed
A63: dispatch function | B63: test_dispatch100_011_givenCase2 | C63: cast error' | E63: Passed
A64: dispatch function | B64: test_dispatch100_012_givenCase3 | C64: value of horizon is illegal' | E64: Passed
A65: dispatch function | B65: test_dispatch100_013_givenCase4 | C65: {'error':'dictionary is missing'} | E65: Passed
A66: dispatch function | B66: test_dispatch100_014_happyPathTest | C66: original input | E66: Passed
A67: adjust calculation | B67: test_calculateAdjsut200_001_happyPath | C67: Adjusts observed angle to compensate for sighting circumstances. | E67: Passed with issues | F67: always a 0.1 in minute of altitude, and fixed by changing the round function
A68: adjust calculation | B68: test_calculateAdjsut200_002_happyPath | C68: Adjusts observed angle to compensate for sighting circumstances. | E68: Passed with issues | F68: always a 0.1 in minute of altitude, and fixed by changing the round function
A69: adjust calculation | B69: test_calculateAdjsut200_003_happyPath | C69: Adjusts observed angle to compensate for sighting circumstances. | E69: Passed with issues | F69: always a 0.1 in minute of altitude, and fixed by changing the round function
A70: adjust calculation | B70: test_calculateAdjsut200_004_happyPath | C70: Adjusts observed angle to compensate for sighting circumstances. | E70: Passed with issues | F70: always a 0.1 in minute of altitude, and fixed by changing the round function

Sheet: Map
A1: Sceneario-Component Map
B3: X
A5: Component Names:
B7: =CONCATENATE("Scenario ", TEXT(#REF!,"#")) -> #REF!
B8: =CONCATENATE("Scenario ", TEXT(#REF!,"#")) -> #REF!
B9: =CONCATENATE("Scenario ", TEXT(#REF!,"#")) -> #REF!
B10: =CONCATENATE("Scenario ", TEXT(#REF!,"#")) -> #REF!
B11: =CONCATENATE("Scenario ", TEXT(#REF!,"#")) -> #REF!
B12: =CONCATENATE("Scenario ", TEXT(#REF!,"#")) -> #REF!
B13: =CONCATENATE("Scenario ", TEXT(#REF!,"#")) -> #REF!
B14: =CONCATENATE("Scenario ", TEXT(#REF!,"#")) -> #REF!
B15: =CONCATENATE("Scenario ", TEXT(#REF!,"#")) -> #REF!

Sheet: Architecture
B1: Architecture
A2: Use this worksheet to describe components required to implement the specifications. List new components and base components. Do not include extraneous components.
B4: Standards
B5: Start date: | C5: 2000-01-01T00:00:00.000
B6: End date: | C6: 2010-01-01T00:00:00.000
B7: Phases: | C7: Planning
C8: Design
C9: Design Review
C10: Code
C11: Code Review
C12: Compile
C13: Test
C14: Postmortem
B15: Defect Types: | C15: Documentation
C16: Syntax
C17: Build, Package
C18: Assignment
C19: Interface
C20: Checking
C21: Data
C22: Function
C23: System
C24: Environment
B25: Y/N: | C25: Yes
C26: No
B27: Component Types: | C27: Calculation
C28: Data
C29: I/O
C30: Logic
B31: Design Approaches: | C31: Object-oriented
C32: Functional
B33: Sizes: | C33: VS
C34: S
C35: M
C36: L
C37: VL
B38: Duration: | C38: LOCe x T
C39: LOCa x T
C40: Productivity
A43: 1 | B43: Component Name:
B44: Design Approach:
B45: Parent Component:
B46: Attributes (optional):
B47: Component Type:
B48: Collaborators:
B49: Operations:
A60: =R[-17]C+1 -> 2 | B60: Component Name:
B61: Design Approach:
B62: Parent Component:
B63: Attributes (optional):
B64: Component Type:
B65: Collaborators:
B66: Operations:
A77: =R[-17]C+1 -> 3 | B77: Component Name:
B78: Design Approach:
B79: Parent Component:
B80: Attributes (optional):
B81: Component Type:
B82: Collaborators:
B83: Operations:
A94: =R[-17]C+1 -> 4 | B94: Component Name:
B95: Design Approach:
B96: Parent Component:
B97: Attributes (optional):
B98: Component Type:
B99: Collaborators:
B100: Operations:
A111: =R[-17]C+1 -> 5 | B111: Component Name:
B112: Design Approach:
B113: Parent Component:
B114: Attributes (optional):
B115: Component Type:
B116: Collaborators:
B117: Operations:
A128: =R[-17]C+1 -> 6 | B128: Component Name:
B129: Design Approach:
B130: Parent Component:
B131: Attributes (optional):
B132: Component Type:
B133: Collaborators:
B134: Operations:
A145: =R[-17]C+1 -> 7 | B145: Component Name:
B146: Design Approach:
B147: Parent Component:
B148: Attributes (optional):
B149: Component Type:
B150: Collaborators:
B151: Operations:
A162: =R[-17]C+1 -> 8 | B162: Component Name:
B163: Design Approach:
B164: Parent Component:
B165: Attributes (optional):
B166: Component Type:
B167: Collaborators:
B168: Operations:
A179: =R[-17]C+1 -> 9 | B179: Component Name:
B180: Design Approach:
B181: Parent Component:
B182: Attributes (optional):
B183: Component Type:
B184: Collaborators:
B185: Operations:
A196: =R[-17]C+1 -> 10 | B196: Component Name:
B197: Design Approach:
B198: Parent Component:
B199: Attributes (optional):
B200: Component Type:
B201: Collaborators:
B202: Operations:
A213: =R[-17]C+1 -> 11 | B213: Component Name: | C213: =OFFSET(Map!R5C3,0,RC[-2]-1) -> 0
B214: Design Approach:
B215: Parent Component:
B216: Attributes (optional):
B217: Component Type:
B218: Collaborators:
B219: Operations:
A230: =R[-17]C+1 -> 12 | B230: Component Name: | C230: =OFFSET(Map!R5C3,0,RC[-2]-1) -> 0
B231: Design Approach:
B232: Parent Component:
B233: Attributes (optional):
B234: Component Type:
B235: Collaborators:
B236: Operations:
A247: =R[-17]C+1 -> 13 | B247: Component Name: | C247: =OFFSET(Map!R5C3,0,RC[-2]-1) -> 0
B248: Design Approach:
B249: Parent Component:
B250: Attributes (optional):
B251: Component Type:
B252: Collaborators:
B253: Operations:
A264: =R[-17]C+1 -> 14 | B264: Component Name: | C264: =OFFSET(Map!R5C3,0,RC[-2]-1) -> 0
B265: Design Approach:
B266: Parent Component:
B267: Attributes (optional):
B268: Component Type:
B269: Collaborators:
B270: Operations:
A281: =R[-17]C+1 -> 15 | B281: Component Name: | C281: =OFFSET(Map!R5C3,0,RC[-2]-1) -> 0
B282: Design Approach:
B283: Parent Component:
B284: Attributes (optional):
B285: Component Type:
B286: Collaborators:
B287: Operations:

Sheet: Estimation
A1: Size Estimate
A3: Standards
A4: Start date: | B4: 2000-01-01T00:00:00.000 | E4: Grades: | F4: AA
A5: End date: | B5: 2020-01-01T00:00:00.000 | F5: A
A6: Phases: | B6: Planning | F6: AB
B7: Architecture | F7: B
B8: Construction | F8: BC
B9: Refactoring | F9: C
B10: Integration Test | F10: CD
B11: Review | F11: D
B12: Sandbox | F12: F
B13: Postmortem
A14: Defect Types: | B14: Documentation
B15: Build | E15: Type | F15: Event
B16: Product syntax | F16: Response
B17: Product logic | E17: Origin | F17: Test Component
B18: Product interface | F18: Blackbox
B19: Product checking | F19: User
B20: Test syntax | F20: External Component (specify)
B21: Test logic | E21: Op Spec type | F21: User
B22: Test interface | F22: Interface
B23: Test checking
A24: Y/N: | B24: Yes
B25: No
A26: Proxy Types: | B26: Calculation
B27: Data
B28: I/O
B29: Logic
A30: Metaphysics: | B30: Object-oriented
B31: Functional
A32: Sizes: | B32: VS
B33: S
B34: M
B35: L
B36: VL
A37: Duration: | B37: LOCe x T
B38: LOCa x T
B39: Productivity
B42: Estimated | G42: Actual
A43: Base Components | B43: Base LOC | C43: Deleted LOC | D43: Modified LOC | E43: Added LOC | G43: Base LOC | H43: Deleted LOC | I43: Modified LOC | J43: Added LOC
A64: Totals | B64: =SUM(R[-20]C:R[-1]C) -> 0 | C64: =SUM(R[-20]C:R[-1]C) -> 0 | D64: =SUM(R[-20]C:R[-1]C) -> 0 | E64: =SUM(R[-20]C:R[-1]C) -> 0 | G64: =SUM(R[-20]C:R[-1]C) -> 0 | H64: =SUM(R[-20]C:R[-1]C) -> 0 | I64: =SUM(R[-20]C:R[-1]C) -> 0 | J64: =SUM(R[-20]C:R[-1]C) -> 0
B66: Estimated | G66: Actual
A67: New Components | B67: Method Count | C67: Rel Size | D67: LOCr | E67: Reuseable? | G67: Method Count | H67: LOCa | I67: Reusable?
D68: =IF(OR(ISBLANK(RC[-3]),ISBLANK(RC[-2]),ISBLANK(RC[-1])),0,HLOOKUP(RC[-1],'Historical Data'!R107C2:R109C6,3,FALSE)*RC[-2]) -> 0
D69: =IF(OR(ISBLANK(RC[-3]),ISBLANK(RC[-2]),ISBLANK(RC[-1])),0,HLOOKUP(RC[-1],'Historical Data'!R107C2:R109C6,3,FALSE)*RC[-2]) -> 0
D70: =IF(OR(ISBLANK(RC[-3]),ISBLANK(RC[-2]),ISBLANK(RC[-1])),0,HLOOKUP(RC[-1],'Historical Data'!R107C2:R109C6,3,FALSE)*RC[-2]) -> 0
D71: =IF(OR(ISBLANK(RC[-3]),ISBLANK(RC[-2]),ISBLANK(RC[-1])),0,HLOOKUP(RC[-1],'Historical Data'!R107C2:R109C6,3,FALSE)*RC[-2]) -> 0
D72: =IF(OR(ISBLANK(RC[-3]),ISBLANK(RC[-2]),ISBLANK(RC[-1])),0,HLOOKUP(RC[-1],'Historical Data'!R107C2:R109C6,3,FALSE)*RC[-2]) -> 0
D73: =IF(OR(ISBLANK(RC[-3]),ISBLANK(RC[-2]),ISBLANK(RC[-1])),0,HLOOKUP(RC[-1],'Historical Data'!R107C2:R109C6,3,FALSE)*RC[-2]) -> 0
D74: =IF(OR(ISBLANK(RC[-3]),ISBLANK(RC[-2]),ISBLANK(RC[-1])),0,HLOOKUP(RC[-1],'Historical Data'!R107C2:R109C6,3,FALSE)*RC[-2]) -> 0
D75: =IF(OR(ISBLANK(RC[-3]),ISBLANK(RC[-2]),ISBLANK(RC[-1])),0,HLOOKUP(RC[-1],'Historical Data'!R107C2:R109C6,3,FALSE)*RC[-2]) -> 0
D76: =IF(OR(ISBLANK(RC[-3]),ISBLANK(RC[-2]),ISBLANK(RC[-1])),0,HLOOKUP(RC[-1],'Historical Data'!R107C2:R109C6,3,FALSE)*RC[-2]) -> 0
D77: =IF(OR(ISBLANK(RC[-3]),ISBLANK(RC[-2]),ISBLANK(RC[-1])),0,HLOOKUP(RC[-1],'Historical Data'!R107C2:R109C6,3,FALSE)*RC[-2]) -> 0
D78: =IF(OR(ISBLANK(RC[-3]),ISBLANK(RC[-2]),ISBLANK(RC[-1])),0,HLOOKUP(RC[-1],'Historical Data'!R107C2:R109C6,3,FALSE)*RC[-2]) -> 0
D79: =IF(OR(ISBLANK(RC[-3]),ISBLANK(RC[-2]),ISBLANK(RC[-1])),0,HLOOKUP(RC[-1],'Historical Data'!R107C2:R109C6,3,FALSE)*RC[-2]) -> 0
D80: =IF(OR(ISBLANK(RC[-3]),ISBLANK(RC[-2]),ISBLANK(RC[-1])),0,HLOOKUP(RC[-1],'Historical Data'!R107C2:R109C6,3,FALSE)*RC[-2]) -> 0
D81: =IF(OR(ISBLANK(RC[-3]),ISBLANK(RC[-2]),ISBLANK(RC[-1])),0,HLOOKUP(RC[-1],'Historical Data'!R107C2:R109C6,3,FALSE)*RC[-2]) -> 0
D82: =IF(OR(ISBLANK(RC[-3]),ISBLANK(RC[-2]),ISBLANK(RC[-1])),0,HLOOKUP(RC[-1],'Historical Data'!R107C2:R109C6,3,FALSE)*RC[-2]) -> 0
D83: =IF(OR(ISBLANK(RC[-3]),ISBLANK(RC[-2]),ISBLANK(RC[-1])),0,HLOOKUP(RC[-1],'Historical Data'!R107C2:R109C6,3,FALSE)*RC[-2]) -> 0
D84: =IF(OR(ISBLANK(RC[-3]),ISBLANK(RC[-2]),ISBLANK(RC[-1])),0,HLOOKUP(RC[-1],'Historical Data'!R107C2:R109C6,3,FALSE)*RC[-2]) -> 0
D85: =IF(OR(ISBLANK(RC[-3]),ISBLANK(RC[-2]),ISBLANK(RC[-1])),0,HLOOKUP(RC[-1],'Historical Data'!R107C2:R109C6,3,FALSE)*RC[-2]) -> 0
D86: =IF(OR(ISBLANK(RC[-3]),ISBLANK(RC[-2]),ISBLANK(RC[-1])),0,HLOOKUP(RC[-1],'Historical Data'!R107C2:R109C6,3,FALSE)*RC[-2]) -> 0
D87: =IF(OR(ISBLANK(RC[-3]),ISBLANK(RC[-2]),ISBLANK(RC[-1])),0,HLOOKUP(RC[-1],'Historical Data'!R107C2:R109C6,3,FALSE)*RC[-2]) -> 0
A88: Totals | D88: =SUM(R[-20]C:R[-1]C) -> 0 | E88: =SUMIF(R[-20]C:R[-1]C,R[-64]C[-3],R[-20]C[-1]:R[-1]C[-1]) -> 0 | H88: =SUM(R[-20]C:R[-1]C) -> 0 | I88: =SUMIF(R[-20]C:R[-1]C,R[-64]C[-7],R[-20]C[-1]:R[-1]C[-1]) -> 0
B90: Estimated | C90: Actual
A91: Reused Parts | B91: LOC | C91: LOC
A97: Totals | B97: =SUM(R[-5]C:R[-1]C) -> 0 | C97: =SUM(R[-5]C:R[-1]C) -> 0
A99: Size Calculation
B100: LOCr= | D100: =R[-12]C+R[-36]C[1]+R[-36]C -> 0
B101: sum(LOCa)/sum(LOCr)= | D101: =IF(ISERR(SUM('Historical Data'!R[15]C:R[19]C)/SUM('Historical Data'!R[15]C[-2]:R[19]C[-2])),0,SUM('Historical Data'!R[15]C:R[19]C)/SUM('Historical Data'!R[15]C[-2]:R[19]C[-2])) -> 0
B102: LOCp= | D102: =CEILING(R[-2]C*R[-1]C,1) -> 0
B103: confidence= | D103: =IF(ISERR(CORREL('Historical Data'!R[13]C[-2]:R[17]C[-2],'Historical Data'!R[13]C:R[17]C)^2),0,CORREL('Historical Data'!R[13]C[-2]:R[17]C[-2],'Historical Data'!R[13]C:R[17]C)^2) -> 0 | E103: =IF(RC[-1]>=0.75,"High",IF(RC[-1]>=0.5,"Medium","Low")) -> Low
A105: Effort Calculation
B106: Productivity= | D106: ='Historical Data'!R[17]C[-2] -> 
B107: sum(Ea)/sum(LOCa)= | D107: =IF(ISERR(SUM('Historical Data'!R[9]C[2]:R[13]C[2])/SUM('Historical Data'!R[9]C:R[13]C)),0,SUM('Historical Data'!R[9]C[2]:R[13]C[2])/SUM('Historical Data'!R[9]C:R[13]C)) -> 0
B108: Ep= | D108: =CEILING(R[-6]C*R[-1]C,1) -> 0
B109: LPI= | D109: =FLOOR(R[-7]C*MIN('Historical Data'!R116C8:R119C8),1) -> 0
B110: UPI= | D110: =CEILING(R[-8]C*MAX('Historical Data'!R116C8:R119C8),1) -> 0
B111: confidence= | D111: =IF(ISERR(CORREL('Historical Data'!R[5]C[2]:R[9]C[2],'Historical Data'!R[5]C:R[9]C)^2),0,CORREL('Historical Data'!R[5]C[2]:R[9]C[2],'Historical Data'!R[5]C:R[9]C)^2) -> 0 | E111: =IF(MIN(RC[-1],R[-8]C[-1])>=0.75,"High",IF(MIN(RC[-1],R[-8]C[-1])>=0.5,"Medium","Low")) -> Low
A114: Estimation Override | B114: LOCp= | D114: =R[-12]C -> 0
B115: Ep= | D115: =R[-7]C -> 0
B116: Rationale for override:

Sheet: Plan
A1: =Constants!RC -> Constants | B1: =Constants!RC ->  | C1: =Constants!RC ->  | D1: =Constants!RC ->  | E1: =Constants!RC ->  | F1: =Constants!RC -> CA02
A2: =Constants!RC -> Start date: | B2: =Constants!RC -> 36526 | C2: =Constants!RC ->  | D2: =Constants!RC -> Grades: | E2: =Constants!RC -> AA | F2: =Constants!RC -> 1
A3: =Constants!RC -> End date: | B3: =Constants!RC -> 73051 | C3: =Constants!RC ->  | D3: =Constants!RC ->  | E3: =Constants!RC -> A | F3: =Constants!RC -> 0.95
A4: =Constants!RC -> Phases: | B4: =Constants!RC -> Analysis | C4: =Constants!RC ->  | D4: =Constants!RC ->  | E4: =Constants!RC -> AB | F4: =Constants!RC -> 0.9
A5: =Constants!RC ->  | B5: =Constants!RC -> Architecture | C5: =Constants!RC ->  | D5: =Constants!RC ->  | E5: =Constants!RC -> B | F5: =Constants!RC -> 0.85
A6: =Constants!RC ->  | B6: =Constants!RC -> Project planning | C6: =Constants!RC ->  | D6: =Constants!RC ->  | E6: =Constants!RC -> BC | F6: =Constants!RC -> 0.8
A7: =Constants!RC ->  | B7: =Constants!RC -> Interation planning | C7: =Constants!RC ->  | D7: =Constants!RC ->  | E7: =Constants!RC -> C | F7: =Constants!RC -> 0.75
A8: =Constants!RC ->  | B8: =Constants!RC -> Construction | C8: =Constants!RC ->  | D8: =Constants!RC ->  | E8: =Constants!RC -> CD | F8: =Constants!RC -> 0.7
A9: =Constants!RC ->  | B9: =Constants!RC -> Refactoring | C9: =Constants!RC ->  | D9: =Constants!RC ->  | E9: =Constants!RC -> D | F9: =Constants!RC -> 0.65
A10: =Constants!RC ->  | B10: =Constants!RC -> Review | C10: =Constants!RC ->  | D10: =Constants!RC ->  | E10: =Constants!RC -> F | F10: =Constants!RC -> 0.5
A11: =Constants!RC ->  | B11: =Constants!RC -> Integration test | C11: =Constants!RC ->  | D11: =Constants!RC ->  | E11: =Constants!RC ->  | F11: =Constants!RC -> 
A12: =Constants!RC ->  | B12: =Constants!RC -> Repatterning | C12: =Constants!RC ->  | D12: =Constants!RC ->  | E12: =Constants!RC ->  | F12: =Constants!RC -> 
A13: =Constants!RC ->  | B13: =Constants!RC -> Postmortem | C13: =Constants!RC ->  | D13: =Constants!RC ->  | E13: =Constants!RC ->  | F13: =Constants!RC -> 
A14: =Constants!RC ->  | B14: =Constants!RC -> Sandbox | C14: =Constants!RC ->  | D14: =Constants!RC ->  | E14: =Constants!RC ->  | F14: =Constants!RC -> 
A15: =Constants!RC ->  | B15: =Constants!RC ->  | C15: =Constants!RC ->  | D15: =Constants!RC ->  | E15: =Constants!RC ->  | F15: =Constants!RC -> 
A16: =Constants!RC ->  | B16: =Constants!RC ->  | C16: =Constants!RC ->  | D16: =Constants!RC ->  | E16: =Constants!RC ->  | F16: =Constants!RC -> 
A17: =Constants!RC ->  | B17: =Constants!RC ->  | C17: =Constants!RC ->  | D17: =Constants!RC ->  | E17: =Constants!RC ->  | F17: =Constants!RC -> 
A18: =Constants!RC ->  | B18: =Constants!RC ->  | C18: =Constants!RC ->  | D18: =Constants!RC ->  | E18: =Constants!RC ->  | F18: =Constants!RC -> 
A19: =Constants!RC -> Defect Types: | B19: =Constants!RC -> Requirements Change | C19: =Constants!RC -> Changes to requirements | D19: =Constants!RC -> Iteration | E19: =Constants!RC -> NA | F19: =Constants!RC -> did not follow
A20: =Constants!RC ->  | B20: =Constants!RC -> Requirements Clarification | C20: =Constants!RC -> Clarifications to requirements | D20: =Constants!RC ->  | E20: =Constants!RC -> 1 | F20: =Constants!RC -> very painful
A21: =Constants!RC ->  | B21: =Constants!RC -> Product syntax | C21: =Constants!RC -> Syntax flaws in the deliverable product | D21: =Constants!RC ->  | E21: =Constants!RC -> 2 | F21: =Constants!RC -> painful
A22: =Constants!RC ->  | B22: =Constants!RC -> Product logic | C22: =Constants!RC -> Logic flaws in the deliverable product | D22: =Constants!RC ->  | E22: =Constants!RC -> 3 | F22: =Constants!RC -> neutral
A23: =Constants!RC ->  | B23: =Constants!RC -> Product interface | C23: =Constants!RC -> Flaws in the interface of a component of the deliverable product | D23: =Constants!RC ->  | E23: =Constants!RC -> 4 | F23: =Constants!RC -> helpful
A24: =Constants!RC ->  | B24: =Constants!RC -> Product checking | C24: =Constants!RC -> Flaws with boundary/type checking within a component of the deliverable product | D24: =Constants!RC ->  | E24: =Constants!RC -> 5 | F24: =Constants!RC -> very helpful
A25: =Constants!RC ->  | B25: =Constants!RC -> Test syntax | C25: =Constants!RC -> Syntax flaws in the test code | D25: =Constants!RC ->  | E25: =Constants!RC -> 6 | F25: =Constants!RC -> 
A26: =Constants!RC ->  | B26: =Constants!RC -> Test logic | C26: =Constants!RC -> Logic flaws in the test code | D26: =Constants!RC ->  | E26: =Constants!RC -> 7 | F26: =Constants!RC -> 
A27: =Constants!RC ->  | B27: =Constants!RC -> Test interface | C27: =Constants!RC -> Flaws in the interface of a component of the test code | D27: =Constants!RC ->  | E27: =Constants!RC -> 8 | F27: =Constants!RC -> 
A28: =Constants!RC ->  | B28: =Constants!RC -> Test checking | C28: =Constants!RC -> Flaws with boundary/type checking within a component of the test code | D28: =Constants!RC ->  | E28: =Constants!RC -> 9 | F28: =Constants!RC -> 
A29: =Constants!RC ->  | B29: =Constants!RC -> Bad Smell | C29: =Constants!RC -> Refactoring changes (please note the bad smell in the defect description) | D29: =Constants!RC ->  | E29: =Constants!RC -> 10 | F29: =Constants!RC -> 0
A30: =Constants!RC -> Y/N: | B30: =Constants!RC -> Yes | C30: =Constants!RC ->  | D30: =Constants!RC ->  | E30: =Constants!RC -> Passed | F30: =Constants!RC -> 0
A31: =Constants!RC ->  | B31: =Constants!RC -> No | C31: =Constants!RC ->  | D31: =Constants!RC ->  | E31: =Constants!RC -> Passed with issues | F31: =Constants!RC -> 0
A32: =Constants!RC -> Proxy Types: | B32: =Constants!RC -> - | C32: =Constants!RC ->  | D32: =Constants!RC ->  | E32: =Constants!RC -> Failed | F32: =Constants!RC -> 
A33: =Constants!RC ->  | B33: =Constants!RC -> Calculation | C33: =Constants!RC ->  | D33: =Constants!RC ->  | E33: =Constants!RC -> Not tested | F33: =Constants!RC -> 
A34: =Constants!RC ->  | B34: =Constants!RC -> Data | C34: =Constants!RC ->  | D34: =Constants!RC ->  | E34: =Constants!RC -> Not applicable | F34: =Constants!RC -> 
A35: =Constants!RC ->  | B35: =Constants!RC -> I/O | C35: =Constants!RC ->  | D35: =Constants!RC ->  | E35: =Constants!RC ->  | F35: =Constants!RC -> 
A36: =Constants!RC ->  | B36: =Constants!RC -> Logic | C36: =Constants!RC ->  | D36: =Constants!RC ->  | E36: =Constants!RC ->  | F36: =Constants!RC -> 
A37: =Constants!RC ->  | B37: =Constants!RC ->  | C37: =Constants!RC ->  | D37: =Constants!RC ->  | E37: =Constants!RC ->  | F37: =Constants!RC -> 
A38: =Constants!RC -> Sizes: | B38: =Constants!RC -> VS | C38: =Constants!RC -> S | D38: =Constants!RC -> M | E38: =Constants!RC -> L | F38: =Constants!RC -> VL
A39: =Constants!RC -> upper | B39: =Constants!RC -> -1.5 | C39: =Constants!RC -> -0.5 | D39: =Constants!RC -> 0.5 | E39: =Constants!RC -> 1.5 | F39: =Constants!RC -> 99999
A40: =Constants!RC -> mid | B40: =Constants!RC -> -2 | C40: =Constants!RC -> -1 | D40: =Constants!RC -> 0 | E40: =Constants!RC -> 1 | F40: =Constants!RC -> 2
A41: =Constants!RC -> lower | B41: =Constants!RC -> 0 | C41: =Constants!RC -> -1.5 | D41: =Constants!RC -> -0.5 | E41: =Constants!RC -> 0.5 | F41: =Constants!RC -> 1.5
A42: =Constants!RC ->  | B42: =Constants!RC -> 0 | C42: =Constants!RC -> 0 | D42: =Constants!RC -> 0 | E42: =Constants!RC -> 0 | F42: =Constants!RC -> 
A43: =Constants!RC ->  | B43: =Constants!RC ->  | C43: =Constants!RC ->  | D43: =Constants!RC ->  | E43: =Constants!RC ->  | F43: =Constants!RC -> 
A44: =Constants!RC -> <-- Mandatory | B44: =Constants!RC ->  | C44: =Constants!RC -> ✔ | D44: =Constants!RC ->  | E44: =Constants!RC ->  | F44: =Constants!RC -> 
A45: Project Plan Summary
A46: Use this worksheet to record how much production code you plan to write and the amount of time to write it. Record the actual size once the project is complete. The actual time will be calculated from the Time Log. Please note that you are not being evaluated on how close your planned values to your actual values.
A47: Program Size (LOC) | C47: Plan | D47: Actual | E47: To Date
A48: ='Historical Data'!R[4]C -> Base code LOC count | C48: 0 | D48: 0 | E48: =RC[-1]+'Historical Data'!R[4]C -> 0
A49: ='Historical Data'!R[4]C -> Lines deleted from Base | C49: 37 | D49: 0 | E49: =RC[-1]+'Historical Data'!R[4]C -> 0
A50: ='Historical Data'!R[4]C -> Lines modified from Base | C50: 0 | D50: 0 | E50: =RC[-1]+'Historical Data'!R[4]C -> 0
A51: ='Historical Data'!R[4]C -> Lines added to Base | C51: 0 | D51: 0 | E51: =RC[-1]+'Historical Data'!R[4]C -> 0
A52: ='Historical Data'!R[4]C -> Reused lines | E52: =RC[-1]+'Historical Data'!R[4]C -> 0
A53: ='Historical Data'!R[4]C -> New component lines of code | C53: 100 | D53: 103 | E53: =RC[-1]+'Historical Data'!R[4]C -> 103
A55: Component Count | C55: Plan | D55: Actual | E55: To Date
A56: ='Historical Data'!R[4]C -> Base components | C56: 100 | D56: 103 | E56: =RC[-1]+'Historical Data'!R[4]C -> 103
A57: ='Historical Data'!R[4]C -> Modified components | E57: =RC[-1]+'Historical Data'!R[4]C -> 0
A58: ='Historical Data'!R[4]C -> New components | E58: =RC[-1]+'Historical Data'!R[4]C -> 0
A60: Time In Phase (minutes) | C60: Plan | D60: Actual | E60: Actual to Date | F60: Actual to Date %
A61: =R[-57]C[1] -> Analysis | C61: =IF(R1C6="CA01","",R72C3*'Historical Data'!R[4]C[3]) -> 0 | D61: =SUMIF('Time Log'!R48C6:R137C6,RC[-3],'Time Log'!R48C5:R137C5) -> 30.000000000000053 | E61: =RC[-1]+'Historical Data'!R[4]C -> 30.000000000000053 | F61: =IF(R72C5=0,0,RC[-1]/R72C5) -> 9.8360655737705055E-2
A62: =R[-57]C[1] -> Architecture | C62: =IF(R1C6="CA01","",R72C3*'Historical Data'!R[4]C[3]) -> 0 | D62: =SUMIF('Time Log'!R48C6:R137C6,RC[-3],'Time Log'!R48C5:R137C5) -> 9.9999999999999645 | E62: =RC[-1]+'Historical Data'!R[4]C -> 9.9999999999999645 | F62: =IF(R72C5=0,0,RC[-1]/R72C5) -> 3.2786885245901509E-2
A63: =R[-57]C[1] -> Project planning | C63: =IF(R1C6="CA01","",R72C3*'Historical Data'!R[4]C[3]) -> 0 | D63: =SUMIF('Time Log'!R48C6:R137C6,RC[-3],'Time Log'!R48C5:R137C5) -> 10.000000000000044 | E63: =RC[-1]+'Historical Data'!R[4]C -> 10.000000000000044 | F63: =IF(R72C5=0,0,RC[-1]/R72C5) -> 3.2786885245901773E-2
A64: =R[-57]C[1] -> Interation planning | C64: =IF(R1C6="CA01","",R72C3*'Historical Data'!R[4]C[3]) -> 0 | D64: =SUMIF('Time Log'!R48C6:R137C6,RC[-3],'Time Log'!R48C5:R137C5) -> 15.000000000000027 | E64: =RC[-1]+'Historical Data'!R[4]C -> 15.000000000000027 | F64: =IF(R72C5=0,0,RC[-1]/R72C5) -> 4.9180327868852527E-2
A65: =R[-57]C[1] -> Construction | C65: =IF(R1C6="CA01","",R72C3*'Historical Data'!R[4]C[3]) -> 0 | D65: =SUMIF('Time Log'!R48C6:R137C6,RC[-3],'Time Log'!R48C5:R137C5) -> 210 | E65: =RC[-1]+'Historical Data'!R[4]C -> 210 | F65: =IF(R72C5=0,0,RC[-1]/R72C5) -> 0.68852459016393419
A66: =R[-57]C[1] -> Refactoring | C66: =IF(R1C6="CA01","",R72C3*'Historical Data'!R[4]C[3]) -> 0 | D66: =SUMIF('Time Log'!R48C6:R137C6,RC[-3],'Time Log'!R48C5:R137C5) -> 0 | E66: =RC[-1]+'Historical Data'!R[4]C -> 0 | F66: =IF(R72C5=0,0,RC[-1]/R72C5) -> 0
A67: =R[-57]C[1] -> Review | C67: =IF(R1C6="CA01","",R72C3*'Historical Data'!R[4]C[3]) -> 0 | D67: =SUMIF('Time Log'!R48C6:R137C6,RC[-3],'Time Log'!R48C5:R137C5) -> 29.999999999999972 | E67: =RC[-1]+'Historical Data'!R[4]C -> 29.999999999999972 | F67: =IF(R72C5=0,0,RC[-1]/R72C5) -> 9.8360655737704791E-2
A68: =R[-57]C[1] -> Integration test | C68: =IF(R1C6="CA01","",R72C3*'Historical Data'!R[4]C[3]) -> 0 | D68: =SUMIF('Time Log'!R48C6:R137C6,RC[-3],'Time Log'!R48C5:R137C5) -> 0 | E68: =RC[-1]+'Historical Data'!R[4]C -> 0 | F68: =IF(R72C5=0,0,RC[-1]/R72C5) -> 0
A69: =R[-57]C[1] -> Repatterning | C69: =IF(R1C6="CA01","",R72C3*'Historical Data'!R[4]C[3]) -> 0 | D69: =SUMIF('Time Log'!R48C6:R137C6,RC[-3],'Time Log'!R48C5:R137C5) -> 0 | E69: =RC[-1]+'Historical Data'!R[4]C -> 0 | F69: =IF(R72C5=0,0,RC[-1]/R72C5) -> 0
A70: =R[-57]C[1] -> Postmortem | C70: =IF(R1C6="CA01","",R72C3*'Historical Data'!R[4]C[3]) -> 0 | D70: =SUMIF('Time Log'!R48C6:R137C6,RC[-3],'Time Log'!R48C5:R137C5) -> 0 | E70: =RC[-1]+'Historical Data'!R[4]C -> 0 | F70: =IF(R72C5=0,0,RC[-1]/R72C5) -> 0
A71: =R[-57]C[1] -> Sandbox | C71: =IF(R1C6="CA01","",R72C3*'Historical Data'!R[4]C[3]) -> 0 | D71: =SUMIF('Time Log'!R48C6:R137C6,RC[-3],'Time Log'!R48C5:R137C5) -> 0 | E71: =RC[-1]+'Historical Data'!R[4]C -> 0 | F71: =IF(R72C5=0,0,RC[-1]/R72C5) -> 0
A72: TOTAL | C72: 360 | D72: =SUM(R[-11]C:R[-1]C) -> 305.00000000000011 | E72: =RC[-1]+'Historical Data'!R[4]C -> 305.00000000000011 | F72: =IF(R72C5=0,0,RC[-1]/R72C5) -> 1
A74: Changes Injected | D74: Actual | E74: Actual to Date | F74: Actual to Date %
A75: =R[-71]C[1] -> Analysis | D75: =COUNTIF('Change Log'!R60C4:R134C4,RC[-3]) -> 0 | E75: =RC[-1]+'Historical Data'!R[4]C -> 0 | F75: =IF(RC[-1]=0,0,RC[-1]/R86C5) -> 0
A76: =R[-71]C[1] -> Architecture | D76: =COUNTIF('Change Log'!R60C4:R134C4,RC[-3]) -> 0 | E76: =RC[-1]+'Historical Data'!R[4]C -> 0 | F76: =IF(RC[-1]=0,0,RC[-1]/R86C5) -> 0
A77: =R[-71]C[1] -> Project planning | D77: =COUNTIF('Change Log'!R60C4:R134C4,RC[-3]) -> 0 | E77: =RC[-1]+'Historical Data'!R[4]C -> 0 | F77: =IF(RC[-1]=0,0,RC[-1]/R86C5) -> 0
A78: =R[-71]C[1] -> Interation planning | D78: =COUNTIF('Change Log'!R60C4:R134C4,RC[-3]) -> 0 | E78: =RC[-1]+'Historical Data'!R[4]C -> 0 | F78: =IF(RC[-1]=0,0,RC[-1]/R86C5) -> 0
A79: =R[-71]C[1] -> Construction | D79: =COUNTIF('Change Log'!R60C4:R134C4,RC[-3]) -> 5 | E79: =RC[-1]+'Historical Data'!R[4]C -> 5 | F79: =IF(RC[-1]=0,0,RC[-1]/R86C5) -> 1
A80: =R[-71]C[1] -> Refactoring | D80: =COUNTIF('Change Log'!R60C4:R134C4,RC[-3]) -> 0 | E80: =RC[-1]+'Historical Data'!R[4]C -> 0 | F80: =IF(RC[-1]=0,0,RC[-1]/R86C5) -> 0
A81: =R[-71]C[1] -> Review | D81: =COUNTIF('Change Log'!R60C4:R134C4,RC[-3]) -> 0 | E81: =RC[-1]+'Historical Data'!R[4]C -> 0 | F81: =IF(RC[-1]=0,0,RC[-1]/R86C5) -> 0
A82: =R[-71]C[1] -> Integration test | D82: =COUNTIF('Change Log'!R60C4:R134C4,RC[-3]) -> 0 | E82: =RC[-1]+'Historical Data'!R[4]C -> 0 | F82: =IF(RC[-1]=0,0,RC[-1]/R86C5) -> 0
A83: =R[-71]C[1] -> Repatterning | D83: =COUNTIF('Change Log'!R60C4:R134C4,RC[-3]) -> 0 | E83: =RC[-1]+'Historical Data'!R[4]C -> 0 | F83: =IF(RC[-1]=0,0,RC[-1]/R86C5) -> 0
A84: =R[-71]C[1] -> Postmortem | D84: =COUNTIF('Change Log'!R60C4:R134C4,RC[-3]) -> 0 | E84: =RC[-1]+'Historical Data'!R[4]C -> 0 | F84: =IF(RC[-1]=0,0,RC[-1]/R86C5) -> 0
A85: =R[-71]C[1] -> Sandbox | D85: =COUNTIF('Change Log'!R60C4:R134C4,RC[-3]) -> 0 | E85: =RC[-1]+'Historical Data'!R[4]C -> 0 | F85: =IF(RC[-1]=0,0,RC[-1]/R86C5) -> 0
A86: TOTAL | D86: =SUM(R[-11]C:R[-1]C) -> 5 | E86: =RC[-1]+'Historical Data'!R[4]C -> 5 | F86: =IF(RC[-1]=0,0,RC[-1]/R86C5) -> 1
A88: Changes Implemented | D88: Actual | E88: Actual to Date | F88: Actual to Date %
A89: =R[-85]C[1] -> Analysis | D89: =COUNTIF('Change Log'!R60C6:R134C6,RC[-3]) -> 0 | E89: =RC[-1]+'Historical Data'!R[4]C -> 0 | F89: =IF(RC[-1]=0,0,RC[-1]/R100C5) -> 0
A90: =R[-85]C[1] -> Architecture | D90: =COUNTIF('Change Log'!R60C6:R134C6,RC[-3]) -> 0 | E90: =RC[-1]+'Historical Data'!R[4]C -> 0 | F90: =IF(RC[-1]=0,0,RC[-1]/R100C5) -> 0
A91: =R[-85]C[1] -> Project planning | D91: =COUNTIF('Change Log'!R60C6:R134C6,RC[-3]) -> 0 | E91: =RC[-1]+'Historical Data'!R[4]C -> 0 | F91: =IF(RC[-1]=0,0,RC[-1]/R100C5) -> 0
A92: =R[-85]C[1] -> Interation planning | D92: =COUNTIF('Change Log'!R60C6:R134C6,RC[-3]) -> 0 | E92: =RC[-1]+'Historical Data'!R[4]C -> 0 | F92: =IF(RC[-1]=0,0,RC[-1]/R100C5) -> 0
A93: =R[-85]C[1] -> Construction | D93: =COUNTIF('Change Log'!R60C6:R134C6,RC[-3]) -> 0 | E93: =RC[-1]+'Historical Data'!R[4]C -> 0 | F93: =IF(RC[-1]=0,0,RC[-1]/R100C5) -> 0
A94: =R[-85]C[1] -> Refactoring | D94: =COUNTIF('Change Log'!R60C6:R134C6,RC[-3]) -> 0 | E94: =RC[-1]+'Historical Data'!R[4]C -> 0 | F94: =IF(RC[-1]=0,0,RC[-1]/R100C5) -> 0
A95: =R[-85]C[1] -> Review | D95: =COUNTIF('Change Log'!R60C6:R134C6,RC[-3]) -> 3 | E95: =RC[-1]+'Historical Data'!R[4]C -> 3 | F95: =IF(RC[-1]=0,0,RC[-1]/R100C5) -> 1
A96: =R[-85]C[1] -> Integration test | D96: =COUNTIF('Change Log'!R60C6:R134C6,RC[-3]) -> 0 | E96: =RC[-1]+'Historical Data'!R[4]C -> 0 | F96: =IF(RC[-1]=0,0,RC[-1]/R100C5) -> 0
A97: =R[-85]C[1] -> Repatterning | D97: =COUNTIF('Change Log'!R60C6:R134C6,RC[-3]) -> 0 | E97: =RC[-1]+'Historical Data'!R[4]C -> 0 | F97: =IF(RC[-1]=0,0,RC[-1]/R100C5) -> 0
A98: =R[-85]C[1] -> Postmortem | D98: =COUNTIF('Change Log'!R60C6:R134C6,RC[-3]) -> 0 | E98: =RC[-1]+'Historical Data'!R[4]C -> 0 | F98: =IF(RC[-1]=0,0,RC[-1]/R100C5) -> 0
A99: =R[-85]C[1] -> Sandbox | D99: =COUNTIF('Change Log'!R60C6:R134C6,RC[-3]) -> 0 | E99: =RC[-1]+'Historical Data'!R[4]C -> 0 | F99: =IF(RC[-1]=0,0,RC[-1]/R100C5) -> 0
A100: TOTAL | D100: =SUM(R[-11]C:R[-1]C) -> 3 | E100: =RC[-1]+'Historical Data'!R[4]C -> 3 | F100: =IF(RC[-1]=0,0,RC[-1]/R100C5) -> 1

Sheet: Iterations
A1: Iterations
A3: Standards
A4: Start date: | B4: 2000-01-01T00:00:00.000
A5: End date: | B5: 2025-01-01T00:00:00.000
A6: Phases: | B6: Planning
B7: Design
B8: Design Review
B9: Code
B10: Code Review
B11: Compile
B12: Test
B13: Postmortem
B14: Documentation
B15: Syntax
A16: Defect Types: | B16: Build, Package
B17: Assignment
B18: Interface
B19: Checking
B20: Data
B21: Function
B22: System
B23: Environment
A24: Y/N: | B24: Yes
B25: No
A26: Proxy Types: | B26: Calculation
B27: Data
B28: I/O
B29: Logic
D31: estimation methods | E31: A
A32: Sizes: | B32: VS | E32: B
B33: S | E33: C
B34: M | E34: D
B35: L
B36: VL
A37: Duration: | B37: LOCe x T
B38: LOCa x T
B39: Productivity
A43: Component-Iteration Map
B44: Component | C44: Iteration 1 | D44: Iteration 2 | E44: Iteration 3 | F44: Iteration 4 | G44: Iteration 5 | H44: Iteration 6 | I44: Iteration 7 | J44: Iteration 8 | K44: Iteration 9 | L44: Iteration 10
A45: Base Components | B45: =IF(ISBLANK(Estimation!R[-1]C[-1]),"",Estimation!R[-1]C[-1]) ->  | M45: =SUM(RC[-10]:RC[-1]) -> 0
B46: =IF(ISBLANK(Estimation!R[-1]C[-1]),"",Estimation!R[-1]C[-1]) ->  | M46: =SUM(RC[-10]:RC[-1]) -> 0
B47: =IF(ISBLANK(Estimation!R[-1]C[-1]),"",Estimation!R[-1]C[-1]) ->  | M47: =SUM(RC[-10]:RC[-1]) -> 0
B48: =IF(ISBLANK(Estimation!R[-1]C[-1]),"",Estimation!R[-1]C[-1]) ->  | M48: =SUM(RC[-10]:RC[-1]) -> 0
B49: =IF(ISBLANK(Estimation!R[-1]C[-1]),"",Estimation!R[-1]C[-1]) ->  | M49: =SUM(RC[-10]:RC[-1]) -> 0
B50: =IF(ISBLANK(Estimation!R[-1]C[-1]),"",Estimation!R[-1]C[-1]) ->  | M50: =SUM(RC[-10]:RC[-1]) -> 0
B51: =IF(ISBLANK(Estimation!R[-1]C[-1]),"",Estimation!R[-1]C[-1]) ->  | M51: =SUM(RC[-10]:RC[-1]) -> 0
B52: =IF(ISBLANK(Estimation!R[-1]C[-1]),"",Estimation!R[-1]C[-1]) ->  | M52: =SUM(RC[-10]:RC[-1]) -> 0
B53: =IF(ISBLANK(Estimation!R[-1]C[-1]),"",Estimation!R[-1]C[-1]) ->  | M53: =SUM(RC[-10]:RC[-1]) -> 0
B54: =IF(ISBLANK(Estimation!R[-1]C[-1]),"",Estimation!R[-1]C[-1]) ->  | M54: =SUM(RC[-10]:RC[-1]) -> 0
A56: New Components | B56: =IF(ISBLANK(Estimation!R[12]C[-1]),"",Estimation!R[12]C[-1]) ->  | M56: =SUM(RC[-10]:RC[-1]) -> 0
B57: =IF(ISBLANK(Estimation!R[12]C[-1]),"",Estimation!R[12]C[-1]) ->  | M57: =SUM(RC[-10]:RC[-1]) -> 0
B58: =IF(ISBLANK(Estimation!R[12]C[-1]),"",Estimation!R[12]C[-1]) ->  | M58: =SUM(RC[-10]:RC[-1]) -> 0
B59: =IF(ISBLANK(Estimation!R[12]C[-1]),"",Estimation!R[12]C[-1]) ->  | M59: =SUM(RC[-10]:RC[-1]) -> 0
B60: =IF(ISBLANK(Estimation!R[12]C[-1]),"",Estimation!R[12]C[-1]) ->  | M60: =SUM(RC[-10]:RC[-1]) -> 0
B61: =IF(ISBLANK(Estimation!R[12]C[-1]),"",Estimation!R[12]C[-1]) ->  | M61: =SUM(RC[-10]:RC[-1]) -> 0
B62: =IF(ISBLANK(Estimation!R[12]C[-1]),"",Estimation!R[12]C[-1]) ->  | M62: =SUM(RC[-10]:RC[-1]) -> 0
B63: =IF(ISBLANK(Estimation!R[12]C[-1]),"",Estimation!R[12]C[-1]) ->  | M63: =SUM(RC[-10]:RC[-1]) -> 0
B64: =IF(ISBLANK(Estimation!R[12]C[-1]),"",Estimation!R[12]C[-1]) ->  | M64: =SUM(RC[-10]:RC[-1]) -> 0
B65: =IF(ISBLANK(Estimation!R[12]C[-1]),"",Estimation!R[12]C[-1]) ->  | M65: =SUM(RC[-10]:RC[-1]) -> 0
B66: =IF(ISBLANK(Estimation!R[12]C[-1]),"",Estimation!R[12]C[-1]) ->  | M66: =SUM(RC[-10]:RC[-1]) -> 0
B67: =IF(ISBLANK(Estimation!R[12]C[-1]),"",Estimation!R[12]C[-1]) ->  | M67: =SUM(RC[-10]:RC[-1]) -> 0
B68: =IF(ISBLANK(Estimation!R[12]C[-1]),"",Estimation!R[12]C[-1]) ->  | M68: =SUM(RC[-10]:RC[-1]) -> 0
B69: =IF(ISBLANK(Estimation!R[12]C[-1]),"",Estimation!R[12]C[-1]) ->  | M69: =SUM(RC[-10]:RC[-1]) -> 0
B70: =IF(ISBLANK(Estimation!R[12]C[-1]),"",Estimation!R[12]C[-1]) ->  | M70: =SUM(RC[-10]:RC[-1]) -> 0
B71: =IF(ISBLANK(Estimation!R[12]C[-1]),"",Estimation!R[12]C[-1]) ->  | M71: =SUM(RC[-10]:RC[-1]) -> 0
B72: =IF(ISBLANK(Estimation!R[12]C[-1]),"",Estimation!R[12]C[-1]) ->  | M72: =SUM(RC[-10]:RC[-1]) -> 0
B73: =IF(ISBLANK(Estimation!R[12]C[-1]),"",Estimation!R[12]C[-1]) ->  | M73: =SUM(RC[-10]:RC[-1]) -> 0
B74: =IF(ISBLANK(Estimation!R[12]C[-1]),"",Estimation!R[12]C[-1]) ->  | M74: =SUM(RC[-10]:RC[-1]) -> 0
B75: =IF(ISBLANK(Estimation!R[12]C[-1]),"",Estimation!R[12]C[-1]) ->  | M75: =SUM(RC[-10]:RC[-1]) -> 0
B76: Number of tasks: | C76: =SUM(R[-31]C:R[-1]C) -> 0 | D76: =SUM(R[-31]C:R[-1]C) -> 0 | E76: =SUM(R[-31]C:R[-1]C) -> 0 | F76: =SUM(R[-31]C:R[-1]C) -> 0 | G76: =SUM(R[-31]C:R[-1]C) -> 0 | H76: =SUM(R[-31]C:R[-1]C) -> 0 | I76: =SUM(R[-31]C:R[-1]C) -> 0 | J76: =SUM(R[-31]C:R[-1]C) -> 0 | K76: =SUM(R[-31]C:R[-1]C) -> 0 | L76: =SUM(R[-31]C:R[-1]C) -> 0 | M76: =SUM(RC[-10]:RC[-1]) -> 0
B77: Effort: | C77: =IF(SUM(R[-1]C3:R[-1]C12)=0,,(R[-1]C/SUM(R[-1]C3:R[-1]C12)*Estimation!R115C4)) -> 0 | D77: =IF(SUM(R[-1]C3:R[-1]C12)=0,,(R[-1]C/SUM(R[-1]C3:R[-1]C12)*Estimation!R115C4)) -> 0 | E77: =IF(SUM(R[-1]C3:R[-1]C12)=0,,(R[-1]C/SUM(R[-1]C3:R[-1]C12)*Estimation!R115C4)) -> 0 | F77: =IF(SUM(R[-1]C3:R[-1]C12)=0,,(R[-1]C/SUM(R[-1]C3:R[-1]C12)*Estimation!R115C4)) -> 0 | G77: =IF(SUM(R[-1]C3:R[-1]C12)=0,,(R[-1]C/SUM(R[-1]C3:R[-1]C12)*Estimation!R115C4)) -> 0 | H77: =IF(SUM(R[-1]C3:R[-1]C12)=0,,(R[-1]C/SUM(R[-1]C3:R[-1]C12)*Estimation!R115C4)) -> 0 | I77: =IF(SUM(R[-1]C3:R[-1]C12)=0,,(R[-1]C/SUM(R[-1]C3:R[-1]C12)*Estimation!R115C4)) -> 0 | J77: =IF(SUM(R[-1]C3:R[-1]C12)=0,,(R[-1]C/SUM(R[-1]C3:R[-1]C12)*Estimation!R115C4)) -> 0 | K77: =IF(SUM(R[-1]C3:R[-1]C12)=0,,(R[-1]C/SUM(R[-1]C3:R[-1]C12)*Estimation!R115C4)) -> 0 | L77: =IF(SUM(R[-1]C3:R[-1]C12)=0,,(R[-1]C/SUM(R[-1]C3:R[-1]C12)*Estimation!R115C4)) -> 0 | M77: =SUM(RC[-10]:RC[-1]) -> 0
A79: WBS
B80: Iteration Number | C80: Planned Effort (minutes) | D80: Cumulative Planned Effort | E80: Planned Velocity | F80: Cumulative Planned Velocity | G80: Planned Completion Date
B81: 1 | D81: =RC[-1] -> 0 | F81: =RC[-1] -> 0
B82: 2 | D82: =RC[-1]+R[-1]C -> 0 | F82: =RC[-1]+R[-1]C -> 0
B83: 3 | D83: =RC[-1]+R[-1]C -> 0 | F83: =RC[-1]+R[-1]C -> 0
B84: 4 | D84: =RC[-1]+R[-1]C -> 0 | F84: =RC[-1]+R[-1]C -> 0
B85: 5 | D85: =RC[-1]+R[-1]C -> 0 | F85: =RC[-1]+R[-1]C -> 0
B86: 6 | D86: =RC[-1]+R[-1]C -> 0 | F86: =RC[-1]+R[-1]C -> 0
B87: 7 | D87: =RC[-1]+R[-1]C -> 0 | F87: =RC[-1]+R[-1]C -> 0
B88: 8 | D88: =RC[-1]+R[-1]C -> 0 | F88: =RC[-1]+R[-1]C -> 0
B89: 9 | D89: =RC[-1]+R[-1]C -> 0 | F89: =RC[-1]+R[-1]C -> 0
B90: 10 | D90: =RC[-1]+R[-1]C -> 0 | F90: =RC[-1]+R[-1]C -> 0
A92: Calendar
B93: Day # | C93: Date | D93: Available Minutes | E93: Cumulative Minutes | F93: Planned Velocity | G93: Cumulative Planned Velocity
B94: 1 | C94: due date - 24 | E94: =RC[-1] -> 0 | G94: =RC[-1] -> 0
B95: 2 | C95: due date - 23 | E95: =RC[-1]+R[-1]C -> 0 | G95: =RC[-1]+R[-1]C -> 0
B96: 3 | C96: due date - 22 | E96: =RC[-1]+R[-1]C -> 0 | G96: =RC[-1]+R[-1]C -> 0
B97: 4 | C97: due date - 21 | E97: =RC[-1]+R[-1]C -> 0 | G97: =RC[-1]+R[-1]C -> 0
B98: 5 | C98: due date - 20 | E98: =RC[-1]+R[-1]C -> 0 | G98: =RC[-1]+R[-1]C -> 0
B99: 6 | C99: due date - 19 | E99: =RC[-1]+R[-1]C -> 0 | G99: =RC[-1]+R[-1]C -> 0
B100: 7 | C100: due date - 18 | E100: =RC[-1]+R[-1]C -> 0 | G100: =RC[-1]+R[-1]C -> 0
B101: 8 | C101: due date - 17 | E101: =RC[-1]+R[-1]C -> 0 | G101: =RC[-1]+R[-1]C -> 0
B102: 9 | C102: due date - 16 | E102: =RC[-1]+R[-1]C -> 0 | G102: =RC[-1]+R[-1]C -> 0
B103: 10 | C103: due date - 15 | E103: =RC[-1]+R[-1]C -> 0 | G103: =RC[-1]+R[-1]C -> 0
B104: 11 | C104: due date - 14 | E104: =RC[-1]+R[-1]C -> 0 | G104: =RC[-1]+R[-1]C -> 0
B105: 12 | C105: due date - 13 | E105: =RC[-1]+R[-1]C -> 0 | G105: =RC[-1]+R[-1]C -> 0
B106: 13 | C106: due date - 12 | E106: =RC[-1]+R[-1]C -> 0 | G106: =RC[-1]+R[-1]C -> 0
B107: 14 | C107: due date - 11 | E107: =RC[-1]+R[-1]C -> 0 | G107: =RC[-1]+R[-1]C -> 0
B108: 15 | C108: due date - 10 | E108: =RC[-1]+R[-1]C -> 0 | G108: =RC[-1]+R[-1]C -> 0
B109: 16 | C109: due date - 9 | E109: =RC[-1]+R[-1]C -> 0 | G109: =RC[-1]+R[-1]C -> 0
B110: 17 | C110: due date - 8 | E110: =RC[-1]+R[-1]C -> 0 | G110: =RC[-1]+R[-1]C -> 0
B111: 18 | C111: due date - 7 | E111: =RC[-1]+R[-1]C -> 0 | G111: =RC[-1]+R[-1]C -> 0
B112: 19 | C112: due date - 6 | E112: =RC[-1]+R[-1]C -> 0 | G112: =RC[-1]+R[-1]C -> 0
B113: 20 | C113: due date - 5 | E113: =RC[-1]+R[-1]C -> 0 | G113: =RC[-1]+R[-1]C -> 0
B114: 21 | C114: due date - 4 | E114: =RC[-1]+R[-1]C -> 0 | G114: =RC[-1]+R[-1]C -> 0
B115: 22 | C115: due date - 3 | E115: =RC[-1]+R[-1]C -> 0 | G115: =RC[-1]+R[-1]C -> 0
B116: 23 | C116: due date - 2 | E116: =RC[-1]+R[-1]C -> 0 | G116: =RC[-1]+R[-1]C -> 0
B117: 24 | C117: due date - 1 | E117: =RC[-1]+R[-1]C -> 0 | G117: =RC[-1]+R[-1]C -> 0
B118: 25 | C118: due date | E118: =RC[-1]+R[-1]C -> 0 | G118: =RC[-1]+R[-1]C -> 0
B119: 26 | C119: due date + 1 | E119: =RC[-1]+R[-1]C -> 0 | G119: =RC[-1]+R[-1]C -> 0
B120: 27 | C120: due date + 2 | E120: =RC[-1]+R[-1]C -> 0 | G120: =RC[-1]+R[-1]C -> 0
B121: 28 | C121: due date + 3 | E121: =RC[-1]+R[-1]C -> 0 | G121: =RC[-1]+R[-1]C -> 0
B122: 29 | C122: due date + 4 | E122: =RC[-1]+R[-1]C -> 0 | G122: =RC[-1]+R[-1]C -> 0
B123: 30 | C123: due date + 5 | E123: =RC[-1]+R[-1]C -> 0 | G123: =RC[-1]+R[-1]C -> 0
B124: 31 | C124: due date + 6 | E124: =RC[-1]+R[-1]C -> 0 | G124: =RC[-1]+R[-1]C -> 0
B125: 32 | C125: due date + 7 | E125: =RC[-1]+R[-1]C -> 0 | G125: =RC[-1]+R[-1]C -> 0
B126: 33 | C126: due date + 8 | E126: =RC[-1]+R[-1]C -> 0 | G126: =RC[-1]+R[-1]C -> 0
B127: 34 | C127: due date + 9 | E127: =RC[-1]+R[-1]C -> 0 | G127: =RC[-1]+R[-1]C -> 0
B128: 35 | C128: due date + 10 | E128: =RC[-1]+R[-1]C -> 0 | G128: =RC[-1]+R[-1]C -> 0
B129: 36 | C129: due date + 11 | E129: =RC[-1]+R[-1]C -> 0 | G129: =RC[-1]+R[-1]C -> 0
B130: 37 | C130: due date + 12 | E130: =RC[-1]+R[-1]C -> 0 | G130: =RC[-1]+R[-1]C -> 0
B131: 38 | C131: due date + 13 | E131: =RC[-1]+R[-1]C -> 0 | G131: =RC[-1]+R[-1]C -> 0
B132: 39 | C132: due date + 14 | E132: =RC[-1]+R[-1]C -> 0 | G132: =RC[-1]+R[-1]C -> 0
B133: 40 | C133: due date + 15 | E133: =RC[-1]+R[-1]C -> 0 | G133: =RC[-1]+R[-1]C -> 0
B134: 41 | C134: due date + 16 | E134: =RC[-1]+R[-1]C -> 0 | G134: =RC[-1]+R[-1]C -> 0
B135: 42 | C135: due date + 17 | E135: =RC[-1]+R[-1]C -> 0 | G135: =RC[-1]+R[-1]C -> 0

Sheet: PlanSummary
A1: Project Plan Summary
A3: Standards
A4: Start date: | B4: 2000-01-01T00:00:00.000 | D4: Grades: | E4: AA
A5: End date: | B5: 40179 | E5: A
A6: Phases: | B6: Analysis | E6: AB
B7: Architecture | E7: B
B8: Planning | E8: BC
B9: Construction | E9: C
B10: Refactoring | E10: CD
B11: Review | E11: D
B12: Integration Test | E12: F
B13: Postmortem
B14: Sandbox
A15: Defect Types: | B15: Documentation | D15: Iteration | E15: NA
B16: Build | E16: 1
B17: Product syntax | E17: 2
B18: Product logic | E18: 3
B19: Product interface | E19: 4
B20: Product checking | E20: 5
B21: Test syntax | E21: 6
B22: Test logic | E22: 7
B23: Test interface | E23: 8
B24: Test checking | E24: 9
B25: Bad Smell | E25: 10
A26: Y/N: | B26: Yes
B27: No
A28: Proxy Types: | B28: Calculation
B29: Data
B30: I/O
B31: Logic
A34: Sizes: | B34: VS
B35: S
B36: M
B37: L
B38: VL
C39: Plan | D39: Actual | E39: To Date
A40: ='Historical Data'!R[11]C -> Program Size (LOC)
A41: ='Historical Data'!R[11]C -> Base code LOC count | C41: =Estimation!R[23]C[-1] -> 0 | D41: =Estimation!R[23]C[3] -> 0 | E41: =RC[-1]+'Historical Data'!R[11]C -> 0
A42: ='Historical Data'!R[11]C -> Lines deleted from Base | C42: =Estimation!R[22]C -> 0 | D42: =Estimation!R[22]C[4] -> 0 | E42: =RC[-1]+'Historical Data'!R[11]C -> 0
A43: ='Historical Data'!R[11]C -> Lines modified from Base | C43: =Estimation!R[21]C[1] -> 0 | D43: =Estimation!R[21]C[5] -> 0 | E43: =RC[-1]+'Historical Data'!R[11]C -> 0
A44: ='Historical Data'!R[11]C -> Lines added to Base | C44: =Estimation!R[20]C[2] -> 0 | D44: =Estimation!R[20]C[6] -> 0 | E44: =RC[-1]+'Historical Data'!R[11]C -> 0
A45: ='Historical Data'!R[11]C -> Reused lines | C45: =Estimation!R[52]C[-1] -> 0 | D45: =Estimation!R[52]C[-1] -> 0 | E45: =RC[-1]+'Historical Data'!R[11]C -> 0
A46: ='Historical Data'!R[11]C -> New component lines of code | C46: =Estimation!R[42]C[1] -> 0 | D46: =Estimation!R[42]C[4] -> 0 | E46: =RC[-1]+'Historical Data'!R[11]C -> 0
C48: Plan | D48: Actual | E48: To Date | F48: To Date %
A49: ='Historical Data'!R[15]C -> Time In Phase (minutes)
A50: ='Historical Data'!R[15]C -> Analysis | C50: =R61C3*'Historical Data'!R[15]C[3] -> 0 | D50: =SUMIF('Time Log'!R48C6:R137C6,RC[-3],'Time Log'!R48C5:R137C5) -> 30.000000000000053 | E50: =RC[-1]+'Historical Data'!R[15]C -> 30.000000000000053 | F50: =IF(R59C5=0,0,RC[-1]/R59C5) -> 0
A51: ='Historical Data'!R[15]C -> Architecture | C51: =R61C3*'Historical Data'!R[15]C[3] -> 0 | D51: =SUMIF('Time Log'!R48C6:R137C6,RC[-3],'Time Log'!R48C5:R137C5) -> 9.9999999999999645 | E51: =RC[-1]+'Historical Data'!R[15]C -> 9.9999999999999645 | F51: =IF(R59C5=0,0,RC[-1]/R59C5) -> 0
A52: ='Historical Data'!R[15]C -> Project planning | C52: =R61C3*'Historical Data'!R[15]C[3] -> 0 | D52: =SUMIF('Time Log'!R48C6:R137C6,RC[-3],'Time Log'!R48C5:R137C5) -> 10.000000000000044 | E52: =RC[-1]+'Historical Data'!R[15]C -> 10.000000000000044 | F52: =IF(R59C5=0,0,RC[-1]/R59C5) -> 0
A53: ='Historical Data'!R[15]C -> Interation planning | C53: =R61C3*'Historical Data'!R[15]C[3] -> 0 | D53: =SUMIF('Time Log'!R48C6:R137C6,RC[-3],'Time Log'!R48C5:R137C5) -> 15.000000000000027 | E53: =RC[-1]+'Historical Data'!R[15]C -> 15.000000000000027 | F53: =IF(R59C5=0,0,RC[-1]/R59C5) -> 0
A54: ='Historical Data'!R[15]C -> Construction | C54: =R61C3*'Historical Data'!R[15]C[3] -> 0 | D54: =SUMIF('Time Log'!R48C6:R137C6,RC[-3],'Time Log'!R48C5:R137C5) -> 210 | E54: =RC[-1]+'Historical Data'!R[15]C -> 210 | F54: =IF(R59C5=0,0,RC[-1]/R59C5) -> 0
A55: ='Historical Data'!R[15]C -> Refactoring | C55: =R61C3*'Historical Data'!R[15]C[3] -> 0 | D55: =SUMIF('Time Log'!R48C6:R137C6,RC[-3],'Time Log'!R48C5:R137C5) -> 0 | E55: =RC[-1]+'Historical Data'!R[15]C -> 0 | F55: =IF(R59C5=0,0,RC[-1]/R59C5) -> 0
A56: ='Historical Data'!R[15]C -> Review | C56: =R61C3*'Historical Data'!R[15]C[3] -> 0 | D56: =SUMIF('Time Log'!R48C6:R137C6,RC[-3],'Time Log'!R48C5:R137C5) -> 29.999999999999972 | E56: =RC[-1]+'Historical Data'!R[15]C -> 29.999999999999972 | F56: =IF(R59C5=0,0,RC[-1]/R59C5) -> 0
A57: ='Historical Data'!R[15]C -> Integration test | C57: =R61C3*'Historical Data'!R[15]C[3] -> 0 | D57: =SUMIF('Time Log'!R48C6:R137C6,RC[-3],'Time Log'!R48C5:R137C5) -> 0 | E57: =RC[-1]+'Historical Data'!R[15]C -> 0 | F57: =IF(R59C5=0,0,RC[-1]/R59C5) -> 0
A58: ='Historical Data'!R[15]C -> Repatterning | C58: =R61C3*'Historical Data'!R[15]C[3] -> 0 | D58: =SUMIF('Time Log'!R48C6:R137C6,RC[-3],'Time Log'!R48C5:R137C5) -> 0 | E58: =RC[-1]+'Historical Data'!R[15]C -> 0 | F58: =IF(R59C5=0,0,RC[-1]/R59C5) -> 0
A59: ='Historical Data'!R[15]C -> Postmortem | C59: =R61C3*'Historical Data'!R[15]C[3] -> 0 | D59: =SUMIF('Time Log'!R48C6:R137C6,RC[-3],'Time Log'!R48C5:R137C5) -> 0 | E59: =RC[-1]+'Historical Data'!R[15]C -> 0 | F59: =IF(R59C5=0,0,RC[-1]/R59C5) -> 0
A60: ='Historical Data'!R[15]C -> Sandbox | C60: =R61C3*'Historical Data'!R[15]C[3] -> 0 | D60: =SUMIF('Time Log'!R48C6:R137C6,RC[-3],'Time Log'!R48C5:R137C5) -> 0 | E60: =RC[-1]+'Historical Data'!R[15]C -> 0 | F60: =IF(R59C5=0,0,RC[-1]/R59C5) -> 0
A61: ='Historical Data'!R[15]C -> TOTAL | C61: =Estimation!R[54]C[1] -> 0 | D61: =SUM(R[-11]C:R[-1]C) -> 305.00000000000011 | E61: =RC[-1]+'Historical Data'!R[15]C -> 305.00000000000011 | F61: =IF(R59C5=0,0,RC[-1]/R59C5) -> 0
A63: ='Historical Data'!R[15]C -> Changes traced to
A64: ='Historical Data'!R[15]C -> Analysis | D64: =COUNTIF('Change Log'!R60C4:R60C4,RC[-3]) -> 0 | E64: =RC[-1]+'Historical Data'!R[15]C -> 0
A65: ='Historical Data'!R[15]C -> Architecture | D65: =COUNTIF('Change Log'!R60C4:R60C4,RC[-3]) -> 0 | E65: =RC[-1]+'Historical Data'!R[15]C -> 0
A66: ='Historical Data'!R[15]C -> Project planning | D66: =COUNTIF('Change Log'!R60C4:R60C4,RC[-3]) -> 0 | E66: =RC[-1]+'Historical Data'!R[15]C -> 0
A67: ='Historical Data'!R[15]C -> Interation planning | D67: =COUNTIF('Change Log'!R60C4:R60C4,RC[-3]) -> 0 | E67: =RC[-1]+'Historical Data'!R[15]C -> 0
A68: ='Historical Data'!R[15]C -> Construction | D68: =COUNTIF('Change Log'!R60C4:R60C4,RC[-3]) -> 1 | E68: =RC[-1]+'Historical Data'!R[15]C -> 1
A69: ='Historical Data'!R[15]C -> Refactoring | D69: =COUNTIF('Change Log'!R60C4:R60C4,RC[-3]) -> 0 | E69: =RC[-1]+'Historical Data'!R[15]C -> 0
A70: ='Historical Data'!R[15]C -> Review | D70: =COUNTIF('Change Log'!R60C4:R60C4,RC[-3]) -> 0 | E70: =RC[-1]+'Historical Data'!R[15]C -> 0
A71: ='Historical Data'!R[15]C -> Integration test | D71: =COUNTIF('Change Log'!R60C4:R60C4,RC[-3]) -> 0 | E71: =RC[-1]+'Historical Data'!R[15]C -> 0
A72: ='Historical Data'!R[15]C -> Repatterning | D72: =COUNTIF('Change Log'!R60C4:R60C4,RC[-3]) -> 0 | E72: =RC[-1]+'Historical Data'!R[15]C -> 0
A73: ='Historical Data'!R[15]C -> Postmortem | D73: =COUNTIF('Change Log'!R60C4:R60C4,RC[-3]) -> 0 | E73: =RC[-1]+'Historical Data'!R[15]C -> 0
A74: ='Historical Data'!R[15]C -> Sandbox | D74: =COUNTIF('Change Log'!R60C4:R60C4,RC[-3]) -> 0 | E74: =RC[-1]+'Historical Data'!R[15]C -> 0
A75: ='Historical Data'!R[15]C -> TOTAL | D75: =SUM(R[-11]C:R[-1]C) -> 1 | E75: =RC[-1]+'Historical Data'!R[15]C -> 1
A77: ='Historical Data'!R[15]C -> Changes implemented in
A78: ='Historical Data'!R[15]C -> Analysis | D78: =COUNTIF('Change Log'!R60C6:R60C6,RC[-3]) -> 0 | E78: =RC[-1]+'Historical Data'!R[15]C -> 0
A79: ='Historical Data'!R[15]C -> Architecture | D79: =COUNTIF('Change Log'!R60C6:R60C6,RC[-3]) -> 0 | E79: =RC[-1]+'Historical Data'!R[15]C -> 0
A80: ='Historical Data'!R[15]C -> Project planning | D80: =COUNTIF('Change Log'!R60C6:R60C6,RC[-3]) -> 0 | E80: =RC[-1]+'Historical Data'!R[15]C -> 0
A81: ='Historical Data'!R[15]C -> Interation planning | D81: =COUNTIF('Change Log'!R60C6:R60C6,RC[-3]) -> 0 | E81: =RC[-1]+'Historical Data'!R[15]C -> 0
A82: ='Historical Data'!R[15]C -> Construction | D82: =COUNTIF('Change Log'!R60C6:R60C6,RC[-3]) -> 0 | E82: =RC[-1]+'Historical Data'!R[15]C -> 0
A83: ='Historical Data'!R[15]C -> Refactoring | D83: =COUNTIF('Change Log'!R60C6:R60C6,RC[-3]) -> 0 | E83: =RC[-1]+'Historical Data'!R[15]C -> 0
A84: ='Historical Data'!R[15]C -> Review | D84: =COUNTIF('Change Log'!R60C6:R60C6,RC[-3]) -> 1 | E84: =RC[-1]+'Historical Data'!R[15]C -> 1
A85: ='Historical Data'!R[15]C -> Integration test | D85: =COUNTIF('Change Log'!R60C6:R60C6,RC[-3]) -> 0 | E85: =RC[-1]+'Historical Data'!R[15]C -> 0
A86: ='Historical Data'!R[15]C -> Repatterning | D86: =COUNTIF('Change Log'!R60C6:R60C6,RC[-3]) -> 0 | E86: =RC[-1]+'Historical Data'!R[15]C -> 0
A87: ='Historical Data'!R[15]C -> Postmortem | D87: =COUNTIF('Change Log'!R60C6:R60C6,RC[-3]) -> 0 | E87: =RC[-1]+'Historical Data'!R[15]C -> 0
A88: ='Historical Data'!R[15]C -> Sandbox | D88: =COUNTIF('Change Log'!R60C6:R60C6,RC[-3]) -> 0 | E88: =RC[-1]+'Historical Data'!R[15]C -> 0
A89: ='Historical Data'!R[15]C -> TOTAL | D89: =SUM(R[-11]C:R[-1]C) -> 1 | E89: =RC[-1]+'Historical Data'!R[15]C -> 1

Sheet: Change Log
A1: =Constants!RC -> Constants | B1: =Constants!RC ->  | C1: =Constants!RC ->  | D1: =Constants!RC ->  | E1: =Constants!RC ->  | F1: =Constants!RC -> CA02 | G1: =Constants!RC ->  | H1: =Constants!RC ->  | I1: =Constants!RC -> 
A2: =Constants!RC -> Start date: | B2: =Constants!RC -> 36526 | C2: =Constants!RC ->  | D2: =Constants!RC -> Grades: | E2: =Constants!RC -> AA | F2: =Constants!RC -> 1 | G2: =Constants!RC -> 0 | H2: =Constants!RC -> 0 | I2: =Constants!RC -> 0
A3: =Constants!RC -> End date: | B3: =Constants!RC -> 73051 | C3: =Constants!RC ->  | D3: =Constants!RC ->  | E3: =Constants!RC -> A | F3: =Constants!RC -> 0.95 | G3: =Constants!RC -> 0 | H3: =Constants!RC -> 0 | I3: =Constants!RC -> 0
A4: =Constants!RC -> Phases: | B4: =Constants!RC -> Analysis | C4: =Constants!RC ->  | D4: =Constants!RC ->  | E4: =Constants!RC -> AB | F4: =Constants!RC -> 0.9 | G4: =Constants!RC -> 0 | H4: =Constants!RC -> 0 | I4: =Constants!RC -> 0
A5: =Constants!RC ->  | B5: =Constants!RC -> Architecture | C5: =Constants!RC ->  | D5: =Constants!RC ->  | E5: =Constants!RC -> B | F5: =Constants!RC -> 0.85 | G5: =Constants!RC -> 0 | H5: =Constants!RC -> 0 | I5: =Constants!RC -> 0
A6: =Constants!RC ->  | B6: =Constants!RC -> Project planning | C6: =Constants!RC ->  | D6: =Constants!RC ->  | E6: =Constants!RC -> BC | F6: =Constants!RC -> 0.8 | G6: =Constants!RC -> 0 | H6: =Constants!RC -> 0 | I6: =Constants!RC -> 0
A7: =Constants!RC ->  | B7: =Constants!RC -> Interation planning | C7: =Constants!RC ->  | D7: =Constants!RC ->  | E7: =Constants!RC -> C | F7: =Constants!RC -> 0.75 | G7: =Constants!RC -> 0 | H7: =Constants!RC -> 0 | I7: =Constants!RC -> 0
A8: =Constants!RC ->  | B8: =Constants!RC -> Construction | C8: =Constants!RC ->  | D8: =Constants!RC ->  | E8: =Constants!RC -> CD | F8: =Constants!RC -> 0.7 | G8: =Constants!RC -> 0 | H8: =Constants!RC -> 0 | I8: =Constants!RC -> 0
A9: =Constants!RC ->  | B9: =Constants!RC -> Refactoring | C9: =Constants!RC ->  | D9: =Constants!RC ->  | E9: =Constants!RC -> D | F9: =Constants!RC -> 0.65 | G9: =Constants!RC -> 0 | H9: =Constants!RC -> 0 | I9: =Constants!RC -> 0
A10: =Constants!RC ->  | B10: =Constants!RC -> Review | C10: =Constants!RC ->  | D10: =Constants!RC ->  | E10: =Constants!RC -> F | F10: =Constants!RC -> 0.5 | G10: =Constants!RC -> 0 | H10: =Constants!RC -> 0 | I10: =Constants!RC -> 0
A11: =Constants!RC ->  | B11: =Constants!RC -> Integration test | C11: =Constants!RC ->  | D11: =Constants!RC ->  | E11: =Constants!RC ->  | F11: =Constants!RC ->  | G11: =Constants!RC -> 0 | H11: =Constants!RC -> 0 | I11: =Constants!RC -> 0
A12: =Constants!RC ->  | B12: =Constants!RC -> Repatterning | C12: =Constants!RC ->  | D12: =Constants!RC ->  | E12: =Constants!RC ->  | F12: =Constants!RC ->  | G12: =Constants!RC -> 0 | H12: =Constants!RC -> 0 | I12: =Constants!RC -> 0
A13: =Constants!RC ->  | B13: =Constants!RC -> Postmortem | C13: =Constants!RC ->  | D13: =Constants!RC ->  | E13: =Constants!RC ->  | F13: =Constants!RC ->  | G13: =Constants!RC -> 0 | H13: =Constants!RC -> 0 | I13: =Constants!RC -> 0
A14: =Constants!RC ->  | B14: =Constants!RC -> Sandbox | C14: =Constants!RC ->  | D14: =Constants!RC ->  | E14: =Constants!RC ->  | F14: =Constants!RC ->  | G14: =Constants!RC -> 0 | H14: =Constants!RC -> 0 | I14: =Constants!RC -> 0
A15: =Constants!RC ->  | B15: =Constants!RC ->  | C15: =Constants!RC ->  | D15: =Constants!RC ->  | E15: =Constants!RC ->  | F15: =Constants!RC ->  | G15: =Constants!RC -> 0 | H15: =Constants!RC -> 0 | I15: =Constants!RC -> 0
A16: =Constants!RC ->  | B16: =Constants!RC ->  | C16: =Constants!RC ->  | D16: =Constants!RC ->  | E16: =Constants!RC ->  | F16: =Constants!RC ->  | G16: =Constants!RC -> 0 | H16: =Constants!RC -> 0 | I16: =Constants!RC -> 0
A17: =Constants!RC ->  | B17: =Constants!RC ->  | C17: =Constants!RC ->  | D17: =Constants!RC ->  | E17: =Constants!RC ->  | F17: =Constants!RC ->  | G17: =Constants!RC -> 0 | H17: =Constants!RC -> 0 | I17: =Constants!RC -> 0
A18: =Constants!RC ->  | B18: =Constants!RC ->  | C18: =Constants!RC ->  | D18: =Constants!RC ->  | E18: =Constants!RC ->  | F18: =Constants!RC ->  | G18: =Constants!RC -> 0 | H18: =Constants!RC -> 0 | I18: =Constants!RC -> 0
A19: =Constants!RC -> Defect Types: | B19: =Constants!RC -> Requirements Change | C19: =Constants!RC -> Changes to requirements | D19: =Constants!RC -> Iteration | E19: =Constants!RC -> NA | F19: =Constants!RC -> did not follow | G19: =Constants!RC -> 0 | H19: =Constants!RC -> 0 | I19: =Constants!RC -> 0
A20: =Constants!RC ->  | B20: =Constants!RC -> Requirements Clarification | C20: =Constants!RC -> Clarifications to requirements | D20: =Constants!RC ->  | E20: =Constants!RC -> 1 | F20: =Constants!RC -> very painful | G20: =Constants!RC -> 0 | H20: =Constants!RC -> 0 | I20: =Constants!RC -> 0
A21: =Constants!RC ->  | B21: =Constants!RC -> Product syntax | C21: =Constants!RC -> Syntax flaws in the deliverable product | D21: =Constants!RC ->  | E21: =Constants!RC -> 2 | F21: =Constants!RC -> painful | G21: =Constants!RC -> 0 | H21: =Constants!RC -> 0 | I21: =Constants!RC -> 0
A22: =Constants!RC ->  | B22: =Constants!RC -> Product logic | C22: =Constants!RC -> Logic flaws in the deliverable product | D22: =Constants!RC ->  | E22: =Constants!RC -> 3 | F22: =Constants!RC -> neutral | G22: =Constants!RC -> 0 | H22: =Constants!RC -> 0 | I22: =Constants!RC -> 0
A23: =Constants!RC ->  | B23: =Constants!RC -> Product interface | C23: =Constants!RC -> Flaws in the interface of a component of the deliverable product | D23: =Constants!RC ->  | E23: =Constants!RC -> 4 | F23: =Constants!RC -> helpful | G23: =Constants!RC -> 0 | H23: =Constants!RC -> 0 | I23: =Constants!RC -> 0
A24: =Constants!RC ->  | B24: =Constants!RC -> Product checking | C24: =Constants!RC -> Flaws with boundary/type checking within a component of the deliverable product | D24: =Constants!RC ->  | E24: =Constants!RC -> 5 | F24: =Constants!RC -> very helpful | G24: =Constants!RC -> 0 | H24: =Constants!RC -> 0 | I24: =Constants!RC -> 0
A25: =Constants!RC ->  | B25: =Constants!RC -> Test syntax | C25: =Constants!RC -> Syntax flaws in the test code | D25: =Constants!RC ->  | E25: =Constants!RC -> 6 | F25: =Constants!RC ->  | G25: =Constants!RC -> 0 | H25: =Constants!RC -> 0 | I25: =Constants!RC -> 0
A26: =Constants!RC ->  | B26: =Constants!RC -> Test logic | C26: =Constants!RC -> Logic flaws in the test code | D26: =Constants!RC ->  | E26: =Constants!RC -> 7 | F26: =Constants!RC ->  | G26: =Constants!RC -> 0 | H26: =Constants!RC -> 0 | I26: =Constants!RC -> 0
A27: =Constants!RC ->  | B27: =Constants!RC -> Test interface | C27: =Constants!RC -> Flaws in the interface of a component of the test code | D27: =Constants!RC ->  | E27: =Constants!RC -> 8 | F27: =Constants!RC ->  | G27: =Constants!RC -> 0 | H27: =Constants!RC -> 0 | I27: =Constants!RC -> 0
A28: =Constants!RC ->  | B28: =Constants!RC -> Test checking | C28: =Constants!RC -> Flaws with boundary/type checking within a component of the test code | D28: =Constants!RC ->  | E28: =Constants!RC -> 9 | F28: =Constants!RC ->  | G28: =Constants!RC -> 0 | H28: =Constants!RC -> 0 | I28: =Constants!RC -> 0
A29: =Constants!RC ->  | B29: =Constants!RC -> Bad Smell | C29: =Constants!RC -> Refactoring changes (please note the bad smell in the defect description) | D29: =Constants!RC ->  | E29: =Constants!RC -> 10 | F29: =Constants!RC -> 0 | G29: =Constants!RC -> 0 | H29: =Constants!RC -> 0 | I29: =Constants!RC -> 0
A30: =Constants!RC -> Y/N: | B30: =Constants!RC -> Yes | C30: =Constants!RC ->  | D30: =Constants!RC ->  | E30: =Constants!RC -> Passed | F30: =Constants!RC -> 0 | G30: =Constants!RC -> 0 | H30: =Constants!RC -> 0 | I30: =Constants!RC -> 0
A31: =Constants!RC ->  | B31: =Constants!RC -> No | C31: =Constants!RC ->  | D31: =Constants!RC ->  | E31: =Constants!RC -> Passed with issues | F31: =Constants!RC -> 0 | G31: =Constants!RC -> 0 | H31: =Constants!RC -> 0 | I31: =Constants!RC -> 0
A32: =Constants!RC -> Proxy Types: | B32: =Constants!RC -> - | C32: =Constants!RC ->  | D32: =Constants!RC ->  | E32: =Constants!RC -> Failed | F32: =Constants!RC ->  | G32: =Constants!RC -> 0 | H32: =Constants!RC -> 0 | I32: =Constants!RC -> 0
A33: =Constants!RC ->  | B33: =Constants!RC -> Calculation | C33: =Constants!RC ->  | D33: =Constants!RC ->  | E33: =Constants!RC -> Not tested | F33: =Constants!RC ->  | G33: =Constants!RC -> 0 | H33: =Constants!RC -> 0 | I33: =Constants!RC -> 0
A34: =Constants!RC ->  | B34: =Constants!RC -> Data | C34: =Constants!RC ->  | D34: =Constants!RC ->  | E34: =Constants!RC -> Not applicable | F34: =Constants!RC ->  | G34: =Constants!RC -> 0 | H34: =Constants!RC -> 0 | I34: =Constants!RC -> 0
A35: =Constants!RC ->  | B35: =Constants!RC -> I/O | C35: =Constants!RC ->  | D35: =Constants!RC ->  | E35: =Constants!RC ->  | F35: =Constants!RC ->  | G35: =Constants!RC -> 0 | H35: =Constants!RC -> 0 | I35: =Constants!RC -> 0
A36: =Constants!RC ->  | B36: =Constants!RC -> Logic | C36: =Constants!RC ->  | D36: =Constants!RC ->  | E36: =Constants!RC ->  | F36: =Constants!RC ->  | G36: =Constants!RC -> 0 | H36: =Constants!RC -> 0 | I36: =Constants!RC -> 0
A37: =Constants!RC ->  | B37: =Constants!RC ->  | C37: =Constants!RC ->  | D37: =Constants!RC ->  | E37: =Constants!RC ->  | F37: =Constants!RC ->  | G37: =Constants!RC -> 0 | H37: =Constants!RC -> 0 | I37: =Constants!RC -> 0
A38: =Constants!RC -> Sizes: | B38: =Constants!RC -> VS | C38: =Constants!RC -> S | D38: =Constants!RC -> M | E38: =Constants!RC -> L | F38: =Constants!RC -> VL | G38: =Constants!RC -> 0 | H38: =Constants!RC -> 0 | I38: =Constants!RC -> 0
A39: =Constants!RC -> upper | B39: =Constants!RC -> -1.5 | C39: =Constants!RC -> -0.5 | D39: =Constants!RC -> 0.5 | E39: =Constants!RC -> 1.5 | F39: =Constants!RC -> 99999 | G39: =Constants!RC -> 0 | H39: =Constants!RC -> 0 | I39: =Constants!RC -> 0
A40: =Constants!RC -> mid | B40: =Constants!RC -> -2 | C40: =Constants!RC -> -1 | D40: =Constants!RC -> 0 | E40: =Constants!RC -> 1 | F40: =Constants!RC -> 2 | G40: =Constants!RC -> 0 | H40: =Constants!RC -> 0 | I40: =Constants!RC -> 0
A41: =Constants!RC -> lower | B41: =Constants!RC -> 0 | C41: =Constants!RC -> -1.5 | D41: =Constants!RC -> -0.5 | E41: =Constants!RC -> 0.5 | F41: =Constants!RC -> 1.5 | G41: =Constants!RC -> 0 | H41: =Constants!RC -> 0 | I41: =Constants!RC -> 0
A42: =Constants!RC ->  | B42: =Constants!RC -> 0 | C42: =Constants!RC -> 0 | D42: =Constants!RC -> 0 | E42: =Constants!RC -> 0 | F42: =Constants!RC ->  | G42: =Constants!RC -> 0 | H42: =Constants!RC -> 0 | I42: =Constants!RC -> 0
A43: =Constants!RC ->  | B43: =Constants!RC ->  | C43: =Constants!RC ->  | D43: =Constants!RC ->  | E43: =Constants!RC ->  | F43: =Constants!RC ->  | G43: =Constants!RC -> 0 | H43: =Constants!RC -> 0 | I43: =Constants!RC -> 0
A44: =Constants!RC -> <-- Mandatory | B44: =Constants!RC ->  | C44: =Constants!RC -> ✔ | D44: =Constants!RC ->  | E44: =Constants!RC ->  | F44: =Constants!RC ->  | G44: =Constants!RC -> 0 | H44: =Constants!RC -> 0 | I44: =Constants!RC -> 0
A45: Change Log
A46: Use this worksheet to record changes to made to artifacts after the project is underway. Record repairs to defects, as well as changes that result from requirements clarifications/changes.
C47: Change Designation | D47: Description
C48: =R[-29]C[-1] -> Requirements Change | D48: =R[-29]C[-1] -> Changes to requirements
C49: =R[-29]C[-1] -> Requirements Clarification | D49: =R[-29]C[-1] -> Clarifications to requirements
C50: =R[-29]C[-1] -> Product syntax | D50: =R[-29]C[-1] -> Syntax flaws in the deliverable product
C51: =R[-29]C[-1] -> Product logic | D51: =R[-29]C[-1] -> Logic flaws in the deliverable product
C52: =R[-29]C[-1] -> Product interface | D52: =R[-29]C[-1] -> Flaws in the interface of a component of the deliverable product
C53: =R[-29]C[-1] -> Product checking | D53: =R[-29]C[-1] -> Flaws with boundary/type checking within a component of the deliverable product
C54: =R[-29]C[-1] -> Test syntax | D54: =R[-29]C[-1] -> Syntax flaws in the test code
C55: =R[-29]C[-1] -> Test logic | D55: =R[-29]C[-1] -> Logic flaws in the test code
C56: =R[-29]C[-1] -> Test interface | D56: =R[-29]C[-1] -> Flaws in the interface of a component of the test code
C57: =R[-29]C[-1] -> Test checking | D57: =R[-29]C[-1] -> Flaws with boundary/type checking within a component of the test code
C58: =R[-29]C[-1] -> Bad Smell | D58: =R[-29]C[-1] -> Refactoring changes (please note the bad smell in the defect description)
A59: Number | B59: Date | C59: Type | D59: Where Injected | E59: Inject Iteration | F59: Where Removed | G59: Remove Iteration | H59: Fix Time | I59: Fix Reference | J59: Description
A60: =1 -> 1 | B60: feb 19 | C60: Product logic | D60: Construction | F60: Review | H60: 5 | J60: wrong return value for function | K60: =IF(ISBLANK(RC[-2]),"",IF(RC[-2]=RC[-10],"<-- Circular reference",IF(ISBLANK(OFFSET(R59C3,RC[-2],0)),"<-- Invalid reference",""))) -> 
A61: =R[-1]C+1 -> 2 | B61: feb 19 | C61: Product logic | D61: Construction | F61: Review | H61: 10 | J61: wrong round position to the value of degree | K61: =IF(ISBLANK(RC[-2]),"",IF(RC[-2]=RC[-10],"<-- Circular reference",IF(ISBLANK(OFFSET(R59C3,RC[-2],0)),"<-- Invalid reference",""))) -> 
A62: =R[-1]C+1 -> 3 | B62: feb 19 | C62: Bad Smell | D62: Construction | J62: cast error is not comprehensive | K62: =IF(ISBLANK(RC[-2]),"",IF(RC[-2]=RC[-10],"<-- Circular reference",IF(ISBLANK(OFFSET(R59C3,RC[-2],0)),"<-- Invalid reference",""))) -> 
A63: =R[-1]C+1 -> 4 | B63: feb 19 | C63: Product logic | D63: Construction | F63: Review | H63: 5 | J63: reong refraction calculation | K63: =IF(ISBLANK(RC[-2]),"",IF(RC[-2]=RC[-10],"<-- Circular reference",IF(ISBLANK(OFFSET(R59C3,RC[-2],0)),"<-- Invalid reference",""))) -> 
A64: =R[-1]C+1 -> 5 | B64: feb 19 | C64: Bad Smell | D64: Construction | J64: observation value test not needed in adjust function | K64: =IF(ISBLANK(RC[-2]),"",IF(RC[-2]=RC[-10],"<-- Circular reference",IF(ISBLANK(OFFSET(R59C3,RC[-2],0)),"<-- Invalid reference",""))) -> 
A65: =R[-1]C+1 -> 6 | K65: =IF(ISBLANK(RC[-2]),"",IF(RC[-2]=RC[-10],"<-- Circular reference",IF(ISBLANK(OFFSET(R59C3,RC[-2],0)),"<-- Invalid reference",""))) -> 
A66: =R[-1]C+1 -> 7 | K66: =IF(ISBLANK(RC[-2]),"",IF(RC[-2]=RC[-10],"<-- Circular reference",IF(ISBLANK(OFFSET(R59C3,RC[-2],0)),"<-- Invalid reference",""))) -> 
A67: =R[-1]C+1 -> 8 | K67: =IF(ISBLANK(RC[-2]),"",IF(RC[-2]=RC[-10],"<-- Circular reference",IF(ISBLANK(OFFSET(R59C3,RC[-2],0)),"<-- Invalid reference",""))) -> 
A68: =R[-1]C+1 -> 9 | K68: =IF(ISBLANK(RC[-2]),"",IF(RC[-2]=RC[-10],"<-- Circular reference",IF(ISBLANK(OFFSET(R59C3,RC[-2],0)),"<-- Invalid reference",""))) -> 
A69: =R[-1]C+1 -> 10 | K69: =IF(ISBLANK(RC[-2]),"",IF(RC[-2]=RC[-10],"<-- Circular reference",IF(ISBLANK(OFFSET(R59C3,RC[-2],0)),"<-- Invalid reference",""))) -> 
A70: =R[-1]C+1 -> 11 | K70: =IF(ISBLANK(RC[-2]),"",IF(RC[-2]=RC[-10],"<-- Circular reference",IF(ISBLANK(OFFSET(R59C3,RC[-2],0)),"<-- Invalid reference",""))) -> 
A71: =R[-1]C+1 -> 12 | K71: =IF(ISBLANK(RC[-2]),"",IF(RC[-2]=RC[-10],"<-- Circular reference",IF(ISBLANK(OFFSET(R59C3,RC[-2],0)),"<-- Invalid reference",""))) -> 
A72: =R[-1]C+1 -> 13 | K72: =IF(ISBLANK(RC[-2]),"",IF(RC[-2]=RC[-10],"<-- Circular reference",IF(ISBLANK(OFFSET(R59C3,RC[-2],0)),"<-- Invalid reference",""))) -> 
A73: =R[-1]C+1 -> 14 | K73: =IF(ISBLANK(RC[-2]),"",IF(RC[-2]=RC[-10],"<-- Circular reference",IF(ISBLANK(OFFSET(R59C3,RC[-2],0)),"<-- Invalid reference",""))) -> 
A74: =R[-1]C+1 -> 15 | K74: =IF(ISBLANK(RC[-2]),"",IF(RC[-2]=RC[-10],"<-- Circular reference",IF(ISBLANK(OFFSET(R59C3,RC[-2],0)),"<-- Invalid reference",""))) -> 
A75: =R[-1]C+1 -> 16 | K75: =IF(ISBLANK(RC[-2]),"",IF(RC[-2]=RC[-10],"<-- Circular reference",IF(ISBLANK(OFFSET(R59C3,RC[-2],0)),"<-- Invalid reference",""))) -> 
A76: =R[-1]C+1 -> 17 | K76: =IF(ISBLANK(RC[-2]),"",IF(RC[-2]=RC[-10],"<-- Circular reference",IF(ISBLANK(OFFSET(R59C3,RC[-2],0)),"<-- Invalid reference",""))) -> 
A77: =R[-1]C+1 -> 18 | K77: =IF(ISBLANK(RC[-2]),"",IF(RC[-2]=RC[-10],"<-- Circular reference",IF(ISBLANK(OFFSET(R59C3,RC[-2],0)),"<-- Invalid reference",""))) -> 
A78: =R[-1]C+1 -> 19 | K78: =IF(ISBLANK(RC[-2]),"",IF(RC[-2]=RC[-10],"<-- Circular reference",IF(ISBLANK(OFFSET(R59C3,RC[-2],0)),"<-- Invalid reference",""))) -> 
A79: =R[-1]C+1 -> 20 | K79: =IF(ISBLANK(RC[-2]),"",IF(RC[-2]=RC[-10],"<-- Circular reference",IF(ISBLANK(OFFSET(R59C3,RC[-2],0)),"<-- Invalid reference",""))) -> 
A80: =R[-1]C+1 -> 21 | K80: =IF(ISBLANK(RC[-2]),"",IF(RC[-2]=RC[-10],"<-- Circular reference",IF(ISBLANK(OFFSET(R59C3,RC[-2],0)),"<-- Invalid reference",""))) -> 
A81: =R[-1]C+1 -> 22 | K81: =IF(ISBLANK(RC[-2]),"",IF(RC[-2]=RC[-10],"<-- Circular reference",IF(ISBLANK(OFFSET(R59C3,RC[-2],0)),"<-- Invalid reference",""))) -> 
A82: =R[-1]C+1 -> 23 | K82: =IF(ISBLANK(RC[-2]),"",IF(RC[-2]=RC[-10],"<-- Circular reference",IF(ISBLANK(OFFSET(R59C3,RC[-2],0)),"<-- Invalid reference",""))) -> 
A83: =R[-1]C+1 -> 24 | K83: =IF(ISBLANK(RC[-2]),"",IF(RC[-2]=RC[-10],"<-- Circular reference",IF(ISBLANK(OFFSET(R59C3,RC[-2],0)),"<-- Invalid reference",""))) -> 
A84: =R[-1]C+1 -> 25 | K84: =IF(ISBLANK(RC[-2]),"",IF(RC[-2]=RC[-10],"<-- Circular reference",IF(ISBLANK(OFFSET(R59C3,RC[-2],0)),"<-- Invalid reference",""))) -> 
A85: =R[-1]C+1 -> 26 | K85: =IF(ISBLANK(RC[-2]),"",IF(RC[-2]=RC[-10],"<-- Circular reference",IF(ISBLANK(OFFSET(R59C3,RC[-2],0)),"<-- Invalid reference",""))) -> 
A86: =R[-1]C+1 -> 27 | K86: =IF(ISBLANK(RC[-2]),"",IF(RC[-2]=RC[-10],"<-- Circular reference",IF(ISBLANK(OFFSET(R59C3,RC[-2],0)),"<-- Invalid reference",""))) -> 
A87: =R[-1]C+1 -> 28 | K87: =IF(ISBLANK(RC[-2]),"",IF(RC[-2]=RC[-10],"<-- Circular reference",IF(ISBLANK(OFFSET(R59C3,RC[-2],0)),"<-- Invalid reference",""))) -> 
A88: =R[-1]C+1 -> 29 | K88: =IF(ISBLANK(RC[-2]),"",IF(RC[-2]=RC[-10],"<-- Circular reference",IF(ISBLANK(OFFSET(R59C3,RC[-2],0)),"<-- Invalid reference",""))) -> 
A89: =R[-1]C+1 -> 30 | K89: =IF(ISBLANK(RC[-2]),"",IF(RC[-2]=RC[-10],"<-- Circular reference",IF(ISBLANK(OFFSET(R59C3,RC[-2],0)),"<-- Invalid reference",""))) -> 
A90: =R[-1]C+1 -> 31 | K90: =IF(ISBLANK(RC[-2]),"",IF(RC[-2]=RC[-10],"<-- Circular reference",IF(ISBLANK(OFFSET(R59C3,RC[-2],0)),"<-- Invalid reference",""))) -> 
A91: =R[-1]C+1 -> 32 | K91: =IF(ISBLANK(RC[-2]),"",IF(RC[-2]=RC[-10],"<-- Circular reference",IF(ISBLANK(OFFSET(R59C3,RC[-2],0)),"<-- Invalid reference",""))) -> 
A92: =R[-1]C+1 -> 33 | K92: =IF(ISBLANK(RC[-2]),"",IF(RC[-2]=RC[-10],"<-- Circular reference",IF(ISBLANK(OFFSET(R59C3,RC[-2],0)),"<-- Invalid reference",""))) -> 
A93: =R[-1]C+1 -> 34 | K93: =IF(ISBLANK(RC[-2]),"",IF(RC[-2]=RC[-10],"<-- Circular reference",IF(ISBLANK(OFFSET(R59C3,RC[-2],0)),"<-- Invalid reference",""))) -> 
A94: =R[-1]C+1 -> 35 | K94: =IF(ISBLANK(RC[-2]),"",IF(RC[-2]=RC[-10],"<-- Circular reference",IF(ISBLANK(OFFSET(R59C3,RC[-2],0)),"<-- Invalid reference",""))) -> 
A95: =R[-1]C+1 -> 36 | K95: =IF(ISBLANK(RC[-2]),"",IF(RC[-2]=RC[-10],"<-- Circular reference",IF(ISBLANK(OFFSET(R59C3,RC[-2],0)),"<-- Invalid reference",""))) -> 
A96: =R[-1]C+1 -> 37 | K96: =IF(ISBLANK(RC[-2]),"",IF(RC[-2]=RC[-10],"<-- Circular reference",IF(ISBLANK(OFFSET(R59C3,RC[-2],0)),"<-- Invalid reference",""))) -> 
A97: =R[-1]C+1 -> 38 | K97: =IF(ISBLANK(RC[-2]),"",IF(RC[-2]=RC[-10],"<-- Circular reference",IF(ISBLANK(OFFSET(R59C3,RC[-2],0)),"<-- Invalid reference",""))) -> 
A98: =R[-1]C+1 -> 39 | K98: =IF(ISBLANK(RC[-2]),"",IF(RC[-2]=RC[-10],"<-- Circular reference",IF(ISBLANK(OFFSET(R59C3,RC[-2],0)),"<-- Invalid reference",""))) -> 
A99: =R[-1]C+1 -> 40 | K99: =IF(ISBLANK(RC[-2]),"",IF(RC[-2]=RC[-10],"<-- Circular reference",IF(ISBLANK(OFFSET(R59C3,RC[-2],0)),"<-- Invalid reference",""))) -> 
A100: =R[-1]C+1 -> 41 | K100: =IF(ISBLANK(RC[-2]),"",IF(RC[-2]=RC[-10],"<-- Circular reference",IF(ISBLANK(OFFSET(R59C3,RC[-2],0)),"<-- Invalid reference",""))) -> 
A101: =R[-1]C+1 -> 42 | K101: =IF(ISBLANK(RC[-2]),"",IF(RC[-2]=RC[-10],"<-- Circular reference",IF(ISBLANK(OFFSET(R59C3,RC[-2],0)),"<-- Invalid reference",""))) -> 
A102: =R[-1]C+1 -> 43 | K102: =IF(ISBLANK(RC[-2]),"",IF(RC[-2]=RC[-10],"<-- Circular reference",IF(ISBLANK(OFFSET(R59C3,RC[-2],0)),"<-- Invalid reference",""))) -> 
A103: =R[-1]C+1 -> 44 | K103: =IF(ISBLANK(RC[-2]),"",IF(RC[-2]=RC[-10],"<-- Circular reference",IF(ISBLANK(OFFSET(R59C3,RC[-2],0)),"<-- Invalid reference",""))) -> 
A104: =R[-1]C+1 -> 45 | K104: =IF(ISBLANK(RC[-2]),"",IF(RC[-2]=RC[-10],"<-- Circular reference",IF(ISBLANK(OFFSET(R59C3,RC[-2],0)),"<-- Invalid reference",""))) -> 
A105: =R[-1]C+1 -> 46 | K105: =IF(ISBLANK(RC[-2]),"",IF(RC[-2]=RC[-10],"<-- Circular reference",IF(ISBLANK(OFFSET(R59C3,RC[-2],0)),"<-- Invalid reference",""))) -> 
A106: =R[-1]C+1 -> 47 | K106: =IF(ISBLANK(RC[-2]),"",IF(RC[-2]=RC[-10],"<-- Circular reference",IF(ISBLANK(OFFSET(R59C3,RC[-2],0)),"<-- Invalid reference",""))) -> 
A107: =R[-1]C+1 -> 48 | K107: =IF(ISBLANK(RC[-2]),"",IF(RC[-2]=RC[-10],"<-- Circular reference",IF(ISBLANK(OFFSET(R59C3,RC[-2],0)),"<-- Invalid reference",""))) -> 
A108: =R[-1]C+1 -> 49 | K108: =IF(ISBLANK(RC[-2]),"",IF(RC[-2]=RC[-10],"<-- Circular reference",IF(ISBLANK(OFFSET(R59C3,RC[-2],0)),"<-- Invalid reference",""))) -> 
A109: =R[-1]C+1 -> 50 | K109: =IF(ISBLANK(RC[-2]),"",IF(RC[-2]=RC[-10],"<-- Circular reference",IF(ISBLANK(OFFSET(R59C3,RC[-2],0)),"<-- Invalid reference",""))) -> 
A110: =R[-1]C+1 -> 51 | K110: =IF(ISBLANK(RC[-2]),"",IF(RC[-2]=RC[-10],"<-- Circular reference",IF(ISBLANK(OFFSET(R59C3,RC[-2],0)),"<-- Invalid reference",""))) -> 
A111: =R[-1]C+1 -> 52 | K111: =IF(ISBLANK(RC[-2]),"",IF(RC[-2]=RC[-10],"<-- Circular reference",IF(ISBLANK(OFFSET(R59C3,RC[-2],0)),"<-- Invalid reference",""))) -> 
A112: =R[-1]C+1 -> 53 | K112: =IF(ISBLANK(RC[-2]),"",IF(RC[-2]=RC[-10],"<-- Circular reference",IF(ISBLANK(OFFSET(R59C3,RC[-2],0)),"<-- Invalid reference",""))) -> 
A113: =R[-1]C+1 -> 54 | K113: =IF(ISBLANK(RC[-2]),"",IF(RC[-2]=RC[-10],"<-- Circular reference",IF(ISBLANK(OFFSET(R59C3,RC[-2],0)),"<-- Invalid reference",""))) -> 
A114: =R[-1]C+1 -> 55 | K114: =IF(ISBLANK(RC[-2]),"",IF(RC[-2]=RC[-10],"<-- Circular reference",IF(ISBLANK(OFFSET(R59C3,RC[-2],0)),"<-- Invalid reference",""))) -> 
A115: =R[-1]C+1 -> 56 | K115: =IF(ISBLANK(RC[-2]),"",IF(RC[-2]=RC[-10],"<-- Circular reference",IF(ISBLANK(OFFSET(R59C3,RC[-2],0)),"<-- Invalid reference",""))) -> 
A116: =R[-1]C+1 -> 57 | K116: =IF(ISBLANK(RC[-2]),"",IF(RC[-2]=RC[-10],"<-- Circular reference",IF(ISBLANK(OFFSET(R59C3,RC[-2],0)),"<-- Invalid reference",""))) -> 
A117: =R[-1]C+1 -> 58 | K117: =IF(ISBLANK(RC[-2]),"",IF(RC[-2]=RC[-10],"<-- Circular reference",IF(ISBLANK(OFFSET(R59C3,RC[-2],0)),"<-- Invalid reference",""))) -> 
A118: =R[-1]C+1 -> 59 | K118: =IF(ISBLANK(RC[-2]),"",IF(RC[-2]=RC[-10],"<-- Circular reference",IF(ISBLANK(OFFSET(R59C3,RC[-2],0)),"<-- Invalid reference",""))) -> 
A119: =R[-1]C+1 -> 60 | K119: =IF(ISBLANK(RC[-2]),"",IF(RC[-2]=RC[-10],"<-- Circular reference",IF(ISBLANK(OFFSET(R59C3,RC[-2],0)),"<-- Invalid reference",""))) -> 
A120: =R[-1]C+1 -> 61 | K120: =IF(ISBLANK(RC[-2]),"",IF(RC[-2]=RC[-10],"<-- Circular reference",IF(ISBLANK(OFFSET(R59C3,RC[-2],0)),"<-- Invalid reference",""))) -> 
A121: =R[-1]C+1 -> 62 | K121: =IF(ISBLANK(RC[-2]),"",IF(RC[-2]=RC[-10],"<-- Circular reference",IF(ISBLANK(OFFSET(R59C3,RC[-2],0)),"<-- Invalid reference",""))) -> 
A122: =R[-1]C+1 -> 63 | K122: =IF(ISBLANK(RC[-2]),"",IF(RC[-2]=RC[-10],"<-- Circular reference",IF(ISBLANK(OFFSET(R59C3,RC[-2],0)),"<-- Invalid reference",""))) -> 
A123: =R[-1]C+1 -> 64 | K123: =IF(ISBLANK(RC[-2]),"",IF(RC[-2]=RC[-10],"<-- Circular reference",IF(ISBLANK(OFFSET(R59C3,RC[-2],0)),"<-- Invalid reference",""))) -> 
A124: =R[-1]C+1 -> 65 | K124: =IF(ISBLANK(RC[-2]),"",IF(RC[-2]=RC[-10],"<-- Circular reference",IF(ISBLANK(OFFSET(R59C3,RC[-2],0)),"<-- Invalid reference",""))) -> 
A125: =R[-1]C+1 -> 66 | K125: =IF(ISBLANK(RC[-2]),"",IF(RC[-2]=RC[-10],"<-- Circular reference",IF(ISBLANK(OFFSET(R59C3,RC[-2],0)),"<-- Invalid reference",""))) -> 
A126: =R[-1]C+1 -> 67 | K126: =IF(ISBLANK(RC[-2]),"",IF(RC[-2]=RC[-10],"<-- Circular reference",IF(ISBLANK(OFFSET(R59C3,RC[-2],0)),"<-- Invalid reference",""))) -> 
A127: =R[-1]C+1 -> 68 | K127: =IF(ISBLANK(RC[-2]),"",IF(RC[-2]=RC[-10],"<-- Circular reference",IF(ISBLANK(OFFSET(R59C3,RC[-2],0)),"<-- Invalid reference",""))) -> 
A128: =R[-1]C+1 -> 69 | K128: =IF(ISBLANK(RC[-2]),"",IF(RC[-2]=RC[-10],"<-- Circular reference",IF(ISBLANK(OFFSET(R59C3,RC[-2],0)),"<-- Invalid reference",""))) -> 
A129: =R[-1]C+1 -> 70 | K129: =IF(ISBLANK(RC[-2]),"",IF(RC[-2]=RC[-10],"<-- Circular reference",IF(ISBLANK(OFFSET(R59C3,RC[-2],0)),"<-- Invalid reference",""))) -> 
A130: =R[-1]C+1 -> 71 | K130: =IF(ISBLANK(RC[-2]),"",IF(RC[-2]=RC[-10],"<-- Circular reference",IF(ISBLANK(OFFSET(R59C3,RC[-2],0)),"<-- Invalid reference",""))) -> 
A131: =R[-1]C+1 -> 72 | K131: =IF(ISBLANK(RC[-2]),"",IF(RC[-2]=RC[-10],"<-- Circular reference",IF(ISBLANK(OFFSET(R59C3,RC[-2],0)),"<-- Invalid reference",""))) -> 
A132: =R[-1]C+1 -> 73 | K132: =IF(ISBLANK(RC[-2]),"",IF(RC[-2]=RC[-10],"<-- Circular reference",IF(ISBLANK(OFFSET(R59C3,RC[-2],0)),"<-- Invalid reference",""))) -> 
A133: =R[-1]C+1 -> 74 | K133: =IF(ISBLANK(RC[-2]),"",IF(RC[-2]=RC[-10],"<-- Circular reference",IF(ISBLANK(OFFSET(R59C3,RC[-2],0)),"<-- Invalid reference",""))) -> 
A134: =R[-1]C+1 -> 75 | K134: =IF(ISBLANK(RC[-2]),"",IF(RC[-2]=RC[-10],"<-- Circular reference",IF(ISBLANK(OFFSET(R59C3,RC[-2],0)),"<-- Invalid reference",""))) -> 

Sheet: Time Log
A1: =Constants!RC -> Constants | B1: =Constants!RC ->  | C1: =Constants!RC ->  | D1: =Constants!RC ->  | E1: =Constants!RC ->  | F1: =Constants!RC -> CA02
A2: =Constants!RC -> Start date: | B2: =Constants!RC -> 36526 | C2: =Constants!RC ->  | D2: =Constants!RC -> Grades: | E2: =Constants!RC -> AA | F2: =Constants!RC -> 1
A3: =Constants!RC -> End date: | B3: =Constants!RC -> 73051 | C3: =Constants!RC ->  | D3: =Constants!RC ->  | E3: =Constants!RC -> A | F3: =Constants!RC -> 0.95
A4: =Constants!RC -> Phases: | B4: =Constants!RC -> Analysis | C4: =Constants!RC ->  | D4: =Constants!RC ->  | E4: =Constants!RC -> AB | F4: =Constants!RC -> 0.9
A5: =Constants!RC ->  | B5: =Constants!RC -> Architecture | C5: =Constants!RC ->  | D5: =Constants!RC ->  | E5: =Constants!RC -> B | F5: =Constants!RC -> 0.85
A6: =Constants!RC ->  | B6: =Constants!RC -> Project planning | C6: =Constants!RC ->  | D6: =Constants!RC ->  | E6: =Constants!RC -> BC | F6: =Constants!RC -> 0.8
A7: =Constants!RC ->  | B7: =Constants!RC -> Interation planning | C7: =Constants!RC ->  | D7: =Constants!RC ->  | E7: =Constants!RC -> C | F7: =Constants!RC -> 0.75
A8: =Constants!RC ->  | B8: =Constants!RC -> Construction | C8: =Constants!RC ->  | D8: =Constants!RC ->  | E8: =Constants!RC -> CD | F8: =Constants!RC -> 0.7
A9: =Constants!RC ->  | B9: =Constants!RC -> Refactoring | C9: =Constants!RC ->  | D9: =Constants!RC ->  | E9: =Constants!RC -> D | F9: =Constants!RC -> 0.65
A10: =Constants!RC ->  | B10: =Constants!RC -> Review | C10: =Constants!RC ->  | D10: =Constants!RC ->  | E10: =Constants!RC -> F | F10: =Constants!RC -> 0.5
A11: =Constants!RC ->  | B11: =Constants!RC -> Integration test | C11: =Constants!RC ->  | D11: =Constants!RC ->  | E11: =Constants!RC ->  | F11: =Constants!RC -> 
A12: =Constants!RC ->  | B12: =Constants!RC -> Repatterning | C12: =Constants!RC ->  | D12: =Constants!RC ->  | E12: =Constants!RC ->  | F12: =Constants!RC -> 
A13: =Constants!RC ->  | B13: =Constants!RC -> Postmortem | C13: =Constants!RC ->  | D13: =Constants!RC ->  | E13: =Constants!RC ->  | F13: =Constants!RC -> 
A14: =Constants!RC ->  | B14: =Constants!RC -> Sandbox | C14: =Constants!RC ->  | D14: =Constants!RC ->  | E14: =Constants!RC ->  | F14: =Constants!RC -> 
A15: =Constants!RC ->  | B15: =Constants!RC ->  | C15: =Constants!RC ->  | D15: =Constants!RC ->  | E15: =Constants!RC ->  | F15: =Constants!RC -> 
A16: =Constants!RC ->  | B16: =Constants!RC ->  | C16: =Constants!RC ->  | D16: =Constants!RC ->  | E16: =Constants!RC ->  | F16: =Constants!RC -> 
A17: =Constants!RC ->  | B17: =Constants!RC ->  | C17: =Constants!RC ->  | D17: =Constants!RC ->  | E17: =Constants!RC ->  | F17: =Constants!RC -> 
A18: =Constants!RC ->  | B18: =Constants!RC ->  | C18: =Constants!RC ->  | D18: =Constants!RC ->  | E18: =Constants!RC ->  | F18: =Constants!RC -> 
A19: =Constants!RC -> Defect Types: | B19: =Constants!RC -> Requirements Change | C19: =Constants!RC -> Changes to requirements | D19: =Constants!RC -> Iteration | E19: =Constants!RC -> NA | F19: =Constants!RC -> did not follow
A20: =Constants!RC ->  | B20: =Constants!RC -> Requirements Clarification | C20: =Constants!RC -> Clarifications to requirements | D20: =Constants!RC ->  | E20: =Constants!RC -> 1 | F20: =Constants!RC -> very painful
A21: =Constants!RC ->  | B21: =Constants!RC -> Product syntax | C21: =Constants!RC -> Syntax flaws in the deliverable product | D21: =Constants!RC ->  | E21: =Constants!RC -> 2 | F21: =Constants!RC -> painful
A22: =Constants!RC ->  | B22: =Constants!RC -> Product logic | C22: =Constants!RC -> Logic flaws in the deliverable product | D22: =Constants!RC ->  | E22: =Constants!RC -> 3 | F22: =Constants!RC -> neutral
A23: =Constants!RC ->  | B23: =Constants!RC -> Product interface | C23: =Constants!RC -> Flaws in the interface of a component of the deliverable product | D23: =Constants!RC ->  | E23: =Constants!RC -> 4 | F23: =Constants!RC -> helpful
A24: =Constants!RC ->  | B24: =Constants!RC -> Product checking | C24: =Constants!RC -> Flaws with boundary/type checking within a component of the deliverable product | D24: =Constants!RC ->  | E24: =Constants!RC -> 5 | F24: =Constants!RC -> very helpful
A25: =Constants!RC ->  | B25: =Constants!RC -> Test syntax | C25: =Constants!RC -> Syntax flaws in the test code | D25: =Constants!RC ->  | E25: =Constants!RC -> 6 | F25: =Constants!RC -> 
A26: =Constants!RC ->  | B26: =Constants!RC -> Test logic | C26: =Constants!RC -> Logic flaws in the test code | D26: =Constants!RC ->  | E26: =Constants!RC -> 7 | F26: =Constants!RC -> 
A27: =Constants!RC ->  | B27: =Constants!RC -> Test interface | C27: =Constants!RC -> Flaws in the interface of a component of the test code | D27: =Constants!RC ->  | E27: =Constants!RC -> 8 | F27: =Constants!RC -> 
A28: =Constants!RC ->  | B28: =Constants!RC -> Test checking | C28: =Constants!RC -> Flaws with boundary/type checking within a component of the test code | D28: =Constants!RC ->  | E28: =Constants!RC -> 9 | F28: =Constants!RC -> 
A29: =Constants!RC ->  | B29: =Constants!RC -> Bad Smell | C29: =Constants!RC -> Refactoring changes (please note the bad smell in the defect description) | D29: =Constants!RC ->  | E29: =Constants!RC -> 10 | F29: =Constants!RC -> 0
A30: =Constants!RC -> Y/N: | B30: =Constants!RC -> Yes | C30: =Constants!RC ->  | D30: =Constants!RC ->  | E30: =Constants!RC -> Passed | F30: =Constants!RC -> 0
A31: =Constants!RC ->  | B31: =Constants!RC -> No | C31: =Constants!RC ->  | D31: =Constants!RC ->  | E31: =Constants!RC -> Passed with issues | F31: =Constants!RC -> 0
A32: =Constants!RC -> Proxy Types: | B32: =Constants!RC -> - | C32: =Constants!RC ->  | D32: =Constants!RC ->  | E32: =Constants!RC -> Failed | F32: =Constants!RC -> 
A33: =Constants!RC ->  | B33: =Constants!RC -> Calculation | C33: =Constants!RC ->  | D33: =Constants!RC ->  | E33: =Constants!RC -> Not tested | F33: =Constants!RC -> 
A34: =Constants!RC ->  | B34: =Constants!RC -> Data | C34: =Constants!RC ->  | D34: =Constants!RC ->  | E34: =Constants!RC -> Not applicable | F34: =Constants!RC -> 
A35: =Constants!RC ->  | B35: =Constants!RC -> I/O | C35: =Constants!RC ->  | D35: =Constants!RC ->  | E35: =Constants!RC ->  | F35: =Constants!RC -> 
A36: =Constants!RC ->  | B36: =Constants!RC -> Logic | C36: =Constants!RC ->  | D36: =Constants!RC ->  | E36: =Constants!RC ->  | F36: =Constants!RC -> 
A37: =Constants!RC ->  | B37: =Constants!RC ->  | C37: =Constants!RC ->  | D37: =Constants!RC ->  | E37: =Constants!RC ->  | F37: =Constants!RC -> 
A38: =Constants!RC -> Sizes: | B38: =Constants!RC -> VS | C38: =Constants!RC -> S | D38: =Constants!RC -> M | E38: =Constants!RC -> L | F38: =Constants!RC -> VL
A39: =Constants!RC -> upper | B39: =Constants!RC -> -1.5 | C39: =Constants!RC -> -0.5 | D39: =Constants!RC -> 0.5 | E39: =Constants!RC -> 1.5 | F39: =Constants!RC -> 99999
A40: =Constants!RC -> mid | B40: =Constants!RC -> -2 | C40: =Constants!RC -> -1 | D40: =Constants!RC -> 0 | E40: =Constants!RC -> 1 | F40: =Constants!RC -> 2
A41: =Constants!RC -> lower | B41: =Constants!RC -> 0 | C41: =Constants!RC -> -1.5 | D41: =Constants!RC -> -0.5 | E41: =Constants!RC -> 0.5 | F41: =Constants!RC -> 1.5
A42: =Constants!RC ->  | B42: =Constants!RC -> 0 | C42: =Constants!RC -> 0 | D42: =Constants!RC -> 0 | E42: =Constants!RC -> 0 | F42: =Constants!RC -> 
A43: =Constants!RC ->  | B43: =Constants!RC ->  | C43: =Constants!RC ->  | D43: =Constants!RC ->  | E43: =Constants!RC ->  | F43: =Constants!RC -> 
A44: =Constants!RC -> <-- Mandatory | B44: =Constants!RC ->  | C44: =Constants!RC -> ✔ | D44: =Constants!RC ->  | E44: =Constants!RC ->  | F44: =Constants!RC -> 
A45: Time Recording Log
A46: Use this worksheet to record the amount of time you spend on each activity. Use the "sandbox" activity to record time spent experimenting with the assignment requirements..
A47: Date | B47: Start Time | C47: Stop Time | D47: Interrupt | E47: Delta | F47: Activity | G47: Iteration | H47: Comments
A48: Feb 19 2017 | B48: 1899-12-31T08:00:00.000 | C48: 1899-12-31T08:30:00.000 | E48: =IF(OR(ISBLANK(RC[-3]),ISBLANK(RC[-2])),"",(RC[-2]-RC[-3])*24*60-RC[-1]) -> 30.000000000000053 | F48: Analysis | I48: =IF(RC[-4]<0,"<-- Invalid stop time","") -> 
A49: Feb 19 2017 | B49: 1899-12-31T08:30:00.000 | C49: 1899-12-31T08:40:00.000 | E49: =IF(OR(ISBLANK(RC[-3]),ISBLANK(RC[-2])),"",(RC[-2]-RC[-3])*24*60-RC[-1]) -> 9.9999999999999645 | F49: Architecture | I49: =IF(RC[-4]<0,"<-- Invalid stop time","") -> 
A50: Feb 19 2017 | B50: 1899-12-31T08:40:00.000 | C50: 1899-12-31T08:50:00.000 | E50: =IF(OR(ISBLANK(RC[-3]),ISBLANK(RC[-2])),"",(RC[-2]-RC[-3])*24*60-RC[-1]) -> 10.000000000000044 | F50: Project planning | I50: =IF(RC[-4]<0,"<-- Invalid stop time","") -> 
A51: Feb 19 2017 | B51: 1899-12-31T08:50:00.000 | C51: 1899-12-31T09:05:00.000 | E51: =IF(OR(ISBLANK(RC[-3]),ISBLANK(RC[-2])),"",(RC[-2]-RC[-3])*24*60-RC[-1]) -> 15.000000000000027 | F51: Interation planning | I51: =IF(RC[-4]<0,"<-- Invalid stop time","") -> 
A52: Feb 19 2017 | B52: 1899-12-31T10:00:00.000 | C52: 1899-12-31T14:00:00.000 | D52: 30 | E52: =IF(OR(ISBLANK(RC[-3]),ISBLANK(RC[-2])),"",(RC[-2]-RC[-3])*24*60-RC[-1]) -> 210 | F52: Construction | I52: =IF(RC[-4]<0,"<-- Invalid stop time","") -> 
A53: Feb 20 2017 | B53: 1899-12-31T07:30:00.000 | C53: 1899-12-31T08:00:00.000 | E53: =IF(OR(ISBLANK(RC[-3]),ISBLANK(RC[-2])),"",(RC[-2]-RC[-3])*24*60-RC[-1]) -> 29.999999999999972 | F53: Review | I53: =IF(RC[-4]<0,"<-- Invalid stop time","") -> 
E54: =IF(OR(ISBLANK(RC[-3]),ISBLANK(RC[-2])),"",(RC[-2]-RC[-3])*24*60-RC[-1]) ->  | I54: =IF(RC[-4]<0,"<-- Invalid stop time","") -> 
E55: =IF(OR(ISBLANK(RC[-3]),ISBLANK(RC[-2])),"",(RC[-2]-RC[-3])*24*60-RC[-1]) ->  | I55: =IF(RC[-4]<0,"<-- Invalid stop time","") -> 
E56: =IF(OR(ISBLANK(RC[-3]),ISBLANK(RC[-2])),"",(RC[-2]-RC[-3])*24*60-RC[-1]) ->  | I56: =IF(RC[-4]<0,"<-- Invalid stop time","") -> 
E57: =IF(OR(ISBLANK(RC[-3]),ISBLANK(RC[-2])),"",(RC[-2]-RC[-3])*24*60-RC[-1]) ->  | I57: =IF(RC[-4]<0,"<-- Invalid stop time","") -> 
E58: =IF(OR(ISBLANK(RC[-3]),ISBLANK(RC[-2])),"",(RC[-2]-RC[-3])*24*60-RC[-1]) ->  | I58: =IF(RC[-4]<0,"<-- Invalid stop time","") -> 
E59: =IF(OR(ISBLANK(RC[-3]),ISBLANK(RC[-2])),"",(RC[-2]-RC[-3])*24*60-RC[-1]) ->  | I59: =IF(RC[-4]<0,"<-- Invalid stop time","") -> 
E60: =IF(OR(ISBLANK(RC[-3]),ISBLANK(RC[-2])),"",(RC[-2]-RC[-3])*24*60-RC[-1]) ->  | I60: =IF(RC[-4]<0,"<-- Invalid stop time","") -> 
E61: =IF(OR(ISBLANK(RC[-3]),ISBLANK(RC[-2])),"",(RC[-2]-RC[-3])*24*60-RC[-1]) ->  | I61: =IF(RC[-4]<0,"<-- Invalid stop time","") -> 
E62: =IF(OR(ISBLANK(RC[-3]),ISBLANK(RC[-2])),"",(RC[-2]-RC[-3])*24*60-RC[-1]) ->  | I62: =IF(RC[-4]<0,"<-- Invalid stop time","") -> 
E63: =IF(OR(ISBLANK(RC[-3]),ISBLANK(RC[-2])),"",(RC[-2]-RC[-3])*24*60-RC[-1]) ->  | I63: =IF(RC[-4]<0,"<-- Invalid stop time","") -> 
E64: =IF(OR(ISBLANK(RC[-3]),ISBLANK(RC[-2])),"",(RC[-2]-RC[-3])*24*60-RC[-1]) ->  | I64: =IF(RC[-4]<0,"<-- Invalid stop time","") -> 
E65: =IF(OR(ISBLANK(RC[-3]),ISBLANK(RC[-2])),"",(RC[-2]-RC[-3])*24*60-RC[-1]) ->  | I65: =IF(RC[-4]<0,"<-- Invalid stop time","") -> 
E66: =IF(OR(ISBLANK(RC[-3]),ISBLANK(RC[-2])),"",(RC[-2]-RC[-3])*24*60-RC[-1]) ->  | I66: =IF(RC[-4]<0,"<-- Invalid stop time","") -> 
E67: =IF(OR(ISBLANK(RC[-3]),ISBLANK(RC[-2])),"",(RC[-2]-RC[-3])*24*60-RC[-1]) ->  | I67: =IF(RC[-4]<0,"<-- Invalid stop time","") -> 
E68: =IF(OR(ISBLANK(RC[-3]),ISBLANK(RC[-2])),"",(RC[-2]-RC[-3])*24*60-RC[-1]) ->  | I68: =IF(RC[-4]<0,"<-- Invalid stop time","") -> 
E69: =IF(OR(ISBLANK(RC[-3]),ISBLANK(RC[-2])),"",(RC[-2]-RC[-3])*24*60-RC[-1]) ->  | I69: =IF(RC[-4]<0,"<-- Invalid stop time","") -> 
E70: =IF(OR(ISBLANK(RC[-3]),ISBLANK(RC[-2])),"",(RC[-2]-RC[-3])*24*60-RC[-1]) ->  | I70: =IF(RC[-4]<0,"<-- Invalid stop time","") -> 
E71: =IF(OR(ISBLANK(RC[-3]),ISBLANK(RC[-2])),"",(RC[-2]-RC[-3])*24*60-RC[-1]) ->  | I71: =IF(RC[-4]<0,"<-- Invalid stop time","") -> 
E72: =IF(OR(ISBLANK(RC[-3]),ISBLANK(RC[-2])),"",(RC[-2]-RC[-3])*24*60-RC[-1]) ->  | I72: =IF(RC[-4]<0,"<-- Invalid stop time","") -> 
E73: =IF(OR(ISBLANK(RC[-3]),ISBLANK(RC[-2])),"",(RC[-2]-RC[-3])*24*60-RC[-1]) ->  | I73: =IF(RC[-4]<0,"<-- Invalid stop time","") -> 
E74: =IF(OR(ISBLANK(RC[-3]),ISBLANK(RC[-2])),"",(RC[-2]-RC[-3])*24*60-RC[-1]) ->  | I74: =IF(RC[-4]<0,"<-- Invalid stop time","") -> 
E75: =IF(OR(ISBLANK(RC[-3]),ISBLANK(RC[-2])),"",(RC[-2]-RC[-3])*24*60-RC[-1]) ->  | I75: =IF(RC[-4]<0,"<-- Invalid stop time","") -> 
E76: =IF(OR(ISBLANK(RC[-3]),ISBLANK(RC[-2])),"",(RC[-2]-RC[-3])*24*60-RC[-1]) ->  | I76: =IF(RC[-4]<0,"<-- Invalid stop time","") -> 
E77: =IF(OR(ISBLANK(RC[-3]),ISBLANK(RC[-2])),"",(RC[-2]-RC[-3])*24*60-RC[-1]) ->  | I77: =IF(RC[-4]<0,"<-- Invalid stop time","") -> 
E78: =IF(OR(ISBLANK(RC[-3]),ISBLANK(RC[-2])),"",(RC[-2]-RC[-3])*24*60-RC[-1]) ->  | I78: =IF(RC[-4]<0,"<-- Invalid stop time","") -> 
E79: =IF(OR(ISBLANK(RC[-3]),ISBLANK(RC[-2])),"",(RC[-2]-RC[-3])*24*60-RC[-1]) ->  | I79: =IF(RC[-4]<0,"<-- Invalid stop time","") -> 
E80: =IF(OR(ISBLANK(RC[-3]),ISBLANK(RC[-2])),"",(RC[-2]-RC[-3])*24*60-RC[-1]) ->  | I80: =IF(RC[-4]<0,"<-- Invalid stop time","") -> 
E81: =IF(OR(ISBLANK(RC[-3]),ISBLANK(RC[-2])),"",(RC[-2]-RC[-3])*24*60-RC[-1]) ->  | I81: =IF(RC[-4]<0,"<-- Invalid stop time","") -> 
E82: =IF(OR(ISBLANK(RC[-3]),ISBLANK(RC[-2])),"",(RC[-2]-RC[-3])*24*60-RC[-1]) ->  | I82: =IF(RC[-4]<0,"<-- Invalid stop time","") -> 
E83: =IF(OR(ISBLANK(RC[-3]),ISBLANK(RC[-2])),"",(RC[-2]-RC[-3])*24*60-RC[-1]) ->  | I83: =IF(RC[-4]<0,"<-- Invalid stop time","") -> 
E84: =IF(OR(ISBLANK(RC[-3]),ISBLANK(RC[-2])),"",(RC[-2]-RC[-3])*24*60-RC[-1]) ->  | I84: =IF(RC[-4]<0,"<-- Invalid stop time","") -> 
E85: =IF(OR(ISBLANK(RC[-3]),ISBLANK(RC[-2])),"",(RC[-2]-RC[-3])*24*60-RC[-1]) ->  | I85: =IF(RC[-4]<0,"<-- Invalid stop time","") -> 
E86: =IF(OR(ISBLANK(RC[-3]),ISBLANK(RC[-2])),"",(RC[-2]-RC[-3])*24*60-RC[-1]) ->  | I86: =IF(RC[-4]<0,"<-- Invalid stop time","") -> 
E87: =IF(OR(ISBLANK(RC[-3]),ISBLANK(RC[-2])),"",(RC[-2]-RC[-3])*24*60-RC[-1]) ->  | I87: =IF(RC[-4]<0,"<-- Invalid stop time","") -> 
E88: =IF(OR(ISBLANK(RC[-3]),ISBLANK(RC[-2])),"",(RC[-2]-RC[-3])*24*60-RC[-1]) ->  | I88: =IF(RC[-4]<0,"<-- Invalid stop time","") -> 
E89: =IF(OR(ISBLANK(RC[-3]),ISBLANK(RC[-2])),"",(RC[-2]-RC[-3])*24*60-RC[-1]) ->  | I89: =IF(RC[-4]<0,"<-- Invalid stop time","") -> 
E90: =IF(OR(ISBLANK(RC[-3]),ISBLANK(RC[-2])),"",(RC[-2]-RC[-3])*24*60-RC[-1]) ->  | I90: =IF(RC[-4]<0,"<-- Invalid stop time","") -> 
E91: =IF(OR(ISBLANK(RC[-3]),ISBLANK(RC[-2])),"",(RC[-2]-RC[-3])*24*60-RC[-1]) ->  | I91: =IF(RC[-4]<0,"<-- Invalid stop time","") -> 
E92: =IF(OR(ISBLANK(RC[-3]),ISBLANK(RC[-2])),"",(RC[-2]-RC[-3])*24*60-RC[-1]) ->  | I92: =IF(RC[-4]<0,"<-- Invalid stop time","") -> 
E93: =IF(OR(ISBLANK(RC[-3]),ISBLANK(RC[-2])),"",(RC[-2]-RC[-3])*24*60-RC[-1]) ->  | I93: =IF(RC[-4]<0,"<-- Invalid stop time","") -> 
E94: =IF(OR(ISBLANK(RC[-3]),ISBLANK(RC[-2])),"",(RC[-2]-RC[-3])*24*60-RC[-1]) ->  | I94: =IF(RC[-4]<0,"<-- Invalid stop time","") -> 
E95: =IF(OR(ISBLANK(RC[-3]),ISBLANK(RC[-2])),"",(RC[-2]-RC[-3])*24*60-RC[-1]) ->  | I95: =IF(RC[-4]<0,"<-- Invalid stop time","") -> 
E96: =IF(OR(ISBLANK(RC[-3]),ISBLANK(RC[-2])),"",(RC[-2]-RC[-3])*24*60-RC[-1]) ->  | I96: =IF(RC[-4]<0,"<-- Invalid stop time","") -> 
E97: =IF(OR(ISBLANK(RC[-3]),ISBLANK(RC[-2])),"",(RC[-2]-RC[-3])*24*60-RC[-1]) ->  | I97: =IF(RC[-4]<0,"<-- Invalid stop time","") -> 
E98: =IF(OR(ISBLANK(RC[-3]),ISBLANK(RC[-2])),"",(RC[-2]-RC[-3])*24*60-RC[-1]) ->  | I98: =IF(RC[-4]<0,"<-- Invalid stop time","") -> 
E99: =IF(OR(ISBLANK(RC[-3]),ISBLANK(RC[-2])),"",(RC[-2]-RC[-3])*24*60-RC[-1]) ->  | I99: =IF(RC[-4]<0,"<-- Invalid stop time","") -> 
E100: =IF(OR(ISBLANK(RC[-3]),ISBLANK(RC[-2])),"",(RC[-2]-RC[-3])*24*60-RC[-1]) ->  | I100: =IF(RC[-4]<0,"<-- Invalid stop time","") -> 
E101: =IF(OR(ISBLANK(RC[-3]),ISBLANK(RC[-2])),"",(RC[-2]-RC[-3])*24*60-RC[-1]) ->  | I101: =IF(RC[-4]<0,"<-- Invalid stop time","") -> 
E102: =IF(OR(ISBLANK(RC[-3]),ISBLANK(RC[-2])),"",(RC[-2]-RC[-3])*24*60-RC[-1]) ->  | I102: =IF(RC[-4]<0,"<-- Invalid stop time","") -> 
E103: =IF(OR(ISBLANK(RC[-3]),ISBLANK(RC[-2])),"",(RC[-2]-RC[-3])*24*60-RC[-1]) ->  | I103: =IF(RC[-4]<0,"<-- Invalid stop time","") -> 
E104: =IF(OR(ISBLANK(RC[-3]),ISBLANK(RC[-2])),"",(RC[-2]-RC[-3])*24*60-RC[-1]) ->  | I104: =IF(RC[-4]<0,"<-- Invalid stop time","") -> 
E105: =IF(OR(ISBLANK(RC[-3]),ISBLANK(RC[-2])),"",(RC[-2]-RC[-3])*24*60-RC[-1]) ->  | I105: =IF(RC[-4]<0,"<-- Invalid stop time","") -> 
E106: =IF(OR(ISBLANK(RC[-3]),ISBLANK(RC[-2])),"",(RC[-2]-RC[-3])*24*60-RC[-1]) ->  | I106: =IF(RC[-4]<0,"<-- Invalid stop time","") -> 
E107: =IF(OR(ISBLANK(RC[-3]),ISBLANK(RC[-2])),"",(RC[-2]-RC[-3])*24*60-RC[-1]) ->  | I107: =IF(RC[-4]<0,"<-- Invalid stop time","") -> 
E108: =IF(OR(ISBLANK(RC[-3]),ISBLANK(RC[-2])),"",(RC[-2]-RC[-3])*24*60-RC[-1]) ->  | I108: =IF(RC[-4]<0,"<-- Invalid stop time","") -> 
E109: =IF(OR(ISBLANK(RC[-3]),ISBLANK(RC[-2])),"",(RC[-2]-RC[-3])*24*60-RC[-1]) ->  | I109: =IF(RC[-4]<0,"<-- Invalid stop time","") -> 
E110: =IF(OR(ISBLANK(RC[-3]),ISBLANK(RC[-2])),"",(RC[-2]-RC[-3])*24*60-RC[-1]) ->  | I110: =IF(RC[-4]<0,"<-- Invalid stop time","") -> 
E111: =IF(OR(ISBLANK(RC[-3]),ISBLANK(RC[-2])),"",(RC[-2]-RC[-3])*24*60-RC[-1]) ->  | I111: =IF(RC[-4]<0,"<-- Invalid stop time","") -> 
E112: =IF(OR(ISBLANK(RC[-3]),ISBLANK(RC[-2])),"",(RC[-2]-RC[-3])*24*60-RC[-1]) ->  | I112: =IF(RC[-4]<0,"<-- Invalid stop time","") -> 
E113: =IF(OR(ISBLANK(RC[-3]),ISBLANK(RC[-2])),"",(RC[-2]-RC[-3])*24*60-RC[-1]) ->  | I113: =IF(RC[-4]<0,"<-- Invalid stop time","") -> 
E114: =IF(OR(ISBLANK(RC[-3]),ISBLANK(RC[-2])),"",(RC[-2]-RC[-3])*24*60-RC[-1]) ->  | I114: =IF(RC[-4]<0,"<-- Invalid stop time","") -> 
E115: =IF(OR(ISBLANK(RC[-3]),ISBLANK(RC[-2])),"",(RC[-2]-RC[-3])*24*60-RC[-1]) ->  | I115: =IF(RC[-4]<0,"<-- Invalid stop time","") -> 
E116: =IF(OR(ISBLANK(RC[-3]),ISBLANK(RC[-2])),"",(RC[-2]-RC[-3])*24*60-RC[-1]) ->  | I116: =IF(RC[-4]<0,"<-- Invalid stop time","") -> 
E117: =IF(OR(ISBLANK(RC[-3]),ISBLANK(RC[-2])),"",(RC[-2]-RC[-3])*24*60-RC[-1]) ->  | I117: =IF(RC[-4]<0,"<-- Invalid stop time","") -> 
E118: =IF(OR(ISBLANK(RC[-3]),ISBLANK(RC[-2])),"",(RC[-2]-RC[-3])*24*60-RC[-1]) ->  | I118: =IF(RC[-4]<0,"<-- Invalid stop time","") -> 
E119: =IF(OR(ISBLANK(RC[-3]),ISBLANK(RC[-2])),"",(RC[-2]-RC[-3])*24*60-RC[-1]) ->  | I119: =IF(RC[-4]<0,"<-- Invalid stop time","") -> 
E120: =IF(OR(ISBLANK(RC[-3]),ISBLANK(RC[-2])),"",(RC[-2]-RC[-3])*24*60-RC[-1]) ->  | I120: =IF(RC[-4]<0,"<-- Invalid stop time","") -> 
E121: =IF(OR(ISBLANK(RC[-3]),ISBLANK(RC[-2])),"",(RC[-2]-RC[-3])*24*60-RC[-1]) ->  | I121: =IF(RC[-4]<0,"<-- Invalid stop time","") -> 
E122: =IF(OR(ISBLANK(RC[-3]),ISBLANK(RC[-2])),"",(RC[-2]-RC[-3])*24*60-RC[-1]) ->  | I122: =IF(RC[-4]<0,"<-- Invalid stop time","") -> 
E123: =IF(OR(ISBLANK(RC[-3]),ISBLANK(RC[-2])),"",(RC[-2]-RC[-3])*24*60-RC[-1]) ->  | I123: =IF(RC[-4]<0,"<-- Invalid stop time","") -> 
E124: =IF(OR(ISBLANK(RC[-3]),ISBLANK(RC[-2])),"",(RC[-2]-RC[-3])*24*60-RC[-1]) ->  | I124: =IF(RC[-4]<0,"<-- Invalid stop time","") -> 
E125: =IF(OR(ISBLANK(RC[-3]),ISBLANK(RC[-2])),"",(RC[-2]-RC[-3])*24*60-RC[-1]) ->  | I125: =IF(RC[-4]<0,"<-- Invalid stop time","") -> 
E126: =IF(OR(ISBLANK(RC[-3]),ISBLANK(RC[-2])),"",(RC[-2]-RC[-3])*24*60-RC[-1]) ->  | I126: =IF(RC[-4]<0,"<-- Invalid stop time","") -> 
E127: =IF(OR(ISBLANK(RC[-3]),ISBLANK(RC[-2])),"",(RC[-2]-RC[-3])*24*60-RC[-1]) ->  | I127: =IF(RC[-4]<0,"<-- Invalid stop time","") -> 
E128: =IF(OR(ISBLANK(RC[-3]),ISBLANK(RC[-2])),"",(RC[-2]-RC[-3])*24*60-RC[-1]) ->  | I128: =IF(RC[-4]<0,"<-- Invalid stop time","") -> 
E129: =IF(OR(ISBLANK(RC[-3]),ISBLANK(RC[-2])),"",(RC[-2]-RC[-3])*24*60-RC[-1]) ->  | I129: =IF(RC[-4]<0,"<-- Invalid stop time","") -> 
E130: =IF(OR(ISBLANK(RC[-3]),ISBLANK(RC[-2])),"",(RC[-2]-RC[-3])*24*60-RC[-1]) ->  | I130: =IF(RC[-4]<0,"<-- Invalid stop time","") -> 
E131: =IF(OR(ISBLANK(RC[-3]),ISBLANK(RC[-2])),"",(RC[-2]-RC[-3])*24*60-RC[-1]) ->  | I131: =IF(RC[-4]<0,"<-- Invalid stop time","") -> 
E132: =IF(OR(ISBLANK(RC[-3]),ISBLANK(RC[-2])),"",(RC[-2]-RC[-3])*24*60-RC[-1]) ->  | I132: =IF(RC[-4]<0,"<-- Invalid stop time","") -> 
E133: =IF(OR(ISBLANK(RC[-3]),ISBLANK(RC[-2])),"",(RC[-2]-RC[-3])*24*60-RC[-1]) ->  | I133: =IF(RC[-4]<0,"<-- Invalid stop time","") -> 
E134: =IF(OR(ISBLANK(RC[-3]),ISBLANK(RC[-2])),"",(RC[-2]-RC[-3])*24*60-RC[-1]) ->  | I134: =IF(RC[-4]<0,"<-- Invalid stop time","") -> 
E135: =IF(OR(ISBLANK(RC[-3]),ISBLANK(RC[-2])),"",(RC[-2]-RC[-3])*24*60-RC[-1]) ->  | I135: =IF(RC[-4]<0,"<-- Invalid stop time","") -> 
E136: =IF(OR(ISBLANK(RC[-3]),ISBLANK(RC[-2])),"",(RC[-2]-RC[-3])*24*60-RC[-1]) ->  | I136: =IF(RC[-4]<0,"<-- Invalid stop time","") -> 
E137: =IF(OR(ISBLANK(RC[-3]),ISBLANK(RC[-2])),"",(RC[-2]-RC[-3])*24*60-RC[-1]) ->  | I137: =IF(RC[-4]<0,"<-- Invalid stop time","") -> 

Sheet: Lessons
A1: Lessons Learned
A3: Problems of Importance
A4: 1
A5: 2
A6: 3
A7: 4
A8: 5
A9: Proposal for Improvements
A10: 1
A11: 2
A12: 3
A13: 4
A14: 5
A15: Notes and Comments
A16: 1
A17: 2
A18: 3
A19: 4
A20: 5

Sheet: Source
A1: Source Code
A2: Paste production source code here. (1) copy your code to the clipboard, (2) click on the "PASTE ME" cell (not the entire row), (3) paste. Do not paste test code.
A3: PASTE ME

Sheet: Constants
A1: Constants | F1: =Description!R[2]C[-4] -> CA02
A2: Start date: | B2: 2000-01-01T00:00:00.000 | D2: Grades: | E2: AA | F2: 1
A3: End date: | B3: 2100-01-01T00:00:00.000 | E3: A | F3: 0.95
A4: Phases: | B4: Analysis | E4: AB | F4: 0.9
B5: Architecture | E5: B | F5: 0.85
B6: Project planning | E6: BC | F6: 0.8
B7: Interation planning | E7: C | F7: 0.75
B8: Construction | E8: CD | F8: 0.7
B9: Refactoring | E9: D | F9: 0.65
B10: Review | E10: F | F10: 0.5
B11: Integration test
B12: Repatterning
B13: Postmortem
B14: Sandbox
A19: Defect Types: | B19: Requirements Change | C19: Changes to requirements | D19: Iteration | E19: NA | F19: did not follow
B20: Requirements Clarification | C20: Clarifications to requirements | E20: 1 | F20: very painful
B21: Product syntax | C21: Syntax flaws in the deliverable product | E21: 2 | F21: painful
B22: Product logic | C22: Logic flaws in the deliverable product | E22: 3 | F22: neutral
B23: Product interface | C23: Flaws in the interface of a component of the deliverable product | E23: 4 | F23: helpful
B24: Product checking | C24: Flaws with boundary/type checking within a component of the deliverable product | E24: 5 | F24: very helpful
B25: Test syntax | C25: Syntax flaws in the test code | E25: 6
B26: Test logic | C26: Logic flaws in the test code | E26: 7
B27: Test interface | C27: Flaws in the interface of a component of the test code | E27: 8
B28: Test checking | C28: Flaws with boundary/type checking within a component of the test code | E28: 9
B29: Bad Smell | C29: Refactoring changes (please note the bad smell in the defect description) | E29: 10
A30: Y/N: | B30: Yes | E30: Passed
B31: No | E31: Passed with issues
A32: Proxy Types: | B32: - | E32: Failed
B33: Calculation | E33: Not tested
B34: Data | E34: Not applicable
B35: I/O
B36: Logic
A38: Sizes: | B38: VS | C38: S | D38: M | E38: L | F38: VL
A39: upper | B39: =RC[1]-1 -> -1.5 | C39: =RC[1]-1 -> -0.5 | D39: =RC[1]-1 -> 0.5 | E39: =R[2]C[1] -> 1.5 | F39: 99999
A40: mid | B40: =RC[1]-1 -> -2 | C40: =RC[1]-1 -> -1 | D40: =RC[1]-1 -> 0 | E40: =RC[1]-1 -> 1 | F40: 2
A41: lower | B41: 0 | C41: =RC[1]-1 -> -1.5 | D41: =RC[1]-1 -> -0.5 | E41: =RC[1]-1 -> 0.5 | F41: =R[-1]C-0.5 -> 1.5
A44: <-- Mandatory | C44: ✔